;90;"МАЙСКИЙ чай Смородина с Мятой черный ароматизированный чай в сашетах 25 шт";120190
;90;"МОЙ МАЛЫШ Мыло жидкое Классическое 300 г";720072
;90;"НАЦИОНАЛЬ фасоль Белая 450 г";150095
;90;"ЧИСТЮЛЯ Губки поролоновые с абразивом БИСКВИТ 3 шт";250033
;91;"7 DAYS круассан ваниль 4 шт";140093
;91;"7 DAYS круассан вареная сгущенка 4 шт";140095
;91;"7 DAYS круассан какао 4 шт";140089
;91;"7 DAYS круассан крем фундук 4 шт";140091
;91;"AQUA FRUIT гель для душа Active Цитрусовый микс 420 мл";380134
;91;"AQUA FRUIT Гель для душа Energy 420 мл";330216
;91;"AQUA FRUIT Гель для душа Fresh 420 мл";330214
;91;"AQUA FRUIT Гель для душа Sensitive 420 мл";330217
;91;"AQUA FRUIT Гель для душа Soft 420 мл";330215
;91;"AURA ватные диски Beauty Cotton Pads 150 шт";360023
;91;"BRADEX блокиратор гибкий мебельный розовый 2 шт";790014
;91;"CIF чистящий крем Active Fresh 250 мл";430349
;91;"CIF чистящий крем Active Лимон 250 мл";430351
;91;"EVEREADY батарейка SuperHD 9V 1 шт";240088
;91;"MILKA молочный шоколад Елочка 100 г";140252
;91;"NIVEA крем-мыло Питание и Забота 100 г";330567
;91;"NIVEA крем-мыло Увлажнение и Забота 100 г";330566
;91;"NUK пустышка латексная ортодонтическая Rose & Blue (6-18 месяцев) розовая 1 шт";780189
;91;"ORAL-B Зубная щетка 3-Effect Натуральная Свежесть  средняя";380193
;91;"ORAL-B Зубная щетка 3-Effect Натуральная Свежесть  средняя 1+1 шт";380196
;91;"ORAL-B Зубная щетка 3-Effect Натуральная Свежесть средняя";310198
;91;"ORAL-B Зубная щетка 3-Effect Натуральная Свежесть средняя 1+1 шт";310195
;91;"ORGANIC SHOP гоммаж для лица утренний кофе 75 мл";530160
;91;"PEDIGREE лакомство Denta Stix дл собак средних пород 77 г";620363
;91;"RAINBOW BEAUTYмаска-сыворотка для лица с Улиточным Муцином 25 мл";530354
;91;"ROYAL CANIN влажный корм Urban Life Adult для собак живущих в городских условиях 150 г";620386
;91;"КОСТРОВОК маринад для Курицы с чесноком и травами 300 г";170168
;91;"КУБАНОЧКА огурцы маринованые 9-11 см 680 мл";160034
;91;"ПРЕЛЕСТЬ лак для укладки волос Сильная Фиксация 160 мл";520602
;92;"BELVITA печенье Утреннее Медовое с орехами 225 г";140134
;92;"BELVITA печенье Утреннее Мульти-злаковое 225 г";140135
;92;"BELVITA печенье Утреннее С какао 225 г";140136
;92;"BRIT Care влажный корм для котят Ягненок 340 г";610042
;92;"CJ LION мыло-пятновыводитель для детских вещей Baby Safe с Экстрактом Акации 190 г";410188
;92;"EVEREADY батарейки SuperHD AA 4 шт";240093
;92;"EVEREADY батарейки SuperHD AAA 4 шт";240094
;92;"LORADO грибы маринованные Опята 314 мл";160045
;92;"MILKA шоколад молочный Dark с малиной 85 г";140260
;92;"MR PROPER Моющий порошок для уборки Универсальный с отбеливателем 400 г";430395
;92;"NUTELLA шоколадная паста &Go + хлебные палочки 54 г";140270
;92;"ORGANIC SHOP крем для рук Organic Kitchen питательный акуна банана 100 мл";540070
;92;"ZEWA туалетная бумага Плюс 2 слоя 4 шт";360218
;92;"ZEWA туалетная бумага Плюс Ромашка 2 слоя 4 шт";360221
;92;"ZEWA туалетная бумага Плюс Свежесть Океана 2 слоя 4 шт";360219
;92;"ZEWA туалетная бумага Плюс Сирень 2 слоя 4 шт";360222
;92;"БАРХАТНЫЕ РУЧКИ крем для рук Гипоаллергенный 80 мл";540031
;92;"БАРХАТНЫЕ РУЧКИ крем для рук Ночной Восстанавливающий 80 мл";540036
;92;"БАРХАТНЫЕ РУЧКИ крем для рук Райское Масло Бабассу 30 мл";540041
;92;"БАРХАТНЫЕ РУЧКИ крем для рук Регенерирующий 80 мл";560176
;92;"БАРХАТНЫЕ РУЧКИ крем для рук Смягчающий 80 мл";540044
;92;"БАРХАТНЫЕ РУЧКИ крем для рук Сокровище Бурити 30 мл";540045
;92;"БАРХАТНЫЕ РУЧКИ крем для рук Тайна Цветов Моринги 30 мл";540046
;92;"ДОННА РОЗА фольга для запекания и упаковки 10 м";220031
;92;"ПРЕЛЕСТЬ мусс для укладки волос сильной фиксации 160 мл";520619
;92;"СОЛНЦЕ И ЛУНА влажные салфетки детские с экстрактом алоэ 63 шт";360131
;92;"СОЛНЦЕ И ЛУНА влажные салфетки Для Детей с экстрактом алоэ 63 шт";360121
;92;"СОЛНЦЕ И ЛУНА влажные салфетки для детей Фитолиния с отваром череды и облепихи с крышкой 56 шт";380166
;92;"СОЛНЦЕ И ЛУНА влажные салфетки Нежное Прикосновение для детей 54 шт";360126
;92;"ЧИСТАЯ ЛИНИЯ бальзам-ополаскиватель Укрепляющий крапива для всех типов волос 230 мл";520032
;93;"CETTUA маска для лица Антивозрастная 1 шт";530273
;93;"КОСТРОВОК маринад для Барбекю 300 г";170166
;93;"КОСТРОВОК маринад для Мяса брусничный 300 г";170169
;94;"BRIT Care влажный корм для кошек Мясное Ассорти с Печенью 340 г";610039
;94;"DOMESTOS туалетный блок 3 в 1 Лимон 1 шт";460282
;94;"HARRYS хлеб нарезка American Sandwich пшеничный 470 г";180011
;94;"HEINZ кетчуп для гриля и шашлыка 350 г";170060
;94;"HEINZ кетчуп Для стейка 0,35 кг";170339
;94;"HEINZ кетчуп Итальянский 350 г";170062
;94;"HEINZ кетчуп Острый 350 г";170064
;94;"HEINZ кетчуп с Горчицей 350 г";170066
;94;"HEINZ кетчуп с чесноком пряностями 350 г";170065
;94;"HEINZ кетчуп Супер Острый 350 г";170067
;94;"HEINZ кетчуп Томатный 0,35 кг";180040
;94;"HILLS влажный корм Science Plan Sterilised Young Adult для кошек с курицей 85 г";610118
;94;"LINDA PROFESSIONAL гель-пилинг для душа Vitamix гиалуроновый 300 мл";330178
;94;"PRO PLAN VET DIETS влажный корм для собак Kidney Function 400 г";620095
;94;"SHEBA влажный корм для кошек Ассорти из курицы и утки 80 г";610370
;94;"SHEBA влажный корм для кошек Соте из куриных грудок 80 г";610371
;94;"ГЛАВКОФЕ кофе растворимый Арабика 80 г";170308
;94;"КУБАНОЧКА масло подсолнечное нерафинированное 1 л";150295
;94;"МАКFА мука для макаронныйх изделий 1 кг";150248
;94;"МОЕ СОЛНЫШКО гель для подмывания младенцев с календулой 200 мл";790120
;94;"МОЕ СОЛНЫШКО жидкое мыло Для подмывания младенцев 200 мл";720069
;94;"ЧИСТАЯ ЛИНИЯ крем дневной Лёгкий Увлажняющий для нормальной и комбинированной кожи 40 мл";530049
;94;"ЧИСТАЯ ЛИНИЯ ночной крем для лица Нежный Питательный для нормальной и комбинированной кожи 40 мл";530052
;94;"Я САМАЯ ватные палочки Моноблок 300 шт";360029
;95;"ARKO Men крем после бритья Anti-Irritation 50 мл";320115
;95;"ARKO крем для бритья Sensitive 50 мл";320057
;95;"ARKO крем после бритья Cool 50 мл";320114
;95;"BELLA носовые платки 10х10 шт";360068
;95;"BELLA носовые платки Baby Happy 10х10 шт";360074
;95;"CETTUA маска для лица Увлажняющая 1 шт";530275
;95;"GREENFIELD чай зеленый листовой Flying Dragon 100 г";120103
;95;"GREENFIELD чай черный в пакетиках Christnas Mystery 25 шт";120085
;95;"GREENFIELD чай черный листовой Barberry Garden 100 г";120075
;95;"GREENFIELD чай черный листовой Classic Breakfast 100 г";120076
;95;"GREENFIELD чай черный листовой Golden Ceylon 100 г";120079
;95;"GREENFIELD чай черный листовой Spring Melody 100 г";120082
;95;"HEINZ соус Барбекю 230 мл";170073
;95;"HEINZ соус Горчичный 230 мл";170337
;95;"HEINZ соус Кисло-сладкий 230 мл";170079
;95;"HEINZ соус Сальса 230 мл";170080
;95;"HEINZ соус Сырный 230 мл";170081
;95;"HEINZ соус Терияки 230 мл";170083
;95;"HEINZ соус Цезарь 230 мл";170075
;95;"HEINZ соус Чесночный 230 мл";170076
;95;"HEINZ соус Чили 230 г";170329
;95;"LENOR кондиционер для белья Скандинавская весна 1 л";410138
;95;"LIBRESSE ежедневные прокладки Natural Care Normal 20 шт";340079
;95;"LIBRESSE прокладки Natural Care Goodnight 7 шт";340177
;95;"LIBRESSE прокладки Natural Care Ultra Normal 10 шт";340174
;95;"LIBRESSE прокладки Natural Care Ultra Super 9 шт";340176
;95;"MOSQUITALL жидкость от комаров Универсальная защита 45 ночей";460166
;95;"NATURES TABLE сухой корм для взрослых кошек с курицей 190 г";610435
;95;"NATURES TABLE сухой корм для кошек Индейка 190 г";610128
;95;"NATURES TABLE сухой корм для кошек Лосось 190 г";610130
;95;"ORAL-B Зубная щетка 3-Effect Деликатное отбеливание средняя";310197
;95;"ORGANIC BEAUTY Шампунь 2в1 Укрепляющий 1000 мл";330814
;95;"PEDIGREE лакомство для собак Tasty Bites с курицей 130 г";620353
;95;"TIDE стиральный порошок Color автомат 0,45 кг";460352
;95;"TIDE стиральный порошок Lenor автомат 0,45 кг";460357
;95;"TIDE стиральный порошок Альпийская свежесть автомат 450 г";410496
;95;"КОРОВКА ИЗ КОРЕНОВКИ Молоко сгущенное 0,38 кг";170206
;95;"КОРОВКА ИЗ КОРЕНОВКИ сгущенное молоко С Какао 270 г";150245
;95;"МАКФА гнезда Капеллини 450 г";150165
;95;"МАКФА гнезда Тальятелле 450 г";150166
;95;"МАКФА лазанья Двойная Волна 500 г";150167
;95;"НАЦИОНАЛЬ фасоль Красная 450 г";150096
;95;"РУССКИЙ ЗАВТРАК каша Пшеничная с грушей 400 г";150070
;95;"ЧИСТЮЛЯ пакеты для мусора Стандарт 60 л 31 шт";250124
;95;"Я САМАЯ влажные салфетки освежающие для всей семьи 63 шт";360106
;95;"Я САМАЯ Гель для интимной гигиены 265 мл";340211
;95;"Я САМАЯ Крем-гель для интимной гигиены 265 мл";380146
;96;"7 DAYS мини круассаны ваниль 300 г";140105
;96;"7 DAYS мини круассаны ваниль-вишня 300 г";140107
;96;"7 DAYS мини круассаны вареная сгущенка 300 г";140109
;96;"7 DAYS мини круассаны какао 300 г";140098
;96;"7 DAYS мини круассаны какао-ваниль 300 г";140100
;96;"7 DAYS мини круассаны карамель 300 г";140101
;96;"7 DAYS мини круассаны клубника 300 г";140103
;96;"7 DAYS мини круассаны черешня 300 г";140096
;96;"BARILLA макароны Farfalle №65 500 г";150142
;96;"BARILLA макароны Piccolini Mini Farfalle №64 500 г";150149
;96;"BARILLA макароны Piccolini Mini Penne Rigate №66 500 г";150150
;96;"BELLA ватные палочки Cotton 350 шт";360044
;96;"BELLA прокладки Perfecta Ultra Blue 10 шт";340138
;96;"BELLA прокладки Perfecta Ultra Green 10 шт";340139
;96;"BELLA прокладки Perfecta Ultra Maxi Blue 8 шт";340140
;96;"BELLA прокладки Perfecta Ultra Maxi Green 8 шт";340143
;96;"BELLA прокладки Perfecta Ultra Night 7 шт";340142
;96;"BELLA прокладки Perfecta Ultra Rose 10 шт";340144
;96;"CURTIS чай Banana Flambe черный ароматизированный в пирамидках 20 шт";120058
;96;"CURTIS чай Barberry Melody черный ароматизированный в пирамидках 20 шт";120059
;96;"CURTIS чай Blue Berries Blues ароматизированный в пирамидках 20 шт";120060
;96;"CURTIS чай Delicate Mango зеленый в пирамидках 20 шт";120061
;96;"CURTIS чай Gunpowder Green зеленый в пирамидках 20 шт";120064
;96;"CURTIS чай Hugo Cocktail зеленый ароматизированный в пирамидках 20 шт";120065
;96;"CURTIS чай Milk Oolong в пирамидках 20 шт";120066
;96;"CURTIS чай White Bountea белый в пирамидках 20 шт";120071
;96;"DOSIA кондиционер для белья для белья Альпийская свежесть 1 л";410103
;96;"DOSIA кондиционер для белья для белья Пробуждение весны 1 л";410104
;96;"DURACELL батарейки Electronics CR2032 1 шт";250197
;96;"EVO жидкое мыло для интимной гигиены Intimate для чувствительной кожи 200 мл";330403
;96;"EVO крем-мыло для интимной гигиены 200 мл";330402
;96;"GREEN LOVE чистящий крем Универсальный 330 г";460406
;96;"GREENFIELD чай черный листовой Kenyan Sunrise 100 г";120081
;96;"LENOR концентрированный кондиционер для белья Альпийские луга 0,5 л";460321
;96;"LENOR Концентрированный кондиционер для белья Детский 0,5 л";790178
;96;"LENOR концентрированный кондиционер для белья Скандинавская весна 0,5 л";460323
;96;"MR PROPER Моющий порошок для уборки Универсальный Лимон 400 г";430394
;96;"QUALITA губки кухонные Extra Strong 5+1 шт";250083
;96;"SEN SOY рис для приготовления суши и роллов 250 г";150137
;96;"КОРОВКА ИЗ КОРЕНОВКИ сгущенные сливки 270 г";150241
;96;"КОСТРОВОК маринад шашлычный По-кавказски 300 г";170172
;96;"ПРЕЛЕСТЬ гель для укладки сильной фиксации С морскими минералами 250 мл";520601
;96;"ПРЕЛЕСТЬ гель для укладки сильной фиксации С экстрактом зеленого чая 250 мл";520600
;96;"СОЛНЦЕ И ЛУНА влажные салфетки Для Детей с отваром ромашки 72 шт";360123
;96;"УБОЙНАЯ СИЛА гель для уничтожения тараканов и муравьёв 75 мл";460231
;96;"ЧИСТЮЛЯ пакеты для мусора Стандарт с завязками 65 л 14 шт";250126
;98;"Ahmad Tea Blueberry Breeze зеленый чай с голубикой, 25 пакетиков";124019
;98;"Ahmad Tea Citrus Sensation черный чай с лимоном и лаймом, 25 пакетиков";124031
;98;"Ahmad Tea Strawberry Cream черный чай с клубникой со сливками, 25 пакетиков";124029
;98;"Ahmad Tea Вечерний черный чай без кофеина, 25 пакетиков";124020
;98;"Ahmad Tea зеленый чай с кленовым сиропом, 25 пакетиков";124026
;98;"Ahmad Tea чай улун с молочным ароматом, 25 пакетиков";124028
;98;"Ahmad Tea черный чай с летним чабрецом, 25 пакетиков";124027
;98;"BAGI Средство для чистки Шуманит от засоров 70 г";430310
;98;"DOCKLAND бальзам после бритья AQUA 75 мл";320098
;98;"DOCKLAND бальзам после бритья SENSITIVE 75 мл";320099
;98;"DOVE крем-мыло Пробуждение Чувств 100 г";330529
;98;"FRUITTELLA жевательный мармелад Медвежата 150 г";170241
;98;"LENOR Концентрированный кондиционер для белья Детский 500 мл";740048
;98;"LUBBY блокиратор Для дверей гибкий большой";790015
;98;"PICNIC гель после укусов Baby 30 мл";460315
;98;"QUALITA фольга алюминиеваяв рулоне 10 м 1 шт";220032
;98;"SANITA гель Антиржавчина 500 мл";460275
;98;"UNCLE BENS соус Кисло-сладкий 210 г";170110
;98;"UNCLE BENS соус Терияки 210 г";150049
;98;"UNCLE BENS соус Техасский Барбекю 210 г";170111
;98;"UNCLE BEN’S соус кисло-сладкий с ананасом 210 г";170333
;98;"WHISKAS подушечки с курицей для стерилизованных кошек 0,35 кг";620479
;98;"ZEWA бумажные полотенца 2 шт";360058
;98;"ZEWA бумажные полотенца 2-в-1 1 шт";360057
;98;"ZEWA бумажные полотенца Decor 2 шт";360059
;98;"БУСИНКА накладки на углы 4 шт";790010
;98;"ДОБРОФЛОТ иваси сардина в масле 210 г";170271
;98;"ЛАПОЧКА крем под подгузник защитный 75 мл";730043
;98;"СОЛНЦЕ И ЛУНА влажные салфетки для детей с экстрактом алоэ 72 шт";380109
;99;"BREESAL Арома саше для белья Пробуждение чувств";440115
;99;"BREESAL Арома саше для белья Шелковые объятия";460390
;99;"BREESAL ароматическое саше Атласный Восторг 20 г";450147
;99;"BRIT Premium влажный корм для собак Говядина и Рис 850 г";620383
;99;"CJ LION зубная паста Systema зеленая мята 120 г";310115
;99;"CJ LION зубная щетка Dentor System средняя 1 шт";310186
;99;"CURTIS чай Earl Grey черный в пакетиках 25 шт";120062
;99;"CURTIS чай Original Ceylon Tea черный в пакетиках 25 шт";120067
;99;"DELISS ароматизатор для автомобиля Harmony саше 1 шт";450111
;99;"DELISS ароматизатор для автомобиля Joy саше 1 шт";450114
;99;"DELISS ароматизатор для автомобиля Romance саше 1 шт";450118
;99;"DELISS ароматизатор для автомобиляя Comfort саше 1 шт";450120
;99;"ENERGIZER батарейки MAX AA (LR6) 2 шт";240077
;99;"ENERGIZER батарейки MAX AAA 2 шт";240078
;99;"FORESTER для барбекю Щепа со специей для копчения рыбы 1 шт";210024
;99;"GAUSS лампа светодиодная Elementary Candle 6W E14 2700K";230020
;99;"GAUSS лампа светодиодная Elementary Candle 6W E14 4100K";230021
;99;"GAUSS лампа светодиодная Elementary Candle 6W E27 2700K";230022
;99;"GAUSS лампа светодиодная Elementary Candle 6W E27 4100K";230023
;99;"GAUSS лампа светодиодная Elementary Globe 6W E14 2700K";230024
;99;"GAUSS лампа светодиодная Elementary Globe 6W E27 2700K";230025
;99;"GAUSS лампа светодиодная Elementary Globe 6W E27 4100K";230026
;99;"GAUSS лампа светодиодная Elementary MR16 GU5.3 3.5W 4100K";230029
;99;"HARRYS хлеб нарезка American Sandwich пшенично-ржаной 470 г";180012
;99;"LIDIE ежедневные прокладки Deo ромашка 25 шт";340011
;99;"LORADO ягоды консервированные Клубника в сиропе 425 мл";160100
;99;"ORGANIC BEAUTY  Шампунь 2в1 Тонизирующий 1000 мл";330815
;99;"ORGANIC BEAUTY Шампунь 2в1 Восстанавливающий 1000 мл";330813
;99;"PRO PLAN влажный корм для стерилизованных кошек Sterilised с тунцом 85 г";610180
;99;"RICHARD чай Lord Grey черный ароматизированный в пакетиках 25 шт";120232
;99;"RICHARD чай Royal Ceylon черный в пакетиках 25 шт";120235
;99;"RICHARD чай Royal English Вreakfast черный в пакетиках 25 шт";120238
;99;"RICHARD чай Royal Green зеленый в пакетиках 25 шт";120239
;99;"КОРОВКА ИЗ КОРЕНОВКИ сгущенное молоко 380 г";170205
;99;"КУБАНОЧКА томатная паста в стеклянной банке 0,5 кг";170332
;99;"ЛАПОЧКА крем-мыло детское жидкое 300 мл";720064
;99;"МНЯМС Хрустящие подушечки для кошек Здоровые зубы 60 гр";610472
;99;"МНЯМС Хрустящие подушечки для кошек с Говядиной Выведение шерсти 60 гр";610470
;99;"МНЯМС Хрустящие подушечки для кошек с Птицей и говядиной Здоровая кожа и шерсть 60 гр";610471
;99;"НАЦИОНАЛЬ Premium рис Жасмин 500 г";150112
;99;"ПРЕЛЕСТЬ лак для волос Сверхсильная фиксация 200 мл";520615
;99;"ПРЕЛЕСТЬ лак для волос Эффект Памяти 75 мл";520603
;99;"СОЛНЦЕ И ЛУНА влажные салфетки Для Новорожденных 54 шт";360124
;99;"ЧИСТИН средство для удаления накипи в стиральных машинах Эффект 500 г";430328
;99;"ЧИСТЮЛЯ пакеты для мусора Легкая с завязками ушками 60 литров 20 шт";250115
;99;"ЭКОФЕРМЕР фруктовая пастила Яблоко с Корицей и Мёдом 50 г";140187
;100;"ARKO Men станок для бритья Regular 2 одноразовый 5 шт";320211
;100;"BELLA тампоны Tampo Regular 8 шт";380093
;100;"BELLA тампоны Tampo Super 8 шт";340224
;100;"BELLA тампоны Tampo Super Plus 8 шт";340231
;100;"CHAMOS сыворотка для снятия макияжа Acaci Moisture Cleansing Serum Очищающая 20 мл";560180
;100;"CRACARE маска-сыворотка для лица с Коллагеном Лифтинг Эффект";530296
;100;"DR. SMART маска для лица Hydrating Tox Solution для проблемной кожи с Маслом чайного дерева";530299
;100;"DR. SMART маска для лица Whitening Revival с Витаминным Комплексом";530301
;100;"DR. SMART маска для лица Wrincle Regeneration с Коллагеном";530302
;100;"GARDEX жидкость от комаров Naturin 30 ночей 30 мл";460131
;100;"HEINZ кукуруза консервированная 340 г";160020
;100;"ORGANIC SHOP пилинг для лица абрикосовый манго 75 мл";530161
;100;"PEDIGREE лакомство для собак Biscrok 200 г";620351
;100;"PEDIGREE лакомство для собак Tasty Bites с курицей 95 г";620354
;100;"PEDIGREE лакомство для щенков Tasty Bites Puppy с курицей 125 г";620350
;100;"WHISKAS подушечки с нежным паштетом Аппетитное ассорти с курицей и индейкой 0,35 кг";620476
;100;"WHISKAS подушечки с нежным паштетом Аппетитный обед с лососем 0,35 кг";620480
;100;"ВОЛШЕБНОЕ ДЕРЕВО 5 перцев 50 г";170347
;100;"ПРЕЛЕСТЬ маска для волос Био Восстановление и укрепление 250 мл";520094
;100;"СОЛНЦЕ И ЛУНА жидкое мыло Детское дой-пак 500 мл";330350
;100;"ЧИСТАЯ ЛИНИЯ скраб для лица Мягкий малина и косточки клюквы50 мл";530146
;101;"ACE Отбеливатель жидкий  Бережное отбеливание 1 л";460440
