"Минимальное количество товара для заказа";"Цена_Розничная";"Короткое название";"Артикул"
;72;"OREO печенье  шоколад 228 г";140146
;72;"QUALITA пакеты для мусора Stripe Top с затяжками 60 литров 10 шт";250137
;72;"ROYAL CANIN влажный корм Ageing 12+ (в соусе) для кошек старше 12 лет 85 г";620534
;72;"ROYAL CANIN влажный корм Kitten Instinctive (в желе) для котят от 4 до 12 месяцев 85 г";620488
;72;"SANITAPLAST лейкопластырь №20 Стандартный 20 шт";360045
;72;"ЦЕЛЕБНЫЕ ТРАВЫ бальзам-ополаскиватель Клевер и масло зародышей пшеницы 220 мл";320271
;73;"МАКА кетчуп Шашлычный 900 г";170094
;74;"AURA ватные диски 120 шт";360113
;74;"CJ LION зубная щетка Kids Safe 7 - 12 лет мягкая 1 шт";720002
;74;"FAMILIA бумажные полотенца белые двухслойные 2 шт";360046
;74;"TESS чай Ginger Mojito зеленый в пирамидках 20 шт";120246
;75;"AOS средство для мытья посуды Бальзам Алоэ Вера 0,45 л";420006
;75;"AOS средство для мытья посуды Лимон 450 мл";420007
;75;"HELEN HARPER Детские впитывающие пеленки Soft & Dry 40х60 5 шт";710111
;76;"ROYAL CANIN влажный корм Persian (паштет) для персидских кошек 85 г";620581
;77;"BROOKE BOND чай черный листовой 100 г";120055
;77;"ШЕСТЬ СОТОК зеленый горошек 425 г";160064
;78;"ALPEN GOLD шоколад молочный Арахис и Кукурузные Хлопья 95 г";140203
;78;"QUALITA зубочистки бамбуковые 300 шт";310010
;79;"NESСAFE Кофе растворимый гранулированный Classic 50 г";110283
;79;"КУБАНОЧКА сахар рафинад 1 кг";150306
;79;"МОЕ СОЛНЫШКО пенка для купания С чередой 200 мл";720031
;80;"BRIT Care влажный корм для кошек Тунец и Лосось 80 г";610040
;80;"LEBO Кофе молотый для заваривания в чашке Gold Арабика 100 г";110254
;80;"LOSK стиральный порошок Горное Озеро ручная стирка 410 г";410370
;82;"QUALITA пакеты для мусора T-shirt с ручками 60 литров 15 шт";250139
;82;"SULA леденцы Лесная Ягода без сахара с витамином С 60 гр";140300
;82;"ДИХЛОФОС средство от насекомых Эко 190 мл + 30 % бесплатно";250157
;82;"ПРИНЦЕССА крем детский С миндальным маслом 75 мл";790195
;83;"CJ LION зубная паста Kids Safe клубника 3 - 12 лет 90 г";720004
;83;"KNORR приправа Ароматная Классика Овощей 200 г";170130
;84;"CJ LION зубная щетка Kids Safe 4 - 6 лет мягкая 1 шт";720001
;84;"DURACELL батарейки Basic AA 2 шт";240048
;84;"DURACELL батарейки Basic AAA 2 шт";240055
;84;"FAMILIA Plus туалетная бумага Волшебный Цветок белая с ароматом и рисунком двухслойная 4 шт";360187
;84;"RITTER SPORT шоколад молочный с Дробленым лесным орехом 100 г";140285
;84;"RITTER SPORT шоколад молочный с начинкой Карамельный мусс 100 г";140287
;84;"Я САМАЯ ватные диски 120 шт";360018
;85;"ПЕМОЛЮКС чистящее средство Сода 5 морской бриз 480 г";460399
;86;"NATURELLA прокладки Classic Camomile Maxi 8 шт";340195
;86;"SANINO Зубная паста Защита от кариеса 100 мл";310129
;86;"ПРЕЛЕСТЬ шампунь Природный блеск с экстрактом Ромашки для всех типов волос 500 мл";520879
;87;"QUALITA пакеты для мусора T-shirt с ручками 35 литров 20 шт";250138
;88;"BARILLA макароны Fusilli №98 500 г";150145
;88;"GREENFIELD чай зеленый в пакетиках Green Melissa 25 шт";124008
;88;"GREENFIELD чай черный в пакетиках Spring Melody 25 шт";124010
;88;"GREENFIELD чай черный в пакетиках Strawberry Gourmet  25 шт";120097
;88;"SHEBA влажный корм для кошек Тунец в нежном соусе 80 г";610551
;88;"Teatone Apple ginger Яблоко-Имбирь | Чайный напиток, 15 стиков";128004
;88;"Teatone Earl grey tea Черный чай с ароматом бергамота, 15 стиков";128008
;88;"Teatone Forest berries Лесные ягоды | Чайный напиток, 15 стиков";128003
;88;"Teatone Green tea Зеленый чай, 15 стиков";128001
;88;"Teatone Indian black tea Индийский черный чай, 15 стиков";128002
;88;"Teatone Jasmine green tea Зеленый чай с жасмином, 15 стиков";128000
;88;"Teatone Mint green tea Зеленый чай с ароматом мяты, 15 стиков";128005
;91;"AURA ватные диски 150 шт";360019
;91;"Я САМАЯ ватные диски Organic 120 шт";360130
;92;"TCHIBO Кофе растворимый Gold Selection 40 г";110236
;92;"ZEWA туалетная бумага Плюс Яблоко 2 слоя 4 шт";360003
;92;"БАРХАТНЫЕ РУЧКИ крем для рук и ногтей Комплексный 80 мл";540032
;92;"ЧИСТЮЛЯ Baby губки Натуральные для детской посуды 2 шт";740014
;94;"DOMESTOS туалетный блок 3 в 1 Атлантик 1 шт";430487
;95;"GREENFIELD чай Jasmine Dream зеленый ароматизированный листовой 100 гр";121004
;95;"GREENFIELD чай черный листовой Earl Grey Fantasy 100 г";121003
;95;"ЖОКЕЙ кофе растворимый гранулированный Фаворит 75 г";110319
;96;"CURTIS чай Fresh Mojito зеленый чай в пирамидках 20 шт";127004
;96;"CURTIS чай Summer Berries фруктово-травяной в пирамидках 20 шт";127002
;96;"CURTIS чай Sunny Lemon черный в пирамидках 20 шт";127003
;96;"ORGANIC SHOP бальзам для волос восстанавливающий коса до пояса 100 мл";520043
;96;"ЧЕРНАЯ КАРТА Кофе растворимый Exclusive Brasilia 47,5 г";110217
;96;"ЧЕРНАЯ КАРТА Кофе растворимый Gold 47,5 г";110201
;98;"NESCAFE кофе растворимый Classic 75 г";110147
;98;"WHISKAS подушечки с говядиной для стерилизованных кошек 0,35 кг";610453
;99;"CJ LION зубная паста Kids Safe виноград 3 - 12 лет 90 г";720003
;99;"ЧИСТИН средство для мытья полов Сочный лимон 1000 мл";430105
;100;"LIPTON чай черный листовой Yellow Label 100 г";121002
;100;"QUALITA пакеты для мусора Standart Top прочные 60 литров 20 шт";250136
;101;"Ahmad Tea Citrus Sorbet зеленый чай с грейпфрутом и лимоном, 20 пирамидок";127011
;101;"LEBO Кофе растворимый Extra 2 г х 25 шт";110262
;101;"LEBO Кофе растворимый Gold 2 г х 25 шт";110255
;102;"FAMILIA туалетная бумага белая Радуга двухслойная 8 шт";360186
;102;"МИФ стиральный порошок Морозная Свежесть ручная стирка 0,9 кг";410396
;104;"FORESTER жидкость для розжига 0,25 л";250164
;104;"NESCAFE Кофе растворимый гранулированный Classic 100 г";110286
;105;"JOHNSON'S Baby влажные салфетки детские Pure Protect 25 шт";710004
;105;"MR PROPER Моющая жидкость для полов и стен Бодрящий лайм и мята 500 мл";430003
;105;"MR PROPER Моющая жидкость для полов и стен Горный ручей и прохлада 500мл";430004
;105;"NESСAFE Кофе растворимый порошкообразный Classic Crema 70 г";110294
;105;"PRINGLES чипсы картофельные Паприка 165 г";150323
;105;"ГАДКИЙ Я гель для душа Тропический микс 250 мл";720034
;105;"ГАДКИЙ Я шампунь 2-в-1 250 мл";570264
;105;"ГАДКИЙ Я шампунь Банан 250 мл";330603
;105;"ГАДКИЙ Я шампунь-гель 250 мл";570266
;105;"МОСКОФЕ кофе растворимый Индийский 90 г";110302
;108;"ZEWA салфетки бумажные для лица Everyday 100 шт";360005
;108;"ПРИНЦЕССА гель для душа Ласковая забота 250 мл";380199
;108;"ПРИНЦЕССА шампунь-гель Нежный уход 250 мл";570268
;108;"ПРИНЦЕССА шампунь-уход Волшебные локоны 250 мл";570265
;110;"AURA FAMILY влажные салфетки для всей семьи Ecoomy с крышкой 200 шт";360114
;110;"RITTER SPORT шоколад темный Элитный 73% 100 г";140290
;110;"TCHIBO Кофе растворимый Gold Selection 47,5 г";110238
;110;"БАРХАТНЫЕ РУЧКИ крем для рук Роскошь Макадамии 80 мл";540042
;110;"ЖОКЕЙ кофе растворимый гранулированный Фаворит 95 г";110320
;110;"КАПИТАН МОРЕЙ шпроты в масле 240 г";160078
;111;"PEDIGREE сухой корм для собак всех пород с говядиной 0,6 кг";620505
;111;"ГОНКИ детский шампунь 2-в-1 300 мл";570267
;113;"AMBASSADOR Кофе растворимый Platinum 47,5 г";110231
;114;"PEDIGREE лакомство Denta Stix для собак малых пород 110 г";620365
;114;"МОСКОФЕ кофе растворимый Московский 90 г";110138
;115;"NESCAFE Кофе растворимый гранулированный Classic 95 г";110291
;115;"WOLLINGER 3D кофе растворимый сублимированный 75 г";110177
;115;"WOLLINGER CREMA кофе растворимый сублимированный 75 г";110184
;115;"WOLLINGER IQ кофе растворимый сублимированный с добавлением молотого 75 г";110181
;116;"DOSIA чистящее средство с дезинфицирующим и отбеливающим эффектом Лимон гель 750 мл";430499
;116;"WOLLINGER IQ кофе растворимый сублимированный с добавлением молотого 95 г";110182
;116;"ЖОКЕЙ кофе растворимый сублимированный Империал 75 г";110313
;118;"FAIRY ProDerma Средство для мытья посуды Шёлк и Орхидея 450 мл";430216
;118;"ПРИНЦЕССА бальзам для губ Мягкое увлажнение 3,8 г";720103
;118;"ЧЕРНАЯ КАРТА Кофе молотый ""Темная обжарка"" 250 г";110208
;119;"Ahmad Tea English Tea No.1 черный чай, 100 г";121007
;119;"ЧЕРНАЯ КАРТА Кофе растворимый Gold 75 г";110205
;120;"ZEWA бумажные полотенца Premium 2 шт";360060
;120;"ZEWA бумажные полотенца Premium Decor 2 шт";360004
;121;"COMET Чистящий гель Весенняя свежесть 0,5 л";430001
;121;"TCHIBO Кофе растворимый Gold Selection 75 г";110237
;122;"PEDIGREE сухой корм для щенков всех пород с курицей 0,6 кг";620516
;122;"TCHIBO Кофе растворимый Exclusive 47,5 г";110245
;122;"ЧЕРНАЯ КАРТА Кофе молотый для турки 250 г";110210
;122;"ЧИСТАЯ ЛИНИЯ Шампунь Пшеница и отвар Льна для Тонких и ослабленных волос 250 мл";520827
;124;"EGOISTE кофе молотый Noir 100 г";110304
;124;"PRINGLES чипсы карт.Паприка 165г*19";170220
;124;"TCHIBO Кофе молотый Gold Mokka 250 г";110233
;126;"ЧИСТАЯ ЛИНИЯ шампунь Укрепляющий для всех типов волос 400 мл";520899
;128;"NESСAFE Кофе растворимый сублимированный Gold 47,5 г";110280
;128;"TCHIBO Кофе молотый по-восточному Gold Mokka 250 г";110234
;129;"ЧЕРНАЯ КАРТА Кофе растворимый Exclusive Brasilia 75 г";110214
;130;"ЖОКЕЙ кофе молотый Баварский шоколад 150 г";110311
;130;"ЧЕРНАЯ КАРТА Кофе молотый для заваривания в чашке 250 г";114003
;131;"LEBO Кофе молотый Extra Арабика 200 г";110259
;131;"NESСAFE Кофе растворимый гранулированный Classic 100 г";110284
;131;"SAFEGUARD Жидкое мыло с Цветочным ароматом 250 мл";330427
;131;"TCHIBO Кофе растворимый Exclusive 75 г";110242
;131;"БАРСИК наполнитель для кошачьего туалета Mix - Древесный 4,5 л";610494
;132;"IKEEP Универсальное чистящее средство для сантехники 700 мл";460414
;134;"NESСAFE Кофе растворимый сублимированный Gold 75 г";116011
;137;"ЖОКЕЙ кофе растворимый сублимированный Империал 95 г";110312
;138;"JARDIN кофе растворимый Guatemala Atitlan 75 г";110125
;138;"WOLLINGER 3D кофе растворимый сублимированный 95 г";110179
;138;"МНЯМС Лакомые палочки для собак с Ягненком 45 гр";620348
;138;"ПРИНЦЕССА спрей для легкого расчесывания Послушные кудряшки 150 мл";790194
;138;"ЧЕРНАЯ КАРТА Кофе в зернах 250 г";111001
;138;"ЧЕРНАЯ КАРТА Кофе растворимый Premium 75 г";110218
;139;"EVO Крем Для Локтей и Коленей 46 мл";540060
;139;"ПРИНЦЕССА гель для душа Молочный апельсин 400 мл";380198
;142;"DOLMIO соус Для Макарон с оливками 350 г";170051
;142;"DOMESTOS универсальный чистящий гель Лимонная Свежесть 0,5 л";460276
;142;"DOMESTOS универсальный чистящий гель Свежесть Атлантики 0,5 л";430382
;142;"DOMESTOS универсальный чистящий гель Свежесть Лаванды 0,5 л";460277
;144;"СОРМОВСКАЯ КФ Когфеты Озорной Мишка со вкусом Сливочного ириса 3кг";140078
;144;"ЧУККА какао-напиток Горячий Шоколад ганулированный 250 г";130011
;145;"BUSHIDO кофе растворимый Original 100 г";110057
;145;"WOLLINGER 3D кофе растворимый сублимированный 85 г";110180
;145;"ZEWA туалетная бумага Deluxe 3 слоя 4 шт";360001
;146;"HEINZ кетчуп Томатный 0,57 кг";170071
;148;"NESCAFE кофе растворимый Classic 150 г";110146
;148;"NESСAFE Кофе растворимый Gold Crema 70 г";110273
;148;"NESСAFE Кофе растворимый порошкообразный Classic Crema 95 г";110295
;148;"ЖОКЕЙ кофе растворимый Триумф 95 г";110318
;149;"FAIRY Средство для мытья посуды Зеленое яблоко 900 мл";420003
;149;"FAIRY Средство для мытья посуды Сочный лимон 900 мл";420002
;149;"FORESTER спички длительного горения 20 шт";210051
;149;"ЧЕРНАЯ КАРТА Кофе молотый 250 г";110209
;150;"КУБАНЬ МАТУШКА Арахис натуральный 700 гр";150272
;151;"LEBO Кофе растворимый Extra 100 г мягкая упаковка";110263
;151;"SORTI стиральный порошок Супер Эконом автомат 1,5 кг";410457
;153;"FAIRY Средство для мытья посуды Нежные руки Ромашка и витамин Е 900 мл";420001
;153;"МАЙСКИЙ ЧАЙ чайный напиток Иван-чай Классический 50 г";120186
;155;"BANANA REPUBLIC бананы сушенные в шоколадной глазури 200 г";150266
;156;"AMBASSADOR Кофе растворимый Platinum 75 г";110229
;157;"FAMILIA Plus туалетная бумага Ромашка белая с ароматом и рисунком двухслойная 8 шт";360188
;157;"ЧЕРНАЯ КАРТА Кофе в зернах Gold 250 г";110194
;158;"FAIRY средство для мытья посуды Pure & Clean 450 мл";430228
;161;"LIPTON чай черный в пакетиках Юбилейный 25 лет 100 шт";124006
;162;"LENOR Концентрированный кондиционер для белья Детский 1 л";740015
;163;"OLA! ежедневные прокладки Light Deo Белый пион 60 шт";340010
;166;"ЖОКЕЙ кофе молотый Итальяно 250 г";110167
;166;"ЖОКЕЙ кофе молотый Классический 250 г";110168
;166;"ЖОКЕЙ кофе молотый По-восточному 250 г";114004
;168;"AMBASSADOR Кофе в зернах Platinum 250 г";110227
;168;"NESСAFE Кофе растворимый Gold, 20 шт. х 2 г";110271
;168;"ЧЕРНАЯ КАРТА Кофе растворимый Gold 95 г";110202
;168;"ЧИСТАЯ ЛИНИЯ шампунь Объем и Сила для тонких и ослабленных волос 400 мл";520900
;169;"JARDIN кофе растворимый Colombia Medellin 75 г";116001
;169;"SENI прокладки урологические Lady mini 20 шт";340156
;170;"NESСAFE Кофе растворимый 3 в 1 Мягкий, 20 стиков х 16 г";116008
;172;"ORGANIC SHOP гель для душа тропический манго 500 мл";330328
;172;"TCHIBO Кофе растворимый Gold Selection 95 г";110239
;172;"TOFFIFEE шоколадные конфеты 125 г";140079
;173;"ЧЕРНАЯ КАРТА Кофе растворимый Exclusive Brasilia 95 г";110216
;174;"NESСAFE Кофе растворимый гранулированный Classic 30 шт. х 2 г";110293
;175;"DOCKLAND гель для бритья Aqua 200 мл";320010
;175;"ECOFOOD Хариса армянская (пшеничная каша с курицей) 500 г";160109
;175;"NESСAFE Кофе растворимый сублимированный Gold 95 г";116012
;177;"AMBASSADOR Кофе молотый Platinum 250 г";110228
;178;"ДОННА РОЗА салфетка  для пола из микрофибры";250212
;179;"FRUCTIS шампунь Годжи Стойкий Цвет укрепляющий 250 мл";520843
;179;"FRUCTIS шампунь Сила и блеск 2 в 1 250 мл";330680
;179;"HEINZ кетчуп Томатный перевернутый 0,57 кг";170072
;180;"ROBERTO TOTTI Кофе в зернах Caffe Ristretto 250 г";111009
;180;"ROBERTO TOTTI Кофе молотый Caffe Ristretto 250 г";114006
;180;"TCHIBO Кофе молотый Exclusive 250 г";110243
;181;"LEBO Кофе растворимый Extra 100 г";110261
;181;"ЛЕСНОЙ БАЛЬЗАМ ополаскиватель для полости рта Бальзам Форте 400 мл";310246
;182;"AMBASSADOR Кофе растворимый Platinum 95 г";116002
;183;"МАМРУКОВСКОЕ масло подсолнечное рафинированное дезодорированное 2 л";150302
;184;"ECOFOOD Долма овощная с виноградными листьями  500 г";160108
;184;"SCHAUMA бальзам-ополаскиватель 6 Уровней Восстановления 200 мл";330134
;184;"SCHAUMA бальзам-ополаскиватель 7 Трав Свежесть и объем 200 мл";330139
;184;"SCHAUMA бальзам-ополаскиватель Кокосовая вода и Цветок Лотоса 200 мл";330136
;185;"ZEWA туалетная бумага Exclusive Ultra Soft 4 слоя 4 шт";360013
;186;"СОЛНЦЕ И ЛУНА подгузники для детей Мягкая Забота 3 (4-9 кг) 16 шт";710208
;187;"NESСAFE Кофе растворимый 3 в 1 Карамель, 20 стиков х 16 г";110267
;187;"NESСAFE Кофе растворимый 3 в 1 Классик, 20 стиков х 16 г";116006
;187;"NESСAFE Кофе растворимый 3 в 1 Крепкий, 20 стиков х 16 г";116007
;188;"FA гель для душа Тайна Масел Розовый Жасмин 250 мл";330274
;189;"HUGGIES влажные салфетки Classic 64 шт";710005
;190;"NESСAFE Кофе растворимый Gold Barista 85 г";110272
;191;"JARDIN кофе растворимый Guatemala Atitlan 95 г";110309
;191;"PANTENE Бальзам-ополаскиватель Aqua Light 200 мл";330021
;191;"НАЦИОНАЛЬ сахар песок Для Кофе тростниковый 900 г";150310
;194;"GORDON чай черный в пакетиках 100 шт";120073
;195;"JARDIN кофе растворимый Kenya Kilimanjaro 95 г";110307
;195;"NESСAFE Кофе растворимый Gold Crema 95 г";110274
;195;"TCHIBO Кофе растворимый Exclusive 95 г";110246
;196;"MEINE LIEBE концентрированный кондиционер для белья Детский 500 мл";740017
;197;"JARDIN кофе растворимый Colombia Medellin 95 г";110310
;199;"TOBLERONE белый шоколад с медово-миндальной нугой 100 г";140296
;202;"TCHIBO Кофе молотый Gold Selection 250 г";110240
;202;"МАЛЕНЬКАЯ ФЕЯ гель для душа Happy Moments Фруктовая Сказка 240 мл";330202
;205;"OLD SPICE Гель для душа Whitewater 250 мл";330325
;206;"ЧЕРНАЯ КАРТА Кофе растворимый Gold 150 г";110204
;207;"ПЕТРОВСКАЯ СЛОБОДА 3в1 Лесной орех 25 шт";110156
;209;"IKEEP! Универсальное средство для кухни all-in-one 750 мл";430428
;209;"TCHIBO Кофе молотый Black and White 250 г";110247
;209;"TCHIBO Кофе растворимый Gold Selection 150 г";110235
;211;"ЧЕРНЫЙ ЖЕМЧУГ ночной крем Самоомоложение Программа от 46 лет 50 мл";530033
;213;"LEBO Кофе в зернах Южная Америка Арабика 250 г";110253
;216;"PALETTE крем-краска для волос Фитолиния Пепельный блондин 218";520377
;216;"PALETTE крем-краска для волос Фитолиния Пленительный медный 270";520380
;216;"PALETTE стойкая крем-краска 6-280 Темно-русый металлик 110 мл";570076
;217;"ЧЕРНАЯ КАРТА Кофе растворимый Premium 95 г";110219
;218;"WOLLINGER 3D кофе растворимый сублимированный 150 г";110178
;218;"WOLLINGER IQ кофе растворимый сублимированный с добавлением молотого 150 г";110183
;219;"ZEWA бумажные полотенца Premium Decor 4 шт";360064
;220;"MACCOFFEE кофе растворимый The Original 25x20 г";110135
;220;"ZEWA туалетная бумага Just1 4 слоя 4 шт";360012
;220;"КАФЕ КРАСОТЫ бальзам-ополаскиватель Мягкий Уход 300 мл";320270
;221;"ЖОКЕЙ кофе растворимый Триумф 150 г";110317
;225;"DEONICA гель для бритья For Men Perfectly Smooth Shave для чувствительной кожи 200 мл";320011
;227;"ECOFOOD Хаш армянский 525 г";160117
;228;"ELSEVE бальзам Полное восстановление секущихся кончиков 200 мл";320272
;229;"ЧЕРНАЯ КАРТА Кофе в зернах Brazil 230 г";110212
;231;"JARDIN кофе растворимый Guatemala Atitlan 150 г";110308
;231;"КОМАРОФФ жидкость от комаров Семья (70 ночей) 45 мл";460136
;234;"SPLAT зубная паста Black Lotus 75 мл";310032
;236;"DOVE крем для рук Объятия Нежности 75 мл";540058
;236;"DOVE крем-гель для душа Драгоценные Масла 250 мл";330238
;236;"NESCAFE Кофе растворимый гранулированный Classic 250 г";110287
;238;"ЧЕРНАЯ КАРТА Кофе растворимый Exclusive Brasilia 150 г";110213
;239;"SYMPHONY Дезинфектор Воздуха Expert без запаха 250 мл";450171
;239;"TENA Прокладки Lady Mini Wings 18 шт";340148
;240;"AMBASSADOR Кофе в зернах Black Label 200 г";110224
;240;"AMBASSADOR Кофе в зернах Blue Label 200 г";110223
;240;"AMBASSADOR Кофе в зернах Gold Label 200 г";110225
