;192;"ЧИСТАЯ ЛИНИЯ для лица Дневной Фито-крем от 55 лет шлемник и морошка 45 мл";530037
;192;"ЧИСТАЯ ЛИНИЯ лосьон для снятия макияжа Импульс молодости 150 мл";560179
;192;"ЧИСТАЯ ЛИНИЯ ночной крем для лица От 60 лет таволга и калина 45 мл";530053
;192;"ЧИСТАЯ ЛИНИЯ Фито-крем для лица  Дневной Шлемник и Морошка от 55 лет 45 мл";570229
;192;"ЧИСТАЯ ЛИНИЯ Фито-крем для лица Дневной Анрика и  Жимолость от 45 лет 45 мл";570227
;192;"ЧИСТАЯ ЛИНИЯ Фито-крем для лица Дневной Анрика и Жимолость от 45 лет 45 мл";530039
;192;"ЧИСТАЯ ЛИНИЯ фито-крем для лица дневной От 45 лет арника и жимолость 45 мл";530040
;192;"ЧИСТАЯ ЛИНИЯ Фито-крем для лица Дневной Шлемник и Морошка от 55 лет 45 мл";530041
;192;"ЧИСТАЯ ЛИНИЯ Фито-крем для лица Ночной  Арника и Жимолость от 45 лет 45мл";570231
;192;"ЧИСТАЯ ЛИНИЯ Фито-крем для лица Ночной Арника и Жимолость от 45 лет 45мл";530042
;192;"ЧИСТАЯ ЛИНИЯ Фито-крем для лица Ночной Вербена и Первоцвет от 35 лет 45 мл";530045
;192;"ЧИСТАЯ ЛИНИЯ фито-крем для лица Ночной от 55 лет Шлемник и Морошка 45 мл";530043
;192;"ЧИСТАЯ ЛИНИЯ Фито-крем для лица Ночной Шлемник и Морошка от 55 лет 45 мл";530044
;194;"DOMESTOS универсальный чистящий гель Фруктовая Свежесть 1 л";430373
;194;"JOHNSON'S Baby Крем под подгузник 50 мл";730016
;194;"LENOR кондиционер для белья Скандинавская весна 2 л";410139
;194;"RAINBOW BEAUTY крем для рук Sense of Care с маслом Ши и Экстрактом Сакуры 35 г";540073
;194;"REXONA дезодорант твердый Невидимая Прозрачный Кристалл женский 40 мл";350139
;194;"REXONA твердый антиперсперант Алоэ Вера 40 мл";350044
;194;"REXONA твердый антиперсперант Антибактериальная и невидимая на черном и белом 40 мл";350054
;194;"REXONA твердый антиперсперант Антибактериальная свежесть 40 мл";350052
;194;"REXONA твердый антиперсперант Антибактериальный эффект 40 мл";350073
;194;"REXONA твердый антиперсперант Без Запаха 40 мл";350077
;194;"REXONA твердый антиперсперант Невидимая защита для черного и белого 40 мл";350058
;194;"REXONA твердый антиперсперант Свежесть Белых цветов и Личи 40 мл";350056
;194;"REXONA твердый антиперсперант Сухость Пудры 40 мл";350050
;194;"TRESEMME шампунь Diamond Strength Укрепляющий 230 мл";330929
;194;"VENUS станки для бритья Одноразовые SIMPLY 2 4 шт";320253
;194;"ГРОДФУД конина тушеная 338 г";170252
;194;"ЛЕСНОЙ БАЛЬЗАМ ополаскиватель для полости рта Природная свежесть 750 мл";310252
;195;"CAMAY гель для душа French Romantique 250 мл";380132
;195;"FA Men гель для душа Sport мужской 250 мл";330266
;195;"FA гель для душа Энергия&Витамины Розовый Грейпфрут 250 мл";330271
;195;"GILLETTE гель для бритья Sensitive Skin с алоэ 75 мл";320037
;195;"LIBRESSE ежедневные прокладки Dailyfresh Multistyle 60 шт";340077
;195;"MEINE LIEBE средство для мытья кухонных поверхностей 500 мл";430112
;195;"PORTO ROSSO кофе молотый Americano в капсулах nespresso 10 шт";110185
;195;"PORTO ROSSO кофе молотый Espresso в капсулах nespresso 10 шт";110186
;195;"SALTON гелевые подушечки для обуви против скольжения";440103
;195;"SALTON Гелевые подушечки под пятку";440104
;195;"SALTON Гелевые подушечки под стопу";440105
;195;"TRESEMME бальзам-ополаскиватель Keratin Smooth разглаживающий 400 мл";330164
;195;"TRESEMME шампунь Repair & Protect Восстанавливающий 230 мл";330932
;195;"ЧЕРНЫЙ ЖЕМЧУГ крем для век BiO-программа Увлажнение и питание 20 мл";530243
;196;"AOS средство для мытья посуды Апельсин и Мята 900 мл";430180
;196;"AOS Средство для мытья посуды Бальзам 1 л";430181
;196;"BUCHERON шоколад молочный с Кусочками малины 100 г";140233
;196;"ELZA цикорий растворимый 100 г";130035
;196;"HELEN HARPER подгузники Soft & Dry 3 (4 - 9 кг) 14 шт";710227
;196;"HELEN HARPER подгузники Soft & Dry 4 (9 - 18 кг) 12 шт";710228
;196;"HELEN HARPER подгузники Soft & Dry 5 (11 - 25 кг) 10 шт";710229
;196;"MOSQUITALL комплект фумигатор + жидкость Защита для Всей Семьи 30 мл";460148
;196;"OLD SPICE Дезодорант твердый Hawkridge 50 мл";350151
;196;"ORGANIC PEOPLE эко-спрей для всех кухонных поверхностей 500 мл";430431
;196;"PAMPERS подгузники Sleep & Play 2 (3 - 6 кг) 18 шт";710272
;196;"PAMPERS подгузники Sleep & Play 2 (4 - 8 кг) 18 шт";790141
;196;"PICNIC аэрозоль от клещей и летающих насекомых Extreme 75 мл";460172
;196;"МАЙСКИЙ чай Отборный Цейлон цейлонский пакетированный 100 шт";120189
;196;"МАЙСКИЙ ЧАЙ чай черный листовой Корона Российской Империи 200 г";120184
;198;"JOHNSON’S Baby детский крем От Макушки до Пяточек 100 мл";730018
;198;"KLEENEX влажная туалетная бумага сменный блок 42 шт";360198
;198;"KLEENEX носовые платочки Balsam 9 х 8 шт";360078
;198;"RAFFAELLO набор конфет 90 г";140061
;198;"SHAMTU бальзам-ополаскиватель Питание и Сила с экстрактами Фруктов 200 мл";330143
;198;"SPLAT Зубная щетка Innova деликатная с ионами серебра";310225
;198;"TESS чай черный листовой Holiday Cookies 110 г";120242
;198;"TESS чай черный листовой Winter Spices 110 г";120243
;198;"БАРХАТНЫЕ РУЧКИ крем для рук Для Всей Семьи 200 мл";540028
;198;"ПРЕЛЕСТЬ бальзам Рост и Сила с Аргинином и экстрактом бамбука для всех типов волос 400 мл";520050
;198;"ПРЕЛЕСТЬ бальзам Эффект ламинирования для нормальных и лишенных блеска волос 400 мл";520045
;199;"BREF туалетный блок Blue Aktiv цветочная свежесть 1 шт";430449
;199;"CAREFREE ежедневные прокладки Cotton Extract Fresh 34 шт";340059
;199;"CAREFREE ежедневные прокладки FlexiForm 30 шт";340033
;199;"COMET  Чистящее средство для туалета Сосна 750 мл";430473
;199;"COMET Чистящее средство для туалета Весенняя свежесть 750 мл";430474
;199;"COMET Чистящее средство для туалета Лимон 750 мл";430468
;199;"COMET Чистящее средство для туалета Океан 750мл";430470
;199;"COMET чистящее средство для туалета Полярный Бриз 750 мл";430472
;199;"COMET Чистящий гель Весенняя свежесть 1 л";430364
;199;"COMET Чистящий гель для ванной комнаты 500 мл";430475
;199;"COMET Чистящий гель Лимон 1 л";430359
;199;"COMET Чистящий гель Океанский бриз 1 л";430361
;199;"COMET Чистящий гель Сосна 1 л";430363
;199;"COMET чистящий спрей для ванной комнаты 500 мл";430476
;199;"KLEENEX салфетки Ultra Soft в коробке 56 шт";360092
;199;"NATURA SIBERICA бальзам для окрашенных волос защита и блеск 500 мл";520040
;199;"PAMPERS подгузники New Baby 2 (3 - 6 кг) 17 шт";790134
;199;"PAMPERS подгузники New Baby 2 (4 - 8 кг) 17 шт";790135
;199;"REXONA антиперсперант для ног ДеоКонтроль Активная свежесть 150 мл";550030
;199;"МАЛЕНЬКАЯ ФЕЯ блеск для губ Happy Moments Малиновый Коктейль 1,3 г";720100
;199;"МАЛЮТКА молочная смесь 1 с рождения 600 г";770052
;199;"ПЕТРОВСКАЯ СЛОБОДА кофе растворимый 3в1 Сгущеное молоко 25 х 18 г";170289
;199;"ПРЕЛЕСТЬ лак для волос сверхсильной фиксации Чистый Стайлинг Expert Collection 300 мл";520616
;199;"СОЮЗГРИЛЬ Жидкость для розжига Зарница 1 л";250162
;199;"ЧИСТАЯ ЛИНИЯ лак для волос Термозащита легкий 160 мл";520549
;200;"BELLA влажные салфетки Happy для детей 56 шт";360117
;200;"CAFE CREME кофе растворимый дой-пак 100 г";110061
;200;"DOSIA стиральный порошок Color автомат 1,8 кг";410336
;200;"DOSIA стиральный порошок Альпийская свежесть автомат 1,8 кг";410327
;200;"FRESHLIGHT  гель для душа с экстрактом цветка Магнолии для девочек 300 мл";380184
;200;"FRESHLIGHT  шампунь для волос с экстрактом цветка Магнолии для девочек 300 мл";570241
;200;"FRESHLIGHT бальзам для волос с экстрактом цветка Лилии для девочек 300 мл";330051
;200;"FRESHLIGHT гель для душа с маслом семян Подсолнуха для девочек 300 мл";330290
;200;"FRESHLIGHT гель для душа с экстрактом цветка Магнолии для девочек 300 мл";330291
;200;"FRESHLIGHT гель для душа с экстрактом цветка Пиона для девочек 300 мл";330292
;200;"FRESHLIGHT шампунь Peony & Smooth Разглаживающий с экстрактом цветка пиона 300 мл";520842
;200;"FRESHLIGHT шампунь для волос с экстрактом цветка Магнолии для девочек 300 мл";330671
;200;"MEDLEX кожный антисептик (пенка) Бетасептин без спирта 180 мл";570169
;200;"MOSQUITALL спрей от комаров Гипоаллергенная Защита 100 мл";460157
;200;"ORAL-B Зубная щетка Pro-Expert Clinic Line Ortho";310215
;200;"QUALITA Салфетки вискозные для экспресс-уборки в рулоне 70 шт";250085
;200;"SANITA гель Жироудалитель Express 500 мл";430436
;200;"VORTEX чистящее средство для удаления плесени и грибка Fungus 500 мл";430409
;200;"ДОМИНГО Перчатки хозяйственные Brute прочные L";250146
;200;"ДОМИНГО Перчатки хозяйственные Brute прочные S";250147
;200;"ДОМИНГО перчатки хозяйственные Gadget Brute Экстрапрочные M";250189
;200;"ЛАПОЧКА шампунь-пенка Детский для чувствительной кожи головы 150 мл";330607
;200;"СОЮЗГРИЛЬ Брикеты угольные длительного горения 2 кг";210054
;201;"CAMAY антиперсперант аэрозольный Dynamique Grapefruit Динамик 150 мл";350078
;201;"CAMAY антиперсперант аэрозольный French Romantique Алые Розы 150 мл";350079
;201;"CAMAY антиперсперант аэрозольный Mademoiselle 150 мл";350080
;201;"DISCREET ежедневные прокладки Air Multiform 60 шт";340027
;201;"DISCREET ежедневные прокладки Deo Irresistible Multiform 60 шт";340045
;201;"DISCREET ежедневные прокладки Deo Spring Breeze Multiform 60 шт";340041
;201;"DISCREET ежедневные прокладки Deo Summer Fresh Multiform 60 шт";340044
;201;"DISCREET ежедневные прокладки Deo Water Lily Multiform 60 шт";340040
;201;"DISCREET ежедневные прокладки Normal 60 шт";340050
;201;"DISCREET ежедневные прокладки Normal Plus 50 шт";340060
;201;"KOTEX прокладки Ultra Soft Normal 20 шт";340162
;201;"KOTEX прокладки Ultra Soft Normal супермягкие 20 шт";340166
;201;"KOTEX прокладки Ultra Soft Супер супермягкие 16 шт";340168
;201;"KOTEX прокладки Ultra ночные 14 шт";380091
;201;"KOTEX прокладки Ultra супер 16 шт";340164
;201;"ROYAL SKIN крем для рук Water Drop с Экстрактом Лотоса 60 мл";540075
;201;"SPLAT Зубная паста Organic 75 мл";380100
;201;"SPLAT зубная паста Special Dream Отбеливающая 75 мл";380153
;201;"SPLAT зубная паста Special Sea Minerals 75 мл";310155
;201;"SPLAT зубная паста Stress Off комплексного действия 75 мл";310033
;201;"МАЙСКИЙ чай Благородный Цейлон чёрный пакетированный 100 шт";120183
;202;"BIONI молочко детское Увлажняющее с д-пантенолом 250 мл";720026
;202;"BREESAL ароматическое мини-саше Ассорти 19,5 г";440116
;202;"BREESAL ароматическое мини-саше Созерцание 3 шт";440117
;202;"BRIT Care сухой корм для котят, беременных и кормящих кошек 0,4 кг";620469
;202;"LORADO черника дробленая с сахаром 370 мл";160088
;202;"SUPRIM средство от накипи для стиральных машин 750 г";430335
;202;"TENA простыни впитывающие одноразовые Bed Underpads Normal 60x90см 5 шт";380040
;202;"КУБАНОЧКА масло подсолнечное рафинированное дезодорированное 2 л";150298
;202;"ЧИСТАЯ ЛИНИЯ молочко для тела Двойное Увлажнение медуница и таволга 250 мл";560052
;202;"ЧИСТАЯ ЛИНИЯ молочко для тела Упругость Черная смородина и Черемуха 250 мл";570176
;202;"ЧИСТАЯ ЛИНИЯ фитобальзам для тела Упругость и Питание 200 мл";560049
;203;"BEAUUGREEN гидрогелевая маска для лица Snail Perfect с Фильтратом Секреции Улитки";530269
;203;"GILLETTE Гель для бритья Mach 3 Extra Comfort 75 мл";320030
;203;"KOTEX тампоны с аппликатором Супер 8 шт";340234
;203;"LIBRESSE ежедневные прокладки Dailyfresh Normal 60 шт";340078
;203;"СОЛНЦЕ И ЛУНА прокладки на грудь 30 шт";780010
;203;"Я РОДИЛСЯ Средство для мытья посуды детское 1 л";740013
;204;"BIC станки для бритья одноразовые BIC metal 10 шт";320213
;204;"CJ LION средство для мытья посуды Chamgreen Гранат 450 мл";460241
;204;"DEPEND прокладки урологические Ultra Mini 22 шт";340150
;204;"FORESTER очиститель гелевый с алое-вера с дозатором 500 мл";250176
;204;"HILLS Science Plan сухой корм Small & Miniature для собак мелких пород c ягненком 300 г";620048
;204;"HILLS Science Plan сухой корм для кошек Optimal Care с курицей 0,4 кг";620481
;204;"LOVULAR влажные фито-салфетки для груди, сосок, пустышек 80 шт";360119
;204;"LUBBY бутылочка с соской Весёлые Животные с рождения 250 мл";780139
;204;"NATURA SIBERICA гель для душа витамины для кожи 400 мл";330299
;204;"NATURELLA ежедневные прокладки Calendula Tenderness Normal 60 шт";380088
;204;"NATURELLA ежедневные прокладки Camomile Plus 50 шт";340101
;204;"NATURELLA ежедневные прокладки Camomile Plus 58 шт";340095
;204;"ORAL-B Безалкогольный ополаскиватель для рта Pro-Expert Мульти-Защита 250 мл";310264
;204;"SECRET антиперспирант аэрозольный Актив 150 мл";350012
;204;"SECRET антиперспирант аэрозольный Деликат 150 мл";350011
;204;"SPLAT очищающая пенка для зубов и десен 2 в 1 Oral Care Foam с ароматом дикой малины 50 мл";310234
;204;"SPLAT очищающая пенка для зубов и десен 2 в 1 Oral Care Foam с ароматом мяты 50 мл";310230
;204;"TAMPAX тампоны Super 16 шт";340223
;204;"TAMPAX тампоны Super Plus 16 шт";340222
;204;"МИФ стиральный порошок Cвежий цвет автомат 2 кг";410383
;204;"МИФ стиральный порошок Морозная Свежесть автомат 2 кг";410390
;204;"МИФ стиральный порошок Свежесть Алоэ автомат 2 кг";410397
;204;"МИФ стиральный порошок Свежесть долины роз автомат 2 кг";410401
;204;"МИФ стиральный порошок Свежесть Лаванды и Ромашки автомат 2 кг";410405
;204;"ЧЕРНЫЙ ЖЕМЧУГ дневной крем Самоомоложение Программа от 56 лет 50 мл";530025
;204;"ЧЕРНЫЙ ЖЕМЧУГ молочко для снятия макияжа 200 мл";570262
;204;"ЧЕРНЫЙ ЖЕМЧУГ тоник-комфорт Освежающий для нормальной и комбинированной кожи 200 мл";530186
;204;"ЧЕРНЫЙ ЖЕМЧУГ тоник-комфорт Ухаживающий для сухой и чувствительной кожи 200 мл";530187
;204;"ЧИСТАЯ ЛИНИЯ Фито-дезодорант антиперспирант Защита Для Нежной Кожи 40 мл";350037
;204;"ЧИСТАЯ ЛИНИЯ Фито-дезодорант антиперспирант Защита От Запаха и Влаги 40 мл";350039
;205;"AXE гель для душа Dark Temptation 250 мл";330333
;205;"DURU Fresh Sensations мыло Mountain Air 4*115г";380138
;205;"DURU Мыло Горная свежесть 4x115 г";330542
;205;"DURU Мыло Океанский бриз 4x115 г";330539
;205;"DURU Мыло Цветочное облако 4x115 г";330538
;205;"FA жидкое мыло Гигиена&Защита Аромат Арбуза детское 250 мл";720075
;205;"FA жидкое мыло Греческий Йогурт Миндаль 250 мл";330405
;205;"FA жидкое мыло Йогурт Алоэ Вера 250 мл";330408
;205;"FA жидкое мыло Кокосовая Вода 250 мл";330406
;205;"FA жидкое мыло Медовый Эликсир 250 мл";330407
;205;"FA жидкое мыло Чистота и Свежесть Аромат Лайма 250 мл";330409
;205;"HILLS Natures Best сухой корм для кошек Naturally Gentle с курицей 0,4 кг";620437
;205;"O.B. тампоны Original Normal 16 шт";340228
;205;"O.B. тампоны Original Super 16 шт";340229
;205;"OLD SPICE гель для душа Blocker Sport 250 мл";330317
;205;"OLD SPICE гель для душа Original 250 мл";330323
;205;"OLD SPICE гель для душа Strong Slugger 250 мл";330324
;205;"OLD SPICE шампунь 2 в 1 Citron 250 мл";330811
;205;"OLD SPICE шампунь 2 в 1 Oхлаждающий 250 мл";330808
;205;"PICNIC комплект фумигатор + жидкость Baby 45 ночей 30 мл";460174
;205;"SYNERGETIC моющее cредство для сантехники 1 л";430510
;205;"БОЛЬШАЯ СТИРКА Шампунь для чистки ковров 1000 мл";430289
;205;"МАЛЕНЬКАЯ ФЕЯ гель для душа Happy Moments Модный 250 мл";330203
;205;"МАЦЕСТА ЧАЙ листовой Клубника со Сливками черный 75 г";120174
;205;"ПРЕЛЕСТЬ шампунь Интенсивное питание для окрашенных волос 600 мл";520870
;205;"ПРЕЛЕСТЬ шампунь Кератинотерапия Expert Collection для любого типа волос 600 мл";520872
;205;"ПРЕЛЕСТЬ шампунь Объем и питание для любого типа волос 600 мл";520874
;205;"ПРЕЛЕСТЬ шампунь Рост и Сила с Аргинином и экстрактом бамбука для всех типов волос 600 мл";520881
;205;"ПРЕЛЕСТЬ шампунь Увлажнение и защита 600 мл";330583
;205;"ПРЕЛЕСТЬ шампунь Эффект ламинирования для нормальных и лишенных блеска волос 600 мл";520868
;206;"AOS средство для мытья посуды Масло Розы 1 л";430192
;206;"AOS средство для мытья посуды Фитокомплекс 7 Трав 1 л";430187
;206;"GILLETTE станки для бритья Одноразовые Blue Simple3 4 шт";320233
;206;"GILLETTE станки для бритья Одноразовые BLUE2 Max 4 шт";320225
;206;"ITALICA кофе растворимый дой-пак 100 г";110088
;206;"АНТИПЯТИН пятновыводитель гель 250 мл";460257
;206;"ДОМИНГО Пакеты для мусора 120 л 10 шт";250130
;206;"МОСКОВСКАЯ КОФЕЙНЯ НА ПАЯХ кофе растворимый Суаре дой-пак 75 г";110142
;206;"ЧИСТАЯ ЛИНИЯ BB‑крем Идеальная Кожа 10в1 40 мл";510134
;206;"ЧИСТАЯ ЛИНИЯ лак для волос Экстрафиксация 200 мл";520548
;207;"CJ LION средство для мытья посуды Chamgreen Японский Абрикос мягкая упаковка 960 мл";430211
;207;"JACOBS кофе растворимый Monarch Velour 70 г";110115
;207;"NATURA SIBERICA шампунь для окрашенных волос защита и блеск 500 мл";520858
;207;"NIVEA гель для душа Крем Абрикос 250 мл";330332
;207;"NIVEA гель для душа Крем Какао 250 мл";330308
;207;"NIVEA гель для душа Крем Карамболь 250 мл";330310
;207;"NIVEA гель для душа Увлажнение и Забота 250 мл";330314
;207;"БОЛЬШАЯ СТИРКА отбеливатель Baby с активным кислородом 1 л";740019
;207;"БОЛЬШАЯ СТИРКА пятновыводитель Baby с активным кислородом 1 л";740020
;207;"ЧИСТАЯ ЛИНИЯ молочко для тела Интенсивное питание 200 мл";560053
;208;"ALWAYS ежедневные прокладки Normal 40 шт";340055
;208;"DOVE крем для лица и тела Питательный 75 мл";530061
;208;"FA Men дезодорант аэрозольный Polar 150 мл";350234
;208;"FA Men дезодорант аэрозольный Sport Двойное Действие Взрыв Свежести 150 мл";350235
;208;"FA Men дезодорант аэрозольный Sport Перезарядка 150 мл";350236
;208;"FA Men дезодорант аэрозольный Xtreme Invisible 150 мл";350239
;208;"FA Men дезодорант аэрозольный Xtreme Power+ 150 мл";350240
;208;"FA Men дезодорант аэрозольный Охлаждение Экстрим 150 мл";350230
;208;"FA Men дезодорант аэрозольный Сила Притяжения 150 мл";350231
;208;"FA Men дезодорант аэрозольный Уход и Свежесть 150 мл";350233
;208;"FA дезодорант аэрозольный Dry Protect Нежность Хлопка 150 мл";350111
;208;"FA дезодорант аэрозольный Floral Protect Орхидея&Фиалка 150 мл";350115
