;416;"NUK бутылочка с соской First Choice Plus с рождения 300 мл";780141
;417;"ENERGIZER батарейки MAX D/LR20 2 шт";240082
;417;"LACALUT зубная паста White&Repair для бережного отбеливания и репарации эмали зубов 75 мл";310030
;418;"LIBERO влажные салфетки Baby Care 2x64 шт";360163
;418;"LOREAL крем после бритья Гидра Сенситив 75 мл";320117
;418;"LOREAL крем после бритья Гидра Энергетик Увлажнение 75 мл";320116
;418;"ROYAL CANIN VET DIET сухой корм для котов Skin Young Male 0,4 кг";620454
;418;"ROYAL CANIN VET DIET сухой корм для кошек Neutered Young Female 0,4 кг";620417
;418;"ROYAL CANIN сухой корм для кошек Persian 0,4 кг";610228
;418;"ROYAL CANIN сухой корм для кошек Sphynx 0,4 кг";620405
;419;"CURTIS чай пакетированный Fantasy Garden ассорти пирамидки 70,5 г";120068
;419;"LACTACYD средство для интимной гигиены ежедневное 200 мл";330352
;420;"MONGE корм для стерилизованных кошек Cat Sterilised 400г";610126
;420;"ZEWA туалетная бумага Just 1 четырехслойная без аромата 8 шт";360193
;421;"BAGI Средство для чистки Акрилан спрей 400 мл";430447
;421;"GARNIER молочко для тела Ультраупругость 250 мл";560061
;421;"ROYAL CANIN VET DIET сухой корм для кошек Senior Consult Stage 2 0,4 кг";620435
;422;"ROYAL CANIN VET DIET сухой корм для кошек Skin Young Female 0,4 кг";620455
;422;"ROYAL CANIN сухой корм для кошек Bengal 0,4 кг";620562
;423;"ROYAL CANIN VET DIET сухой корм для котов Neutered Young Male 400+160 г";610334
;424;"HELEN HARPER Детские впитывающие пеленки Soft & Dry 60x60 30 шт";710107
;424;"JOHNSON’S Baby гель для стирки Для Маленьких Непосед 1 л";740031
;424;"JOHNSON’S Baby гель для стирки Для Самых Маленьких 1 л";740030
;424;"LET ME SKIN маска альгинатная Ultra H2O увлажняющая 50+5 г";530330
;424;"ORGANIC PETS шампунь-кондиционер для собак и кошек натуральный гипоаллергенный  500 мл";620379
;424;"ROYAL CANIN VET DIET сухой корм для кошек Senior Consult Stage 1 0,4 кг";620425
;424;"ROYAL CANIN сухой корм для кошек Digestive Care 0,4 кг";620409
;424;"ROYAL CANIN сухой корм для кошек Hair & Skin Care 0,4 кг";620411
;424;"ROYAL CANIN сухой корм для кошек Urinary Care 0,4 кг";620497
;424;"TAFT спрей-пудра для укладки волос Объем и Свежесть Экстраобъем от корней 200 мл";520730
;425;"GREEN LOVE средство для стирки 1,35 л";460372
;426;"DEONICA сменные кассеты для бритья FOR MEN 6 лезвий 2 шт";320148
;426;"GARNIER драгоценное молочко красоты 250 мл";560058
;426;"GILLETTE подарочный набор Mach3 станок для бритья с 1 сменной кассетой + гель для бритья Extra Comfort 75 мл";320202
;426;"GILLETTE станок для бритья Mach3 Start с 1 сменной кассетой";320247
;426;"LIBERO подгузники Comfort 3 (4 - 9 кг) 22 шт";710345
;426;"NIVEA гель для бритья 3-Дневной Щетины для чувствительной кожи 200 мл";320048
;426;"NIVEA гель для бритья Ultra 200 мл";320051
;426;"NIVEA гель для бритья Восстанавливающий для чувствительной кожи 200 мл";320049
;426;"NIVEA гель для бритья Охлаждающий 200 мл";320047
;426;"NIVEA гель для бритья Увлажняющий 200 мл";320050
;426;"NIVEA гель для бритья Успокаивающий для чувствительной кожи 200 мл";320046
;426;"NIVEA гель для бритья Экстремальная Свежесть 200 мл";320092
;426;"NIVEA гель для душа Заряд Чистоты 500 мл";330302
;426;"NIVEA гель для душа Пробуждающий 500 мл";330304
;426;"NIVEA гель для душа Спорт 500 мл";330303
;426;"ROYAL CANIN сухой корм для котят Kitten Maine Coon 400+400 г";610269
;426;"ROYAL CANIN сухой корм для кошек British Shorthair 0,4 кг";620413
;426;"ROYAL CANIN сухой корм для кошек Maine Coon 0,4 кг";620412
;426;"ROYAL CANIN сухой корм для кошек Maine Coon 400+400 г";620414
;426;"БИОЛАН стиральный порошок Color автомат 6 кг";410294
;426;"БИОЛАН стиральный порошок Белые Цветы автомат 6 кг";410290
;427;"FARMSTAY многофункциональный смягчающий гель Moisture Soothing Gel Snail с экстрактом улитки 300 мл";530064
;427;"KABRITA каша на козьем молочке 7 Злаков с Бананом с 6 месяцев 180 г";770049
;428;"BAGI чистящее средство Мастика для Полировки Полов 500 мл";430101
;428;"BAGI чистящее средство Супер Кожа для Чистки и Ухода 400 мл";430286
;428;"YOUR SUN подгузники L (9-13кг) 52 шт";710463
;428;"YOUR SUN подгузники M  (5-10кг) 60 шт";790188
;429;"8 IN 1 шампунь для кошек и собак PC Shed Control & Hairball против линьки и колтунов с тропическим ароматом 295 мл";620375
;429;"AVENT пустышка силиконовая ортодонтическая Ночная SCF176/22 (6-18 месяцев) 2 шт";780185
;429;"DURACELL батарейка CR2 3V для фотоаппаратов 1 шт";240044
;429;"JACOBS кофе растворимый Gold 140 г";110095
;429;"JACOBS кофе растворимый Monarch 150 г";110103
;429;"LOREAL мицеллярная вода Бифазная для всех типов кожи 400 мл";530133
;429;"MAYBELLINE тональный крем для лица Fit Me матирующий скрывающий поры оттенок 104 ванильно-бежевый 30 мл";510175
;429;"MAYBELLINE тональный крем для лица Fit Me матирующий скрывающий поры оттенок 105 светло-бежевый 30 мл";510176
;429;"SOMAT ополаскиватель для посудомоечных машин 750 мл";430176
;429;"VERNEL кондиционер для белья Supreme Romance 1,2 л";410161
;429;"VERNEL кондиционер для белья Ароматерапия белый пион & масло хлопка 1,8 л";460333
;429;"VERNEL кондиционер для белья Ароматерапия дикий гибикус & масло розы 1,8 л";460254
;429;"VERNEL кондиционер для белья Ароматерапия цветок ванили & цитрусовое масло 1,8 л";410153
;429;"VERNEL кондиционер для белья Ароматерапия черная орхидея & масло пачули 1,8 л";410151
;429;"VERNEL кондиционер для белья Детский 1,8 л";790180
;429;"VERNEL кондиционер для белья Свежесть Прованса 1,8 л";410164
;430;"LION стиральный порошок Голубой Бриллиант автомат 900 г";410354
;430;"SYOSS шампунь Keratin Hair Perfection для сухих и безжизненных волос 500 мл";330910
;430;"SYOSS шампунь Pure&Care Балансирующий 500 мл";330915
;431;"AVENT пустышка силиконовая ортодонтическая Classic SCF195/03 (0-6 месяцев) 2 шт";780182
;431;"BAGI Средство для чистки Шуманит Жироудалитель 0,4 л";460403
;431;"GLISS KUR маска для волос Экстремальное Восстановление 200 мл";520077
;431;"ROYAL CANIN сухой корм для кошек Siamese 0,4 кг";620537
;431;"ROYAL CANIN сухой корм для кошек Siberian Adult 0,4 кг";620490
;432;"KLEENEX салфетки универсальные Viva в рулоне1 шт";250081
;432;"LOREAL скраб Pure Zone Глубокое очищение 7 в 1";530154
;432;"WELLAFLEX набор лак для волос суперсильной фиксации 250 мл + спрей для горячей укладки 150 мл";520788
;434;"GREEN LOVE средство для стирки детского белья 1,35 л";460356
;434;"WELLAFLEX набор лак для волос Блеск и Фиксация 250 мл + муcc для укладки";520784
;435;"DEONICA сменные кассеты для бритья FOR WOMEN 5 лезвий 2 шт";320147
;435;"ORGANIC PETS шампунь-кондиционер для собак длинношерстных пород натуральный 500 мл";620378
;435;"ROYAL CANIN сухой корм Digestive Care Mini для собак мелких размеров с расстройствами пищеварния 0,8 кг";620111
;435;"ROYAL CANIN сухой корм Mini Adult для собак мелких пород старше 10 месяцев 0,8 кг";620522
;435;"ROYAL CANIN сухой корм Mini Dermacomfort для собак мелких пород с повышенной чувствительностью кожи 800 г";620180
;435;"ROYAL CANIN сухой корм для кошек Hairball Care 0,4 кг";620410
;435;"ROYAL CANIN сухой корм для кошек Light Weight Care 0,4 кг";620402
;435;"ROYAL CANIN сухой корм для кошек Oral Care 0,4 кг";620429
;436;"ARIEL cтиральный порошок Аромат Вербены автомат 3 кг";410211
;436;"ARIEL cтиральный порошок Аромат Масла Ши автомат 3 кг";410207
;436;"ARIEL гель для стирки Color 1,3 л";410218
;436;"ARIEL Гель для стирки Touch of Lenor fresh 1,1 л";410228
;436;"ARIEL гель для стирки Аромат Масла Ши 1,3 л";410216
;436;"ARIEL Гель для стирки в капсулах Color & Style автомат 15 шт";410235
;436;"ARIEL Гель для стирки в капсулах Touch of Lenor Fresh автомат 15 шт";410242
;436;"ARIEL Гель для стирки в капсулах Аромат Масла Ши автомат 15 шт";410230
;436;"ARIEL Гель для стирки в капсулах Горный родник автомат 15 шт";410238
;436;"ARIEL Гель для стирки Горный родник 1,1 л";410223
;436;"ARIEL Гель для стирки Для чувствительной кожи 1,1 л";410222
;436;"ARIEL стиральный порошок Color автомат 3 кг";410245
;436;"ARIEL стиральный порошок Touch of Lenor Fresh автомат 3 кг";410262
;436;"ARIEL стиральный порошок Горный родник автомат 3 кг";410254
;436;"ARIEL стиральный порошок Нежный пион автомат 3 кг";460283
;436;"PIGEON прорезыватель обучающий Step1 Цветочек 1 шт";780176
;436;"TAFT жидкость для укладки волос Объем №3 Очень Сильная Фиксация 150 мл";520731
;436;"TAFT спрей для укладки волос Power Экспресс-Укладка №5 Мегафиксация 150 мл";520728
;436;"TAFT спрей для укладки волос Густые и Пышные Сверхсильная Фиксация 150 мл";520727
;437;"RAFFAELLO набор конфет 240 г";140059
;438;"FRUCTIS масло-эликсир Fructis Преображение 150 мл";520129
;438;"LIBERO подгузники-трусики Up & Go 5 (10 - 14 кг) 16 шт";710327
;438;"LIBERO подгузники-трусики Up & Go 6 (13 - 20 кг) 14 шт";710328
;438;"PAMPERS подгузники-трусики 4 (9 - 14 кг) 16 шт";710329
;438;"PAMPERS подгузники-трусики 5 (12 - 18 кг) 15 шт";710330
;438;"PAMPERS подгузники-трусики Pants 3 (6 - 11 кг) 19 шт";710331
;438;"PAMPERS подгузники-трусики Pants 6 (16+ кг) 14 шт";710332
;438;"PIGEON ножницы детские 1 шт";720010
;439;"CJ LION шампунь Dhama Для сухих и ломких волос 400 мл";520839
;439;"MACCOFFEE кофе растворимый The Original 50x20 г";110136
;439;"N1 игрушка для собак Петух с пищалкой средний 23 см";620503
;439;"SHOCKWAVES лак для волос Ultimate Hold 400 мл";520632
;440;"ATTACK концентрированный стиральный порошок Multi-Action 810 г";410267
;440;"BIC станок для бритья Flex 3 Hybrid с 4 сменными кассетами";320222
;440;"SYOSS краска для волос Color Красное дерево 4-2";570107
;440;"SYOSS краска для волос Color Морозный каштановый 5-24";570114
;440;"SYOSS краска для волос Color Платиновый осветлитель 13-5";520478
;440;"SYOSS краска для волос Color Ультра осветлитель 13-0";560120
;440;"SYOSS краска для волос Color Ультраплатиновый блонд 10-55";570187
;440;"SYOSS спрей для волос Root Retoucher Тонирующий Каштановый 120 мл";520679
;440;"SYOSS спрей для волос Root Retoucher Тонирующий Черный 120 мл";520524
;441;"BRIT сухой корм Premium Lamb&Rice Sensitive для собак 1 кг";620034
;441;"ID простыни впитывающие Disposable Underpads 60x60 30 шт";380037
;441;"N1 наполнитель Naturel Зеленый Чай для кошачьего туалета комкующийся 4,5 л";610522
;441;"N1 наполнитель Naturel Растительный для кошачьего туалета комкующийся 4,5 л";610521
;441;"ROYAL CANIN сухой корм Jack Russel Junior для щенков Джек-рассел-терьера 500 г";620529
;441;"ROYAL CANIN сухой корм для щенков породы Чихуахуа до 8 месяцев 0,5 кг";620114
;441;"SEEBERGER смесь кешью и клюквы 150 г";170208
;442;"BIC кассеты для бритья Flex 5 Hybrid 2 шт";320134
;442;"ROYAL SKIN очищающая пенка для умывания с Коллагеном 150 мл";530238
;442;"МАКФА мука Высший Сорт 10 кг";150252
;443;"AVENT пустышка силиконовая ортодонтическая Mini SCF151/00 (0-2 месяцев) 1 шт";780201
;444;"ELIZAVECCA эссенция для волос Milky Piggy Collagen Coating Protein Ion Injection 50 мл";520120
;444;"FAIRY Капсулы для посудомоечных машин Platinum 18 шт";430158
;445;"BREF туалетный блок Blue Aktiv цветочная свежесть 3 шт";460407
;445;"BREF туалетный блок Сила-Актив лимонная свежесть 3 шт";460423
;445;"BREF туалетный блок Сила-Актив океанский бриз 3 шт";460421
;445;"BREF туалетный блок Сила-Актив свежесть лаванды 3 шт";460422
;445;"ELSEVE двойной эликсир для волос Роскошь 6 Масел 200 мл";520123
;445;"ELSEVE эликсир для волос двухфазный Полное Восстановление 5 200 мл";520124
;446;"GOT2B пудра для укладки Мгновенный Объем 10 г";520568
;446;"JACOBS кофе растворимый Intense 150 г";110097
;446;"MAYBELLINE тональный крем Fit Me 111 ванильно-розовый 30 мл";510182
;446;"MAYBELLINE тональный крем Fit Me 112 теплый бежевый 30 мл";510183
;446;"ROYAL CANIN VET DIET сухой корм Neutered Satiety Balance для кошек с момента стерилизации до 7 лет 0,4 кг";620430
;446;"SENI прокладки урологические Lady plus 15 шт";380142
;446;"VERNEL кондиционер для белья Цветущий Миндаль 1,8 л";410157
;446;"ФОТОН Удлинитель сетевой с заземлением с выключателем 16-35ЕS, 5 розеток, 3м, 16А";240017
;447;"DOVE масло-сыворотка для волос Advanced Hair Series Прогрессивное Восстановление 50 мл";520118
;448;"FA Men гель для душа Sport мужской 750 мл";330262
;448;"FA гель для душа Греческий Йогурт Миндаль 750 мл";330277
;448;"FA гель для душа Йогурт Алоэ Вера 750 мл";330270
;448;"FA гель для душа Природная Свежесть Белый чай 750 мл";330268
;448;"FA гель для душа Энергия&Витамины Розовый Грейпфрут 750 мл";330278
;448;"LOREAL маска для лица Возраст Эксперт 55+ 50 мл";530344
;448;"LOREAL уход-скульптор Возраст Эксперт 45+ для лица, шеи и зоны декольте 50 мл";530096
;448;"LOREAL уход-скульптор Возраст Эксперт 55+ для лица, шеи и зоны декольте 50 мл";530097
;448;"Я РОДИЛСЯ стиральный порошок детский Color автомат 2,4 кг";740033
;449;"8 IN 1 Косточка для мелких собак  с Говядиной DELIGHTS Beef XS 7,5 см 7 шт";620339
;449;"BEOLOGY спрей для укладки Deep Sea Extract Увлажнение для сухих волос 150 мл";520547
;449;"FARMSTAY многофункциональная сыворотка Honey с медом 250 мл";530314
;449;"N1 наполнитель для кошачьего туалета Crystals 5 л";610512
;450;"AVENT бутылочка с соской Standart SCF972/17 с 6 месяцев 280 мл";780106
;450;"BRADEX игра настольная Кто в Яйце";790106
;450;"GARDEX Браслет от комаров со сменным картриджем";460117
;450;"GARNIER cкраб для тела Драгоценный 200 мл";560036
;450;"SORTI стиральный порошок Активный кислород автомат 6 кг";410449
;450;"TIRET Гель для удаления засоров в трубах Professional 1 л";430321
;451;"BAGI Средство для чистки Шуманит для стеклокерамики 0,5 л";460401
;451;"ID подгузники для взрослых Slip M (80-110 см) 10 шт";380018
;451;"SYOSS бальзам для волос Color full Оттеночный Глубокий каштановый 150 мл";570106
;451;"SYOSS бальзам для волос Color full Оттеночный Золотистый блонд 150 мл";570103
;451;"SYOSS бальзам для волос Color full Оттеночный Медный 150 мл";570104
;451;"SYOSS бальзам для волос Color full Оттеночный Платиновый блонд 150 мл";570101
;451;"SYOSS бальзам для волос Color full Оттеночный Рубиновый 150 мл";560115
;451;"SYOSS бальзам для волос Color full Оттеночный Теплый каштановый 150 мл";520474
;451;"SYOSS бальзам для волос Color full Оттеночный Холодный блонд 150 мл";570102
;451;"SYOSS бальзам для волос Color full Оттеночный Холодный каштановый 150 мл";570105
;451;"SYOSS бальзам для волос Color full Оттеночный Черный 150 мл";570099
;452;"SEN SOY набор для приготовления суши";150021
;454;"BAGI Средство для чистки Шуманит Жироудалитель пена 0,4 л";460404
;454;"BRIT Care сухой корм Adult Small для собак мелких пород 1 кг";620016
;454;"PIGEON прорезыватель обучающий Step1 1 шт";780197
;455;"N1 наполнитель для кошачьего туалета Crystals антибактериальный 5 л";610514
;456;"DURACELL батарейки Industrial AA 10 шт";240064
;456;"DURACELL батарейки Industrial AAA 10 шт";240065
;456;"ID подгузники для взрослых Slop Basic L 10 шт";380022
;456;"LIBERO подгузники Comfort 5 (10 - 16 кг) 18 шт";710353
;456;"LIBERO подгузники Comfort 6 (12 - 22 кг) 16 шт";710354
;456;"LOREAL cтойкая краска для волос Casting Creme Gloss 100 Черная ваниль";520297
;456;"LOREAL cтойкая краска для волос Casting Creme Gloss 1013 Светло-светло-русый бежевый";570205
;456;"LOREAL cтойкая краска для волос Casting Creme Gloss 1021 Светло-светло-русый перламутровый";570126
;456;"LOREAL cтойкая краска для волос Casting Creme Gloss 200 Черный кофе";570121
;456;"LOREAL cтойкая краска для волос Casting Creme Gloss 300 Двойной эспрессо";570119
;456;"LOREAL cтойкая краска для волос Casting Creme Gloss 323 Черный шоколад";570124
;456;"LOREAL cтойкая краска для волос Casting Creme Gloss 400 Каштан";560108
;456;"LOREAL cтойкая краска для волос Casting Creme Gloss 412 Какао со льдом";560109
;456;"LOREAL cтойкая краска для волос Casting Creme Gloss 415 Морозный каштан";560110
;456;"LOREAL cтойкая краска для волос Casting Creme Gloss 432 Шоколадный трюфель";520298
;456;"LOREAL cтойкая краска для волос Casting Creme Gloss 503 Шоколадная глазурь";570202
;456;"LOREAL cтойкая краска для волос Casting Creme Gloss 513 Морозный капучино";560111
;456;"LOREAL cтойкая краска для волос Casting Creme Gloss 515 Морозный шоколад";570125
;456;"LOREAL cтойкая краска для волос Casting Creme Gloss 525 Шоколадный фондан";570123
;456;"LOREAL cтойкая краска для волос Casting Creme Gloss 535 Шоколад";570199
;456;"LOREAL cтойкая краска для волос Casting Creme Gloss 600 Темно-русый";570122
;456;"LOREAL cтойкая краска для волос Casting Creme Gloss 603 Молочный шоколад";570198
;456;"LOREAL cтойкая краска для волос Casting Creme Gloss 635 Шоколадное пралине";520300
;456;"LOREAL cтойкая краска для волос Casting Creme Gloss 680 Шоколадный Мокко";570118
;456;"LOREAL cтойкая краска для волос Casting Creme Gloss 724 Карамель";570200
;456;"LOREAL cтойкая краска для волос Casting Creme Gloss 7304 Пряная карамель";570204
;456;"LOREAL cтойкая краска для волос Casting Creme Gloss 780 Ореховый мокко";570120
;456;"LOREAL cтойкая краска для волос Casting Creme Gloss 8031 Cветло-русый золотисто-пепельный";520301
;456;"LOREAL cтойкая краска для волос Casting Creme Gloss 810 Светло-русый перламутровый";560112
;456;"LOREAL cтойкая краска для волос Casting Creme Gloss 832 Крем-брюле";560113
;456;"LOREAL стойкая краска для волос Casting Creme Gloss оттенок 302 Ледяной Фраппучино";520344
;456;"NIVEA подарочный набор Энергия Молодости дневной + ночной крема 35+ 50 мл";530111
;456;"OLD SPICE Лосьон после бритья Lagoon 100 мл";320132
;456;"OLD SPICE Лосьон после бритья Whitewater 100 мл";320131
;456;"OLD SPICE Лосьон после бритья Wolfthorn 100 мл";320130
;456;"PERFECT FIT сухой корм In-home для домашних кошек 1,2 кг";610439
;456;"PERFECT FIT сухой корм Sensitive для кошек с чувствительным пищеварением с индейкой 1,2 кг";610132
;456;"PERFECT FIT сухой корм Sensitive для кошек с чувствительным пищеварением с индейкой 1.2 кг";610446
;458;"DOVE Подарочный набот Крем-гель для душа Dove с Драгоценными маслами 250 мл + Крем-гель для душа Dove Фисташковый крем и магнолия 250 мл и мочалка в подарок.";570016
;458;"NIVEA молочко для тела Нежная Кожа 250 мл";560073
;458;"NIVEA молочко для тела Питательное 250 мл";560074
