"Короткое название";"Цена_Трансазия";"Цена_Розничная";"Оценка товарного запаса";"Артикул";"Показывать товар"
"BELLA Baby подгузники Happy Junior 5 (12-25 кг) 58 шт";995;1244;5;710440;1
"BELLA Baby подгузники Happy Mini 2 (3-6 кг) 38 шт";496;620;15;790162;1
"СОЛНЦЕ И ЛУНА подгузники для детей Мягкая Забота 5 (11-25 кг) 58 шт";698;872;5;710376;1
"BELLA Baby подгузники Happy Newborn 1 (2-5 кг) 42 шт";487;609;15;790161;1
"СОЛНЦЕ И ЛУНА подгузники-трусики Нежное Прикосновение 4 (9-14 кг) 43 шт";734;918;25;710382;1
"СОЛНЦЕ И ЛУНА подгузники-трусики Нежное Прикосновение 4 (9-14 кг) 14 шт";248;310;25;710288;1
"СОЛНЦЕ И ЛУНА подгузники для детей Нежное Прикосновение 5 (11-25 кг) 12 шт";225;281;25;710278;1
"СОЛНЦЕ И ЛУНА подгузники для детей Нежное Прикосновение 3 (4-9 кг) 14 шт";211;264;25;710263;1
"HELEN HARPER трусики-подгузники Soft&Dry Pants Junior 5 (12-18 кг) 64 шт";1044;1305;5;710519;1
"LOVULAR трусики-подгузники Giraffe L (9-14 кг) 50 шт";1154;1442;5;710131;1
"LOVULAR трусики-подгузники L (9-14 кг) 19 шт";528;660;15;790164;1
"LOVULAR трусики-подгузники XL (12-17 кг) 18 шт";542;678;5;710363;1
"LOVULAR трусики-подгузники XXL (15-25 кг) 17 шт";549;686;5;710364;1
"HELEN HARPER детские подгузники Soft & Dry XL (15-30кг) 40 шт";628;785;5;790163;1
"HELEN HARPER трусики-подгузники Soft&Dry Maxi 4 (8-13кг) 50 шт";831;1039;25;710523;1
"HELEN HARPER трусики-подгузники Soft&Dry Junior 5 (12-18кг) 46 шт";831;1039;25;710524;1
"HELEN HARPER трусики-подгузники Soft&Dry XL 6 (18+ кг) 44 шт";831;1039;15;710520;1
"HUGGIES подгузники Elite Soft 1 (до 5кг) 27 шт";523;654;15;710361;1
"HUGGIES подгузники Elite Soft 1 (до 5кг) 84 шт";1314;1642;15;710179;1
"HUGGIES подгузники Elite Soft 2 (3-6кг) 27 шт";523;654;25;710362;1
"HUGGIES подгузники Elite Soft 2 (3-6кг) 66 шт";905;1131;25;710135;1
"HUGGIES подгузники Elite Soft 2 (3-6кг) 88 шт";1424;1780;25;710206;1
"HUGGIES подгузники Elite Soft 3 (5-9кг) 21 шт";700;875;25;710377;1
"HUGGIES подгузники Elite Soft 3 (5-9кг) 80 шт";2444;3055;25;710285;1
"HUGGIES подгузники Elite Soft 4 (8-14кг) 19 шт";733;916;15;710381;1
"HUGGIES подгузники Elite Soft 4 (8-14кг) 66 шт";2444;3055;25;710286;1
"HUGGIES подгузники Elite Soft 5 (12-22кг) 56 шт";2444;3055;25;710287;1
"HUGGIES подгузники Elite Soft 3 (5-9кг) 40 шт";1195;1494;15;710144;1
"HUGGIES подгузники Elite Soft 4 (8-14кг) 33 шт";1195;1494;15;710145;1
"HUGGIES подгузники Elite Soft 5 (12-22кг) 28 шт";1195;1494;5;710146;1
"HELEN HARPER Детские впитывающие пеленки Baby 60x60 5 шт";96;120;5;710112;1
"HELEN HARPER Детские впитывающие пеленки Baby 60х90 5 шт";125;156;15;710102;1
"LIBERO пеленки одноразовые 50x70 6 шт";183;229;25;710104;1
"HELEN HARPER Детские впитывающие пеленки Soft & Dry 40х60 5 шт";60;75;25;710515;1
"СОЛНЦЕ И ЛУНА пеленки впитывающие 60x60 5 шт";98;122;25;790157;1
"JOHNSON'S Baby влажные салфетки детские Pure Protect 25 шт";84;105;15;360156;1
"JOHNSON'S Baby влажные салфетки детские Нежная забота 64 шт";128;160;25;360157;1
"СОЛНЦЕ И ЛУНА влажные салфетки детские с экстрактом алоэ 63 шт";70;88;25;360131;1
"LIBERO влажные салфетки Baby Care 64 шт";186;232;25;360162;1
"LIBERO влажные салфетки Baby Care 2x64 шт";334;418;25;360163;1
"PAMPERS влажные салфетки Sensitive 12 шт";32;40;15;360178;1
"PAMPERS влажные салфетки Baby Fresh Clean 2х64 шт";229;286;25;360115;1
"PAMPERS влажные салфетки Baby Fresh Clean 4x64";402;502;25;360172;1
"PAMPERS влажные салфетки Sensitive 4x56 шт";402;502;25;360175;1
"PAMPERS влажные салфетки Sensitive 2x56 шт";249;311;25;360176;1
"МОЕ СОЛНЫШКО влажные салфетки Универсальные 70 шт";84;105;5;360129;1
"LURE влажные салфетки для детей с крышкой 120 шт";85;106;25;380165;1
"СОЛНЦЕ И ЛУНА влажные салфетки Нежное Прикосновение с крышкой 63 шт";86;108;25;360134;1
"PIGEON влажные салфетки для детей (0+ мес) 70 шт";202;252;5;360180;1
"MANUOKI влажые салфетки для детей 20 шт";40;50;5;360169;1
"BELLA влажные салфетки Happy для детей 56 шт";160;200;5;360117;1
"СОЛНЦЕ И ЛУНА влажные салфетки Для Детей с экстрактом алоэ 63 шт";70;88;25;360121;1
"СОЛНЦЕ И ЛУНА влажные салфетки Для Детей с экстрактом алоэ 15 шт";23;29;25;360132;1
"СОЛНЦЕ И ЛУНА влажные салфетки Нежное Прикосновение для детей 54 шт";70;88;25;360126;1
"СОЛНЦЕ И ЛУНА влажные салфетки Нежное Прикосновение для детей 15 шт";26;32;25;360127;1
"СОЛНЦЕ И ЛУНА влажные салфетки Для Новорожденных 54 шт";75;94;25;360124;1
"СОЛНЦЕ И ЛУНА влажные салфетки для детей Фитолиния с отваром череды и облепихи с крышкой 56 шт";74;92;25;380166;1
"LOVULAR влажные фито-салфетки для груди, сосок, пустышек 40 шт";105;131;25;360118;1
"KLEENEX влажные салфетки Дисней 40 шт";171;214;25;360161;1
"KLEENEX влажные салфетки Дисней антибактериальные 10 шт";57;71;25;360159;1
"HUGGIES влажные салфетки Classic 128 шт";263;329;25;360154;1
"HUGGIES влажные салфетки Ultra Comfort алоэ 128 шт";302;378;5;360152;1
"HUGGIES влажные салфетки Ultra Comfort алоэ 64 шт";171;214;15;360150;1
"HUGGIES влажные салфетки Elite Soft 128 шт";302;378;25;360151;1
"HUGGIES влажные салфетки Elite Soft 64 шт";171;214;25;360149;1
"HUGGIES влажные салфетки Classic 64 шт";151;189;25;360153;1
"LOVULAR влажные салфетки Календула 62 шт";93;116;25;710101;1
"JOHNSON'S Baby Гель-пена для купания 2 в 1 Веселые пузырьки 300 мл";202;252;5;720028;1
"JOHNSON'S Baby Пена для купания Перед сном 300 мл";202;252;15;720027;1
"ГАДКИЙ Я гель для душа Банан 250 мл";99;124;15;720033;1
"ГАДКИЙ Я гель для душа Тропический микс 250 мл";99;124;25;720034;1
"МОЕ СОЛНЫШКО пена для купания Баю-баюшки 200 мл";67;84;25;720032;1
"МОЕ СОЛНЫШКО пенка для купания С чередой 200 мл";63;79;25;720031;1
"МОЕ СОЛНЫШКО Пенка для купания Медовая дыня 200 мл";56;70;25;720030;1
"ЛАПОЧКА крем-гель для купания 300 мл";107;134;25;720018;1
"ЛАПОЧКА пена для ванн детская 300 мл";107;134;25;720020;1
"ЛАПОЧКА средство для купания От Макушки до Пяток детское 300 мл";107;134;25;720019;1
"МАЛЕНЬКАЯ ФЕЯ гель для душа Happy Moments Фруктовая Сказка 240 мл";162;202;25;330202;1
"СОЛНЦЕ И ЛУНА средство для купания 2-в-1 Принцесса для девочек 200 мл";56;70;15;330175;1
"СОЛНЦЕ И ЛУНА средство для купания 2-в-1 Супермен для мальчиков 200 мл";56;70;15;330176;1
"СОЛНЦЕ И ЛУНА средство для купания 2-в-1 Пони для девочек 200 мл";56;70;5;330174;1
"МОЯ ПРЕЛЕСТЬ пена для ванн Космическая слива цветная для детей 500 мл";112;140;25;720021;1
"ПРИНЦЕССА Пена для ванн Волшебная 400 мл";111;139;25;330435;1
"BIONI пена детская Мягкая для купания перед сном 250 мл";132;165;15;720022;1
"BIONI молочко детское Увлажняющее с д-пантенолом 250 мл";162;202;25;720026;1
"ГОНКИ Детский гель для душа 300 мл";105;131;25;380131;1
"ВЕСНА Крем с Экстрактом Череды детский 45 мл";27;34;25;730027;1
"JOHNSON'S Baby Присыпка 100 г";149;186;25;730017;1
"JOHNSON'S Baby Масло 200 мл";196;245;25;730020;1
"JOHNSON'S Baby Масло Перед сном 200 мл";196;245;25;790153;1
"АВАНТА крем Детский без футляра 46 мл";24;30;25;730022;1
"АВАНТА крем Детский 75 мл";35;44;25;730031;1
"JOHNSON'S Baby Масло с алоэ 200 мл";196;245;25;790154;1
"JOHNSON'S Baby Масло 100 мл";100;125;25;730012;1
"АВАНТА крем Детский увлажняющий 75 мл";37;46;25;730032;1
"МОЕ СОЛНЫШКО крем детский с экстрактом ромашки 100 мл";48;60;25;730036;1
"МОЕ СОЛНЫШКО крем детский Заживай-ка 46 мл";55;69;25;730041;1
"АВАНТА крем Детский 46 мл";30;38;25;730030;1
"МОЕ СОЛНЫШКО Молочко после солнца 100 мл";91;114;15;790151;1
"МОЕ СОЛНЫШКО крем детский Пантенол 100 мл";112;140;25;730014;1
"JOHNSON'S Baby крем Детский 200 мл";198;248;15;790183;1
"АВАНТА зимний детский крем для лица Морозко Румяные Щечки 50 мл";50;62;25;730038;1
"ЛАПОЧКА крем под подгузник защитный 75 мл";78;98;25;730043;1
"DERMANIKA крем детский Увлажняющий 75 мл";24;30;5;730024;1
"DERMANIKA крем детский Увлажняющий мини 60 мл";18;22;25;790152;1
"ЛАПОЧКА крем детский увлажняющий 75 мл";58;72;25;730042;1
"ЛАПОЧКА крем детский с Д-пантенолом 75 мл";91;114;15;790184;1
"JOHNSON’S Baby детский крем с молоком 50 г";54;68;15;730040;1
"МАЛЕНЬКАЯ ФЕЯ крем для рук Happy Moments Детский 25 мл";96;120;25;540065;1
"СОЛНЦЕ И ЛУНА крем детский 0+ Увлажняющий 75 мл";40;50;25;730035;1
"СОЛНЦЕ И ЛУНА крем детский с Д-пантенолом 75 мл";101;126;25;730013;1
"СОЛНЦЕ И ЛУНА крем детский 75 мл";37;46;25;730033;1
"СОЛНЦЕ И ЛУНА для тела Увлажняющий детский крем 75 мл";40;50;25;730034;1
"МОЕ СОЛНЫШКО масло для массажа 200 мл";125;156;15;730015;1
"ORAL-B Электрическая зубная щетка детская Mickey for Kids D10";2438;3048;15;720046;1
"ORAL-B Насадки для электрических зубных щеток Детские 2 шт";847;1059;5;720055;1
"ORAL-B Электрическая зубная щетка детская Stages Power DB4 от 3 лет";1463;1829;5;720039;1
"SPLAT Зубная паста Juicy Вишня для детей 35 мл";83;104;25;310136;1
"SPLAT Зубная паста Juicy Тутти-фрутти для детей 35 мл";83;104;25;310135;1
"SPLAT Зубная паста Kids Молочный шоколад для детей от 2 до 6 лет 50 мл";121;151;25;310140;1
"ORAL-B электрическая зубная щетка Stages Power (Frozen) D12 от трех лет";1678;2098;25;720041;1
"ВЕСНА Зубная паста Буратино лимонадный взрыв 75 гр";24;30;25;310053;1
"ВЕСНА Зубная паста Дюймовочка клубника со сливками 75 гр";24;30;25;310054;1
"МОЕ СОЛНЫШКО зубная паста Тутти - фрутти для детей 100 г";30;38;25;310078;1
"МОЕ СОЛНЫШКО зубная паста Мультивитамин 65 г";30;38;25;310075;1
"МОЕ СОЛНЫШКО зубная паста Клубника 65 г";30;38;25;310074;1
"МОЕ СОЛНЫШКО зубная паста Апельсин гелевая 75 г";34;42;25;310077;1
"МОЕ СОЛНЫШКО зубная паста Апельсин 65 г";30;38;25;310076;1
"ORAL-B насадки для электрической зубной щетки Stages Power (star wars) 2 шт";847;1059;15;720053;1
"ORAL-B насадки для электрической зубной щетки Stages Power (frozen) 2 шт";847;1059;15;720054;1
"ORAL-B электрическая зубная щетка Stages Power cars 1 шт";1678;2098;15;720042;1
"SPLAT Зубная щетка Kids детская";125;156;25;720037;1
"SPLAT зубная паста Junior Сладкий мандарин детская 73 мл";129;161;15;310138;1
"SPLAT зубная паста Junior Ягодный коктейль детская 73 мл";129;161;25;310137;1
"SPLAT Зубная паста Smilex Освежающая кола 100 мл";129;161;5;310154;1
"CJ LION зубная паста Kids Safe виноград 3 - 12 лет 90 г";79;99;5;310107;1
"ORAL-B электрическая зубная щетка Stages Power D12 (Star Wars) для детей от 3-х лет";1678;2098;5;720040;1
"МАЛЕНЬКАЯ ФЕЯ зубная паста Happy Moments Клубничная Мечта 60 мл";68;85;25;310041;1
"МАЛЕНЬКАЯ ФЕЯ зубная паста Happy Moments Волшебный фрукт 60 мл";68;85;25;310039;1
"ДРАКОША зубная паста-гель Фруктовая Мята детская 60 мл";68;85;25;310037;1
"ДРАКОША зубная паста-гель Груша детская 60 мл";68;85;25;310038;1
"ДРАКОША ополаскиватель для полости рта Тутти-Фрутти детский 250 мл";116;145;25;310235;1
"ДРАКОША зубная паста-гель Bubble Gum детская 60 мл";68;85;25;310040;1
"ДРАКОША зубная паста-гель Клубника детская 60 мл";68;85;25;310035;1
"ДРАКОША зубная паста-гель Малина детская 60 мл";68;85;25;310036;1
"ЛЕСНОЙ БАЛЬЗАМ зубная паста Натуральный уход Нежная клубника детская от 2 лет 50 мл";80;100;25;720051;1
"ЛЕСНОЙ БАЛЬЗАМ зубная паста Ягодный взрыв детская от 7 лет 50 мл";80;100;25;720052;1
"R.O.C.S. зубная паста Нежный уход с ароматом липы 0-3 лет 45 г";183;229;5;720045;1
"R.O.C.S. зубная паста Teens для детей школьного возраста Земляника 74 г";183;229;5;310044;1
"R.O.C.S. зубная паста PRO Baby Минеральная защита и нежный уход 0-3 лет 45 г";205;256;5;310045;1
"ГАДКИЙ Я зубная паста Банан 60 мл";50;62;25;310027;1
"ПРИНЦЕССА зубная паста Мандарин 65 г";53;66;25;310021;1
"ГАДКИЙ Я зубная паста детская Апельсин 60 гр";50;62;25;310026;1
"ГАДКИЙ Я зубная паста детская Клубника 60 гр";50;62;25;310020;1
"GREEN LOVE ополаскиватель для детского белья 1 л";151;189;15;380158;1
"GARNIER молочко солнцезащитное детское Ambre Solaire SPF 30 200 мл";619;774;25;790181;1
"GARNIER Крем для загара Ambre Solaire Малыш в Тени SPF 50+ 50 мл";308;385;25;790182;1
"МОЕ СОЛНЫШКО крем детский солнцезащитный SPF 50 55 мл";140;175;25;790150;1
"МОЕ СОЛНЫШКО крем детский солнцезащитный SPF 20 75 мл";112;140;15;790148;1
"МОЕ СОЛНЫШКО крем детский солнцезащитный SPF 30 55 мл";112;140;25;790149;1
"GARDEX Клипса от комаров со сменным картриджем";320;400;25;460119;1
"GARDEX Браслет от комаров со сменным картриджем";360;450;25;460117;1
"GARDEX Пластыри после укусов насекомых детские";134;168;25;460124;1
"GARDEX Аэрозоль от клещей и комаров на одежду детский 100 мл";247;309;25;460105;1
"РАПТОР жидкость от комаров Некусайка для детей 30 ночей";143;179;25;460197;1
"МОЕ СОЛНЫШКО Спрей от комаров детский";150;188;25;460249;1
"МОЕ СОЛНЫШКО Крем от комаров детский";100;125;25;460248;1
"МОЕ СОЛНЫШКО Бальзам детский после укусов насекомых";70;88;25;460137;1
"GARDEX Спрей от комаров для детей с 2 лет 100 мл";234;292;25;460126;1
"GARDEX Baby спрей от комаров детский 50 мл";177;221;25;460114;1
"РАПТОР пластины от комаров для детей Некусайка 10 шт";44;55;25;460191;1
"РАПТОР комплект от комаров жидкость + электрофумигатор Некусайка для детей 30 ночей";253;316;25;460189;1
"MOSQUITALL пластины от комаров Нежная защита для детей 10 шт";37;46;25;460152;1
"PICNIC комплект фумигатор + жидкость Baby 45 ночей 30 мл";164;205;25;460174;1
"MOSQUITALL комплект фумигатор + жидкость Нежная Защита для Детей 30 мл";234;292;25;460147;1
"PICNIC аэрозоль от клещей и комаров Baby 125 мл + пластины";129;161;25;460314;1
"PICNIC жидкость от комаров Baby 45 ночей 30 мл";86;108;25;460182;1
"MOSQUITALL аэрозоль от комаров Нежная защита для детей 150 мл";193;241;25;460139;1
"MOSQUITALL спрей от комаров Нежная защита для детей 100 мл";171;214;25;460158;1
"MOSQUITALL жидкость от комаров Нежная защита для детей 30 ночей 30 мл";137;171;25;460164;1
"PICNIC аэрозоль от клещей и комаров Baby 125 мл";129;161;25;460171;1
"PICNIC гель после укусов Baby 30 мл";78;98;25;460315;1
"PICNIC спрей от комаров Baby 120 мл";119;149;25;460313;1
"GARDEX наклейки от комаров + флакон эфирных масел Baby 8 шт";245;306;25;460121;1
"MOSQUITALL молочко от комаров Нежная защита для детей 100 мл";103;129;15;460150;1
"GARDEX спрей от комаров Naturin для детей с 2 лет 75 мл";122;152;25;460129;1
"GARDEX аэрозоль от комаров Baby для детей с 1 года 80 мл";229;286;25;460107;1
"Я РОДИЛСЯ стиральный порошок детский для белого белья автомат 0,4 кг";83;104;25;740049;1
"Я РОДИЛСЯ стиральный порошок детский Color автомат 2,4 кг";358;448;15;740033;1
"TIDE стиральный порошок Детский автомат 0,4 кг";55;69;25;740045;1
"BIO MIO стиральный порошок Bio-White автомат 1,5 кг";410;512;25;740036;1
"ЧАЙКА стиральный порошок Детский автомат 2 кг";181;226;25;740022;1
"GARDEN ECOкондиционер для детского белья Kids ромашка 1 л";136;170;25;740016;1
"BURTI гель для стирки Baby для детского белья 1,5 л";554;692;5;790176;1
"VERNEL кондиционер для белья Детский 0,91 л";203;254;25;740024;1
"VERNEL кондиционер для белья Детский 1,8 л";343;429;25;790180;1
"МАРА гель для стирки Для Детского Белья 1 л";167;209;15;740021;1
"MEINE LIEBE карандаш-пятновыводитель для детского белья 35 г";173;216;5;410191;1
"MEINE LIEBE концентрированный кондиционер для белья Детский 500 мл";157;196;5;740017;1
"LOSK Гель для стирки Детского белья 1,17 л";403;504;25;740042;1
"BIO MIO кондиционер для белья Bio-soft корица 1 л";218;272;25;410100;1
"GREEN LOVE средство для стирки детского белья 1,35 л";347;434;15;460356;1
"GARDEN Kids Детский стиральный порошок с ионами серебра, без отдушки 1,4 кг";301;376;5;460354;1
"BIO MIO средство для мытья посуды без запаха Bio-Care 450 мл";135;169;25;740010;1
"BIO MIO средство для мытья посуды Bio-care мандарин 450 мл";146;182;25;740012;1
"GREEN LOVE средство для мытья детской посуды 500 мл";100;125;25;460296;1
"ARIEL стиральный порошок Expert автомат 15 кг";1978;2472;25;410252;1
"TIDE стиральный порошок Expert Color автомат 15 кг";1059;1324;25;410508;1
"МИФ стиральный порошок Expert автомат 15 кг";1055;1319;5;410388;1
"МИФ стиральный порошок Expert Свежий Цвет автомат 15 кг";1055;1319;15;410389;1
"TIDE стиральный порошок Color автомат 4 кг";515;644;15;460353;1
"ЧАЙКА стиральный порошок Северное Сияние автомат 5 кг";429;536;25;410314;1
"ЧАЙКА стиральный порошок Балтийское Море автомат 9 кг";722;902;25;410309;1
"ЧАЙКА стиральный порошок Северное Сияние автомат 9 кг";722;902;25;410315;1
"BIMAX стиральный порошок Color автомат 4 кг";612;765;25;410280;1
"БИОЛАН стиральный порошок Эконом Эксперт автомат 4 кг";386;482;25;410298;1
"ЧАЙКА стиральный порошок 2 в 1 с кондиционером автомат 2 кг";181;226;25;410304;1
"ЧАЙКА стиральный порошок Балтийское Море автомат 3 кг";263;329;25;410306;1
"ЧАЙКА стиральный порошок Северное Сияние автомат 3 кг";263;329;25;410312;1
"ЧАЙКА стиральный порошок Балтийское Море автомат 5 кг";429;536;25;410308;1
"ЧАЙКА стиральный порошок Яркий цвет и зимняя свежесть автомат 2 кг";181;226;25;410319;1
"TIDE cтиральный порошок Lenor ручная стирка 400 г";57;71;25;410469;1
"TIDE cтиральный порошок Альпийская свежесть ручная стирка 400 г";57;71;25;410467;1
"TIDE cтиральный порошок Лимон и Белая Лилия ручная стирка 1,8 кг";210;262;25;410470;1
"TIDE стиральный порошок Color автомат 0,45 кг";76;95;25;410502;1
"TIDE стиральный порошок Альпийская свежесть автомат 450 г";76;95;25;410496;1
"TIDE стиральный порошок Lenor автомат 0,45 кг";76;95;25;410512;1
"TIDE стиральный порошок Lenor Color автомат 450 г";91;114;25;410514;1
"SORTI стиральный порошок Color автомат 0,35 кг";47;59;25;410453;1
"BIMAX стиральный порошок 100 пятен автомат 4 кг";612;765;25;410271;1
"BIMAX стиральный порошок Color автомат 3 кг";409;511;25;410279;1
"SORTI стиральный порошок Intelletest автомат 3 кг";315;394;25;410455;1
"SORTI стиральный порошок Color автомат 6 кг";542;678;15;410454;1
"FREE TIME стиральный порошок Color автомат 3 кг";213;266;25;410340;1
"BIMAX стиральный порошок 100 пятен автомат 0,4 кг";83;104;25;410272;1
"FREE TIME стиральный порошок Color автомат 0,35 кг";31;39;25;410341;1
"FREE TIME стиральный порошок 3 в 1 ручная стирка 350 г";31;39;25;410339;1
"FREE TIME стиральный порошок Для белого белья автомат 350 г";31;39;25;410342;1
"ЧАЙКА стиральный порошок Весенний цветок ручная стирка 2 кг";172;215;25;410317;1
"ЧАЙКА жидкое средство для стирки Балтийское море 1 л";128;160;25;410321;1
"ЧАЙКА стиральный порошок Яркий цвет и зимняя свежесть автомат 0,4 кг";44;55;25;410320;1
"ЧАЙКА жидкое средство для стирки Северное сияние 1 л";128;160;25;410322;1
