"Короткое название";"Цена_Трансазия";"Цена_Розничная";"Оценка товарного запаса";"Артикул";"Показывать товар"
"МИФ стиральный порошок Cвежий цвет автомат 9 кг";634;792;25;410387;1
"PANTENE Бальзам-ополаскиватель дополнительный объем 400 мл";207;259;25;330094;1
"HEAD & SHOULDERS Шампунь Объем от самых корней 400 мл";242;302;25;330701;1
"PAMPERS подгузники Active Baby 6 (15+ кг) 16 шт";315;394;25;710321;1
"МИФ стиральный порошок Cвежий цвет автомат 6 кг";446;558;25;410386;1
"ARIEL стиральный порошок Color автомат 4,5 кг";521;651;25;410246;1
"МИФ стиральный порошок Cвежий цвет автомат 4 кг";301;376;25;410384;1
"PAMPERS подгузники Active Baby 5 (11 - 18 кг) 58 шт";955;1194;5;710454;1
"МИФ стиральный порошок Морозная Свежесть автомат 9 кг";634;792;15;410394;1
"HEAD & SHOULDERS Шампунь 2 в 1 Энергия океана 400 мл";242;302;25;330720;1
"HEAD & SHOULDERS Шампунь Old Spice 400 мл";242;302;25;330758;1
"HEAD & SHOULDERS Шампунь 2 в 1 Мгновенная помощь 400 мл";242;302;25;330719;1
"AUSSIE Шампунь Aussome Volume 300 мл";242;302;25;330620;1
"PAMPERS подгузники Active Baby 6 (15+ кг) 54 шт";955;1194;25;710455;1
"МИФ стиральный порошок Свежесть долины роз автомат 4 кг";301;376;25;410402;1
"ARIEL стиральный порошок Touch of Lenor Fresh автомат 3 кг";349;436;25;410262;1
"HEAD & SHOULDERS Шампунь 2 в 1 Густые и крепкие 400 мл";242;302;25;330716;1
"TIDE стиральный порошок Детский автомат 6 кг";559;699;25;740046;1
"GILLETTE Антиперспирант аэрозольный Arctic Ice 150 мл";190;238;25;380125;1
"BLEND-A-MED Зубная паста 3D White Luxe Гламур 75мл";116;145;25;310088;1
"BLEND-A-MED Зубная паста 3D White Luxe с Экстрактом Жемчуга 75мл";116;145;25;310087;1
"PANTENE Бальзам-ополаскиватель Защита Цвета и Блеск 400 мл";207;259;25;330095;1
"GILLETTE Антиперспирант гелевый Power Rush 70 мл";218;272;25;350167;1
"GILLETTE Антиперспирант гелевый Cool Wave 70 мл";218;272;25;350166;1
"GILLETTE Антиперспирант гелевый Arctic Ice 70 мл";218;272;25;350169;1
"AUSSIE Бальзам-ополаскиватель Aussome Volume 250 мл";242;302;25;330031;1
"HEAD & SHOULDERS Шампунь Густые и крепкие 400 мл";242;302;25;330715;1
"HEAD & SHOULDERS Шампунь Густые и крепкие 600 мл";268;335;25;330718;1
"AUSSIE Шампунь Colour Mate 300 мл";242;302;25;330621;1
"AUSSIE Бальзам-ополаскиватель Colour Mate 250 мл";242;302;25;330032;1
"GILLETTE Антиперспирант гелевый Cool Wave Power Beads 75 мл";218;272;25;350192;1
"HEAD & SHOULDERS Шампунь 2 в 1 Гладкие и шелковистые 400 мл";242;302;25;330724;1
"GILLETTE Антиперспирант Гелевый Sport Triumph 70 мл";218;272;25;350168;1
"AUSSIE Шампунь Miracle Moist 300 мл";242;302;25;330622;1
"HEAD & SHOULDERS шампунь Увлажняющий уход 400 мл";242;302;25;330733;1
"HEAD & SHOULDERS Шампунь Объем от самых корней 600 мл";268;335;5;330700;1
"ARIEL стиральный порошок Color автомат 3 кг";349;436;25;410245;1
"GILLETTE Антиперспирант аэрозольный Cool Wave 150 мл";190;238;25;380126;1
"GILLETTE Антиперспирант аэрозольный Power Rush 150 мл";190;238;25;380127;1
"TIDE Гель для стирки в капсулах Lenor 20 шт";428;535;25;410491;1
"TIDE Гель для стирки в капсулах Альпийская свежесть 26 шт";559;699;15;410484;1
"TIDE Гель для стирки в капсулах Альпийская свежесть 12 шт";182;228;25;410481;1
"ORAL-B Зубная паста Stages Ягодный взрыв 75 мл";116;145;25;310117;1
"GILLETTE станок для бритья Fusion ProGlide с 1 сменной кассетой";573;716;25;320239;1
"GILLETTE Гель для бритья ProGlide Sensitive Ocean Breeze 170 мл";323;404;5;320041;1
"GILLETTE Пена для бритья ProGlide Sensitive Active Sport 250 мл";207;259;25;320070;1
"ORAL-B Зубная щетка Stages 1 (до 2 лет)";116;145;25;720036;1
"PAMPERS подгузники Active Baby 6 (15+ кг) 56 шт";869;1086;25;710162;1
"PANTENE Шампунь Укрепление и блеск 400мл";207;259;25;330849;1
"ORAL-B Зубная щетка Stages 3 ( от 5 до 7 лет)";116;145;25;790118;1
"PANTENE Бальзам-ополаскиватель Слияние с природой Укрепление и блеск 400 мл";207;259;25;330109;1
"LENOR концентрированный кондиционер для белья Скандинавская весна 2 л";239;299;25;410122;1
"HEAD & SHOULDERS Шампунь 2 в 1 Основной уход 400 мл";242;302;25;330731;1
"LENOR концентрированный кондиционер для белья Прохлада океана 0,93 л";130;162;25;410118;1
"LENOR концентрированный кондиционер для белья Золотая орхидея 1,8 л";239;299;25;410130;1
"PANTENE Шампунь Очищение и Питание 400мл";207;259;25;330846;1
"PANTENE Бальзам-ополаскиватель Слияние с природой Очищение и Питание 400мл";207;259;25;330106;1
"LENOR концентрированный кондиционер для белья Альпийские луга 1 л";130;162;25;410111;1
"HEAD & SHOULDERS Шампунь 2 в 1 Ментол 400 мл";242;302;25;330722;1
"LENOR концентрированный кондиционер для белья Альпийские луга 2 л";239;299;25;410112;1
"LENOR концентрированный кондиционер для белья Садовые цветы 1,8 л";239;299;25;410119;1
"PANTENE Бальзам-ополаскиватель Слияние с природой Oil Therapy 360 мл";207;259;25;330104;1
"NATURELLA прокладки Classic Camomile Maxi 16 шт";95;119;5;340194;1
"NATURELLA прокладки Classic Camomile Normal 20 шт";95;119;5;340188;1
"PANTENE Шампунь Oil Therapy 400 мл";207;259;25;330845;1
"ALWAYS прокладки Ultra Light 10 шт";74;92;25;340106;1
"LENOR кондиционер для белья Скандинавская весна 4 л";307;384;25;410140;1
"LENOR Концентрированный кондиционер для белья Детский 2 л";239;299;25;740027;1
"TIDE стиральный порошок Color автомат 6 кг";559;699;25;410503;1
"LENOR Концентрированный кондиционер для белья Миндальное Масло, для чувствительной кожи 2 л";239;299;25;740026;1
"ARIEL стиральный порошок Color автомат 9 кг";983;1229;25;410249;1
"TIDE стиральный порошок Альпийская свежесть автомат 6 кг";559;699;25;410497;1
"TIDE стиральный порошок Альпийская свежесть автомат 4,5 кг";428;535;25;410495;1
"FAIRY Капсулы для посудомоечных машин 39 шт";502;628;15;430153;1
"ARIEL стиральный порошок Color автомат 6 кг";684;855;25;410248;1
"GILLETTE Бальзам после бритья Интенсивное охлаждение 100 мл";213;266;15;320103;1
"ARIEL Гель для стирки в капсулах Горный родник автомат 12 шт";216;270;25;410237;1
"ARIEL Гель для стирки в капсулах Color & Style автомат 12 шт";216;270;25;410234;1
"TIDE стиральный порошок Color Lenor автомат 3 кг";277;346;5;410506;1
"TIDE стиральный порошок Color автомат 3 кг";277;346;15;410500;1
"GILLETTE Гель для бритья Hydrating 200 мл";246;308;25;320024;1
"ARIEL стиральный порошок Горный родник автомат 9 кг";983;1229;25;460260;1
"ALWAYS прокладки Ultra Platinum Normal Plus 10 шт";74;92;15;340127;1
"ARIEL стиральный порошок Горный родник автомат 4,5 кг";521;651;25;410255;1
"BLEND-A-MED Зубная паста Pro-Expert Здоровое отбеливание 100 мл";116;145;25;310103;1
"DISCREET ежедневные прокладки Deo Water Lily Multiform 100 шт";235;294;25;340042;1
"ALWAYS прокладки Ultra Platinum Super Plus 8 шт";74;92;25;340129;1
"AUSSIE Шампунь Repair Miracle 300 мл";242;302;25;330623;1
"AUSSIE Бальзам-ополаскиватель Repair Miracle 250 мл";242;302;25;330033;1
"ORAL-B Электрическая зубная щетка Vitality D12 Precision Clean";1647;2059;15;310281;1
"ORAL-B Электрическая зубная щетка Professional Care 3000/D20";3765;4706;5;310286;1
"ARIEL стиральный порошок Touch of Lenor Fresh автомат 4,5 кг";521;651;25;410263;1
"TIDE стиральный порошок Color автомат 9 кг";782;978;5;410504;1
"HEAD & SHOULDERS Шампунь Против выпадения волос женский 400 мл";242;302;25;330754;1
"BLEND-A-MED зубная паста Pro-Expert Свежая Мята 100 мл";116;145;25;310102;1
"DISCREET ежедневные прокладки Deo Spring Breeze Multiform 100 шт";235;294;25;340043;1
"PANTENE Бальзам-ополаскиватель Питание и Блеск 360 мл";207;259;25;330108;1
"ARIEL Гель для стирки в капсулах Touch of Lenor Fresh автомат 15 шт";349;436;25;410242;1
"TIDE стиральный порошок Детский автомат 2,4 кг";221;276;25;740025;1
"BLEND-A-MED Зубная паста 3D White Трехмерное отбеливание 100 мл";92;115;5;310084;1
"ARIEL Гель для стирки в капсулах Color & Style автомат 15 шт";349;436;25;410235;1
"PANTENE Бальзам-ополаскиватель Увлажнение и Восстановление 360 мл";207;259;15;330098;1
"GILLETTE Бальзам после бритья Sensitive Skin с алоэ вера 100 мл";213;266;15;320105;1
"ORAL-B Электрическая зубная щетка Professional Care 500/D16";1791;2239;15;310283;1
"HEAD & SHOULDERS Шампунь Sports Fresh 400 мл";242;302;25;330736;1
"TIDE стиральный порошок Детский автомат 4,5 кг";428;535;25;740037;1
"ARIEL Гель для стирки в капсулах Color автомат 23 шт";521;651;25;410233;1
"TIDE Гель для стирки в капсулах Lenor 15 шт";289;361;25;410490;1
"DISCREET ежедневные прокладки Air Multiform 100 шт";235;294;25;340028;1
"FAIRY Капсулы для посудомоечных машин Platinum 18 шт";355;444;25;430158;1
"МИФ Средство для мытья посуды Свежесть цитрусов 1 л";77;96;25;430258;1
"TIDE Гель для стирки в капсулах Альпийская свежесть 15 шт";289;361;25;460415;1
"PANTENE Шампунь Питание и Блеск 400 мл";207;259;25;330828;1
"ORAL-B Насадки для электрических зубных щеток Ortho Essentials 3 шт";594;742;25;310271;1
"ORAL-B Насадки для ирригатора Oxyjet ED17 4 шт";1467;1834;25;310295;1
"ORAL-B Электрическая зубная щетка Trizone 3000/D20";3765;4706;5;310284;1
"PANTENE Шампунь Увлажнение и Восстановление 400 мл";207;259;25;330823;1
"FAIRY Средство для мытья посуды Апельсин и лимонник 900 мл";119;149;25;430218;1
"FAIRY Средство для мытья посуды Зеленое яблоко 900 мл";119;149;25;430237;1
"PANTENE Спрей Мгновенное увеличение густоты волос 150 мл";207;259;25;520156;1
"HEAD & SHOULDERS Шампунь 2 в 1 Укрепление волос мужской 400 мл";242;302;25;330960;1
"PANTENE Бальзам-ополаскиватель Aqua Light 400 мл";207;259;25;330022;1
"GILLETTE Гель для бритья ProGlide cooling 200 мл";246;308;25;320025;1
"PANTENE Шампунь Защита Цвета и Блеск Color Therapy 400 мл";207;259;25;330819;1
"HEAD & SHOULDERS Шампунь Цитрусовая свежесть 400 мл";242;302;25;330969;1
"HEAD & SHOULDERS Шампунь Успокаивающий уход 400 мл";242;302;25;330954;1
"PANTENE Спрей Мгновенное восстановление 150 мл";207;259;25;520157;1
"BLEND-A-MED Зубная паста 3D White Medic Delicate 100мл";92;115;25;310083;1
"SAFEGUARD Жидкое мыло с Цветочным ароматом 250 мл";105;131;25;330427;1
"МИФ Гель для стирки Морозная свежесть 2 л";387;484;25;410378;1
"PAMPERS подгузники New Baby 1 (2 - 5 кг) 27 шт";270;338;25;710304;1
"ARIEL Гель для стирки Горный родник 1,1 л";349;436;25;410223;1
"ARIEL Гель для стирки Для чувствительной кожи 1,1 л";349;436;25;410222;1
"AUSSIE Шампунь Mega 300 мл";242;302;25;330624;1
"AUSSIE Бальзам-ополаскиватель Mega Instant 250 мл";242;302;25;330034;1
"BLEND-A-MED Зубная паста Complete 7 Отбеливание 100 мл";92;115;25;310099;1
"ORAL-B Зубная щетка Комплекс Пятисторонняя чистка средняя";116;145;25;380102;1
"PANTENE Масло Восстановление кератина с витамином Е 100 мл";261;326;25;520154;1
"GILLETTE станок для бритья MACH3 с 1 сменной кассетой";330;412;25;320246;1
"ORAL-B Зубная щетка 3-Effect Maxi Clean средняя";43;54;5;310210;1
"HEAD & SHOULDERS Шампунь Комплексный уход 400 мл";242;302;25;330958;1
"SAFEGUARD Жидкое мыло с ароматом Алоэ 250 мл";105;131;25;330426;1
"МИФ Гель для стирки Морозная свежесть 1,6 л";278;348;25;410377;1
"HEAD & SHOULDERS Шампунь Sensitive 400 мл";242;302;25;330966;1
"HEAD & SHOULDERS Шампунь 2 в 1 Цитрусовая свежесть 400 мл";242;302;25;330957;1
"ORAL-B Зубная щетка 3-Effect Деликатное отбеливание средняя";76;95;25;310197;1
"NATURELLA прокладки Classic Camomile Normal 40 шт";173;216;5;340192;1
"HEAD & SHOULDERS Шампунь Лед Арктики 400 мл";242;302;25;330959;1
"BLEND-A-MED Зубная паста 3D White Арктическая Свежесть 100 мл";92;115;25;310086;1
"PANTENE Шампунь Дополнительный объем 400 мл";207;259;25;330816;1
"HEAD & SHOULDERS Шампунь Укрепление волос мужской 400 мл";242;302;25;330968;1
"ORAL-B Зубная щетка 3D White Свежесть средняя";116;145;25;310214;1
"HEAD & SHOULDERS шампунь Успокаивающий уход 600 мл";268;335;5;330712;1
"PANTENE Бальзам-ополаскиватель Густые и крепкие 400 мл";207;259;25;330025;1
"PANTENE Бальзам-ополаскиватель Интенсивное восстановление 400 мл";207;259;5;330100;1
"HEAD & SHOULDERS Шампунь Основной уход 400 мл";242;302;25;330965;1
"ARIEL Гель для стирки Горный родник 0,98 л";283;354;25;410225;1
"ARIEL гель для стирки Color 1 л";283;354;25;410217;1
"PAMPERS подгузники-трусики 4 (9 - 14 кг) 16 шт";350;438;25;710329;1
"TIDE Гель для стирки Альпийская свежесть 1,3 л";289;361;25;410473;1
"PAMPERS подгузники-трусики 4 (9 - 14 кг) 52 шт";1023;1279;5;710502;1
"PAMPERS подгузники-трусики 3 (6 - 11 кг) 60 шт";1023;1279;25;710501;1
"HEAD & SHOULDERS Шампунь Яблочная свежесть 400 мл";242;302;25;330951;1
"TIDE Гель для стирки Альпийская свежесть 1,95 л";428;535;15;410474;1
"ARIEL Гель для стирки Touch of Lenor fresh 1,1 л";349;436;25;410228;1
"МИФ стиральный порошок Морозная Свежесть автомат 4 кг";301;376;25;410391;1
"МИФ стиральный порошок Морозная Свежесть автомат 6 кг";446;558;25;410393;1
"PAMPERS подгузники New Baby 2 (4 - 8 кг) 94 шт";742;928;25;710457;1
"ARIEL стиральный порошок Горный родник автомат 3 кг";349;436;25;410254;1
"PANTENE Бальзам-ополаскиватель Защита от потери волос 400 мл";207;259;25;330102;1
"HEAD & SHOULDERS Шампунь Энергия океана 400 мл";242;302;25;330961;1
"ARIEL Гель для стирки в капсулах Горный родник автомат 30 шт";684;855;15;410240;1
"GILLETTE Бальзам после бритья Soothing 100 мл";213;266;25;320102;1
"BLEND-A-MED Зубная паста Complete 7 Кора Дуба 100 мл";92;115;25;310101;1
"HEAD & SHOULDERS шампунь Комплексный уход 200 мл";146;182;25;330956;1
"ORAL-B Зубная щетка 3D White Отбеливание средняя";116;145;25;380101;1
"PANTENE Шампунь Защита от потери волос 400 мл";207;259;25;330825;1
"ARIEL Гель для стирки в капсулах Горный родник автомат 23 шт";521;651;25;410239;1
"PANTENE cпрей Мгновенный объем 150 мл";207;259;25;520153;1
"ABSOLUT Мыло Алоэ 90 гр";20;25;25;330511;1
"SPLAT Зубная паста Organic 75 мл";129;161;25;380100;1
"SPLAT Зубная паста Extreme White 75 мл";149;186;25;380099;1
"Я РОДИЛСЯ стиральный порошок детский для белого белья автомат 4 кг";364;455;15;740034;1
"Я РОДИЛСЯ стиральный порошок детский Color автомат 0,4 кг";55;69;25;790179;1
"Я РОДИЛСЯ стиральный порошок детский Color автомат 4 кг";394;492;15;740032;1
"Я РОДИЛСЯ Кондиционер для белья с Лавандой 1 л";87;109;5;740050;1
"LE PETIT MARSEILLAIS Гель для душа Цветок апельсинового дерева 250 мл";92;115;5;330293;1
"SPLAT Зубная щетка Innova деликатная с ионами серебра";126;158;25;310225;1
"AURA Влажные салфетки Ultra Comfort для детей с экстрактом Алоэ и витамином Е 100 шт";55;69;25;360144;1
"AURA губка для купания Губка Боб";55;69;25;330339;1
"AURA Влажные салфетки Ultra Comfort для детей с экстрактом Алоэ и витамином Е 120 шт";63;79;25;360143;1
"GARNIER cпрей Ambre Solaire Идеальный загар SPF 30 200 мл";635;794;25;560015;1
"BAGI Средство для прочистки засоров Потхан 600 г";436;545;25;430311;1
"BAGI Средство против грибка и плесени Анти-Плесень 500 мл";285;356;25;430338;1
"BAGI Средство для чистки Шуманит для стеклокерамики 0,5 л";361;451;25;430415;1
"BAGI Средство для чистки ковров и обивки Штихонит Спрей 500 мл";307;384;25;430287;1
"BAGI Средство для удаления накипи Кумкумит 550 мл";307;384;25;430326;1
"BAGI Средство для чистки Шуманит 3 л";1158;1448;25;430414;1
"BIMAX Гель для стирки Black Fashion 1500 г";227;284;25;410269;1
"BIMAX Гель для стирки Color 1500 г";227;284;25;410270;1
"BIMAX Гель для стирки 100 пятен 1500 г";227;284;25;410268;1
"SECRET антиперспирант аэрозольный Актив 150 мл";163;204;25;350012;1
"SECRET антиперспирант твердый Актив 45 г";137;171;25;350015;1
"SECRET антиперспирант аэрозольный Деликат 150 мл";163;204;25;350011;1
"SECRET антиперспирант твердый Деликат 45 г";137;171;25;350016;1
"SECRET антиперспирант кремовый Натурель 40 мл";251;314;25;350014;1
"SECRET антиперспирант кремовый Защита Платинум Актив 40 мл";251;314;25;350013;1
"HELEN HARPER Детские впитывающие пеленки 60x60 10 шт";155;194;25;710103;1
"HELEN HARPER Детские впитывающие пеленки Baby 60х90 10 шт";201;251;25;710105;1
"HEAD & SHOULDERS Шампунь Густые и крепкие 200 мл";146;182;25;330717;1
"HEAD & SHOULDERS шампунь Увлажняющий уход 200 мл";146;182;25;330732;1
"HEAD & SHOULDERS Шампунь 2 в 1 Гладкие и шелковистые 200 мл";146;182;25;330723;1
"HEAD & SHOULDERS Шампунь Против выпадения волос женский 200 мл";146;182;25;330753;1
"HEAD & SHOULDERS Шампунь 2 в 1 Основной уход 200 мл";146;182;25;330944;1
"HEAD & SHOULDERS Шампунь Sensitive 200 мл";146;182;25;330964;1
"HEAD & SHOULDERS Шампунь Sports Fresh 200 мл";146;182;25;330948;1
"HEAD & SHOULDERS Шампунь 2 в 1 Ментол 200 мл";146;182;25;330950;1
"AURA влажные салфетки Tropic Cocktail освежающие 15 шт";6;8;25;360113;1
"AURA Влажные салфетки Ultra Comfort для детей 60 шт";38;48;25;360142;1
"МИФ стиральный порошок Свежесть долины роз автомат 2 кг";163;204;25;410401;1
"TIDE стиральный порошок Color автомат 1,5 кг";210;262;25;410499;1
"TIDE стиральный порошок Альпийская свежесть автомат 1,5 кг";210;262;25;410492;1
"TIDE стиральный порошок Lenor Color автомат 1,5 кг";210;262;25;460386;1
"ARIEL стиральный порошок Color автомат 1,5 кг";243;304;25;410244;1
"ARIEL стиральный порошок Горный родник автомат 1,5 кг";243;304;25;410253;1
"МИФ стиральный порошок Cвежий цвет автомат 2 кг";163;204;25;410383;1
"МИФ Средство для мытья посуды Лимонная свежесть 0,5 л";42;52;25;430256;1
"МИФ Средство для мытья посуды Бальзам АлоэВера 0,5 л";42;52;25;430253;1
"МИФ Средство для мытья посуды Свежесть цитрусов 0,5 л";42;52;25;430259;1
"МИФ Средство для мытья посуды Бальзам Лаванда 500 мл";42;52;25;430254;1
"FAIRY Средство для мытья посуды Сочный лимон 450 мл";68;85;25;430231;1
"FAIRY Средство для мытья посуды Зеленое яблоко 450 мл";68;85;25;430235;1
"FAIRY Средство для мытья посуды Нежные руки Ромашка и витамин Е 450 мл";68;85;25;430222;1
"FAIRY Средство для мытья посуды Апельсин и лимонник 450 мл";68;85;25;430217;1
"FAIRY Средство для мытья посуды Нежные руки Чайное дерево и мята 450 мл";68;85;25;430219;1
"LENOR Концентрированный кондиционер для белья Детский 1 л";130;162;25;740047;1
"ALWAYS прокладки Ultra Super Plus 8 шт";74;92;25;340114;1
"ALWAYS прокладки Ultra Night Экстра Защита 7 шт";74;92;25;340123;1
"ALWAYS прокладки Ultra Normal Plus 10 шт";74;92;5;340109;1
"ALWAYS прокладки Ultra Night 7 шт";74;92;5;340119;1
"LENOR концентрированный кондиционер для белья Скандинавская весна 1 л";130;162;25;410121;1
"ARIEL гель для стирки Горный родник 1,95 л";521;651;25;460262;1
"ARIEL гель для стирки Lenor 1,95 л";521;651;5;410226;1
"AUSSIE Реконструктор волос 3 Minute Miracle 250 мл";289;361;25;520103;1
"PANTENE Спрей Мгновенное питание Aqua Light 150 мл";207;259;25;520155;1
"PANTENE Укрепляющая сыворотка Слияние с природой 150 мл";207;259;25;570069;1
"ARIEL стиральный порошок Горный родник ручная стирка 450 г";81;101;25;410258;1
"МИФ стиральный порошок Морозная Свежесть ручная стирка 0,9 кг";82;102;25;410396;1
"LENOR кондиционер для белья Скандинавская весна 1 л";76;95;25;410138;1
"ARIEL стиральный порошок Color автомат 0,45 кг";84;105;25;410247;1
