"Короткое название";"Цена_Трансазия";"Цена_Розничная";"Оценка товарного запаса";"Артикул";"Показывать товар"
"KLEENEX туалетная бумага нежная ромашка трехслойная 4 шт";170;212;15;360208;1
"KLEENEX туалетная бумага сочная клубника трехслойная 4 шт";170;212;25;360207;1
"FAMILIA туалетная бумага белая Радуга двухслойная 4 шт";45;56;25;360185;1
"GARNIER крем для рук Интенсивный уход для очень сухой кожи 100 мл";201;251;25;540063;1
"AURA крем для рук и ногтей Beauty Комплексный с витаминами и экстрактом лаванды 75 мл";30;38;25;540017;1
"АВАНТА крем для рук Дачница 75 мл";32;40;25;540022;1
"АВАНТА крем для рук и ногтей Белоручка питательный 75 мл";38;48;25;540025;1
"АВАНТА крем для рук Белоручка увлажняющий 75 мл";38;48;25;540020;1
"EVO крем универсальный Пантенол 46 мл";72;90;25;540061;1
"АВАНТА крем для рук Белоручка Летний шелк 80 мл";46;58;25;540018;1
"АВАНТА крем для рук Дачница защитный 75 мл";32;40;25;540023;1
"АВАНТА крем для рук и ногтей Белоручка Крепкие ногти 80 мл";46;58;5;540024;1
"АВАНТА крем для рук Белоручка Смягчающий 75мл";38;48;25;540019;1
"АВАНТА крем для рук Силиконовый защитный 75 мл";28;35;25;540026;1
"АВАНТА крем для рук Белоручка зимний бархат 75 мл";46;58;15;540021;1
"LURE подарочный набор Little Joy крем для рук Витаминный 40 мл + крем для рук Алоэ 40 мл";47;59;25;570170;1
"LURE крем для рук Питательный с маслом ши и D-пантенолом 90 мл";30;38;25;540064;1
"DERMANIKA крем для рук Омолаживающий 75 мл";24;30;25;540056;1
"БАРХАТНЫЕ РУЧКИ крем для рук и ногтей Комплексный 80 мл";74;92;25;540033;1
"БАРХАТНЫЕ РУЧКИ крем для рук Роскошь Макадамии 80 мл";88;110;25;540043;1
"БАРХАТНЫЕ РУЧКИ крем-бальзам для рук SOS-восстановление 45 мл";102;128;25;540027;1
"БАРХАТНЫЕ РУЧКИ крем-мусс для рук Энергия Асаи 72 мл";88;110;25;540050;1
"ORGANIC BEAUTY бальзам для рук и тела Питательный 500 мл";90;112;25;560076;1
"БАРХАТНЫЕ РУЧКИ для рук крем Увлажняющий 80 мл";70;88;25;560175;1
"БАРХАТНЫЕ РУЧКИ крем для рук Увлажняющий 80 мл";70;88;25;560177;1
"ЧИСТАЯ ЛИНИЯ крем для рук Интенсивное Увлажнение 75 мл";61;76;15;540054;1
"ЧИСТАЯ ЛИНИЯ крем для рук Нежное Питание 75 мл";61;76;25;540055;1
"БАРХАТНЫЕ РУЧКИ подарочный набор Совершенство крем для рук Питательный 72 мл + крем-уход для рук Шёлковая нежность 80 мл";135;169;15;540051;1
"БАРХАТНЫЕ РУЧКИ крем-лосьон для рук и ногтей Прикосновение Нежности Питательный 160 мл";166;208;15;540047;1
"DOVE крем для рук Объятия Нежности 75 мл";189;236;25;540058;1
"БАРХАТНЫЕ РУЧКИ крем для рук Роскошь Макадамии 80 мл";88;110;25;540043;1
"БАРХАТНЫЕ РУЧКИ крем для рук Защитный 80 мл";70;88;25;560178;1
"БАРХАТНЫЕ РУЧКИ крем для рук Для Всей Семьи 200 мл";158;198;25;540028;1
"БАРХАТНЫЕ РУЧКИ крем для рук Ночной Восстанавливающий 80 мл";74;92;25;540036;1
"БАРХАТНЫЕ РУЧКИ крем для рук Энергия Асаи ночной 45 мл";88;110;25;540029;1
"БАРХАТНЫЕ РУЧКИ крем для рук Гипоаллергенный 80 мл";74;92;25;540031;1
"БАРХАТНЫЕ РУЧКИ крем для рук Основной Уход 45 мл";51;64;15;540037;1
"БАРХАТНЫЕ РУЧКИ крем-масло для рук SOS-восстановление ночной уход 45 мл";139;174;25;540049;1
"БАРХАТНЫЕ РУЧКИ крем для рук Нежность Тиаре 80 мл";88;110;25;540035;1
"БАРХАТНЫЕ РУЧКИ крем для рук Регенерирующий 80 мл";74;92;25;560176;1
"БАРХАТНЫЕ РУЧКИ крем для рук Интенсивный Молодость Кожи 80 мл";105;131;15;540034;1
"БАРХАТНЫЕ РУЧКИ крем для рук и ногтей Комплексный 80 мл";74;92;25;540033;1
"БАРХАТНЫЕ РУЧКИ крем для рук Гармония Арганы 80 мл";88;110;25;540030;1
"БАРХАТНЫЕ РУЧКИ крем для рук Питательный мини версия 20 мл";35;44;15;540040;1
"БАРХАТНЫЕ РУЧКИ крем для рук Смягчающий 80 мл";74;92;25;540044;1
"БАРХАТНЫЕ РУЧКИ крем для рук Тайна Цветов Моринги 30 мл";74;92;25;540046;1
"БАРХАТНЫЕ РУЧКИ крем для рук Райское Масло Бабассу 30 мл";74;92;25;540041;1
"БАРХАТНЫЕ РУЧКИ крем для рук Сокровище Бурити 30 мл";74;92;25;540045;1
"EVO Крем Для Локтей и Коленей 46 мл";111;139;15;540060;1
"ORGANIC SHOP крем для рук Organic Kitchen питательный акуна банана 100 мл";74;92;5;540070;1
"Я САМАЯ средство для снятия лака Professional с помпой дозатором 150 мл";137;171;25;540082;1
"GARNIER крем для ног Интенсивный уход восстановление 100 мл";286;358;15;550015;1
"ЛАБОРАТОРИЯ ПРИРОДЫ крем для ног Эвкалиптовый 100 мл";39;49;25;550016;1
"EVO крем для ног с мочевиной";82;102;25;550013;1
"ЛАБОРАТОРИЯ ПРИРОДЫ крем для ног Каштановый 100 мл";40;50;25;550017;1
"АВАНТА крем для ног Дачница 75 мл";32;40;25;550010;1
"ЧИСТАЯ ЛИНИЯ гель-свежесть для ног Снятие Усталости мята медуница75 мл";96;120;15;550012;1
"СТО РЕЦЕПТОВ КРАСОТЫ крем для ног Смягчающий с тыквой 80 мл";61;76;25;550023;1
"LURE крем для ног Vitamins с мочевиной 75 мл";34;42;25;550018;1
"СТО РЕЦЕПТОВ КРАСОТЫ гель для ног Венотон 70 мл";71;89;25;550022;1
"SALTON Спрей для ног и обуви Feet Comfort Профилактика грибка 60 мл";253;316;25;550035;1
"SALTON антиперспирант для ног 2 в 1 Feet Only Lady с маслом Ши и экстрактом Лотоса";175;219;25;550031;1
"SALTON охлаждающий спрей Feet Only Ice Power для снятия усталости ног 110 мл";246;308;25;550034;1
"SALTON нейтрализатор запаха для ног Feet Only Men мужской 60 мл";209;261;25;550033;1
"REXONA антиперсперант для ног ДеоКонтроль Активная свежесть 150 мл";204;255;25;550030;1
"SALTON карандаш для ног Feet Comfort Lady Защита от мозолей 14 мл";205;256;25;550032;1
"GARNIER молочко для тела с Алоэ Вера 250 мл";244;305;25;560059;1
"GARNIER молочко для тела с маслом Манго 250 мл";244;305;15;560060;1
"GARNIER драгоценное молочко красоты 250 мл";341;426;15;560058;1
"GARNIER драгоценное масло красоты 150 мл";430;538;15;560057;1
"АВАНТА крем массажный Нега 75 мл";46;58;25;560044;1
"NIVEA молочко для тела Ванильный Десерт 200 мл";276;345;15;560075;1
"DOVE молочко для тела Увлажнение и Питание 250 мл";385;481;25;560056;1
"BARNANGEN бальзам для тела All Over Rescue 200 мл";473;591;25;560045;1
"BARNANGEN лосьон для тела Caring 400 мл";473;591;25;560046;1
"BARNANGEN лосьон для тела Nutritive 400 мл";473;591;25;560047;1
"BARNANGEN лосьон для тела Sensitive 400 мл";473;591;25;560048;1
"DOVE крем для лица и тела Питательный 150 мл";228;285;25;530060;1
"DOVE лосьон для тела Кокосовое масло и Миндальное молочко Восстанавливающий 250 мл";385;481;25;560054;1
"DOVE лосьон для тела Масло Авокадо и экстракт календулы Пробуждающий 250 мл";385;481;25;560055;1
"DOVE крем для лица и тела Питательный 75 мл";166;208;25;530061;1
"DOVE лосьон для тела Сияние лета 250 мл";385;481;25;570179;1
"ЧИСТАЯ ЛИНИЯ фитобальзам для тела Упругость и Питание 200 мл";162;202;15;560049;1
"ЧИСТАЯ ЛИНИЯ молочко для тела Двойное Увлажнение медуница и таволга 250 мл";162;202;25;560052;1
"GARNIER молочко для тела Овсяное Успокаивающее 250 мл";244;305;25;570180;1
"BARNÄNGEN Бальзам для тела Интенсивный Уход для очень сухой кожи 200мл";473;591;25;570178;1
"GARNIER Масло-спрей солнцезащитное Ambre Solaire для загара SPF15 150 мл";453;566;5;560017;1
"GARNIER Ambre Solaire молочко солнцезащитное SPF 30 200 мл";440;550;25;570175;1
"GARNIER Ambre Solaire крем после загара Эксперт Защита освежающий 200 мл";448;560;25;570174;1
"GARNIER солнцезащитный спрей Ambre Solaire солнечная вода прозрачный SPF 30 150 мл";635;794;15;560020;1
"GARNIER Ambre Solaire Спрей Солнечная вода SPF 50 150мл";696;870;5;570172;1
"LOREAL крем Revitalift Вокруг глаз 50 мл";542;678;25;530257;1
"LOREAL крем Возраст Эксперт 45+ вокруг глаз 50 мл";307;384;15;530260;1
"LOREAL крем Возраст Эксперт 55+ вокруг глаз 50 мл";307;384;25;530261;1
"LOREAL крем Роскошь Питания вокруг глаз 15 мл";440;550;15;530258;1
"LOREAL крем Увлажнение Эксперт вокруг глаз 50 мл";293;366;5;530259;1
"ЧЕРНЫЙ ЖЕМЧУГ крем-гель для умывания Очищение и Уход для сухой и чувствительной кожи 120 мл";172;215;25;530244;1
"ЧЕРНЫЙ ЖЕМЧУГ крем-сыворотка для век Программа от 56 лет 17 мл";219;274;15;530246;1
"ЧЕРНЫЙ ЖЕМЧУГ крем для кожи вокруг глаз Крем-Эксперт 46+ 15 мл";226;282;25;530241;1
"ЧЕРНЫЙ ЖЕМЧУГ крем-сыворотка для лица и век Самоомоложение Активатор лифтинг-Эффекта 46+ 30 мл";287;359;15;530281;1
"GARNIER крем для кожи вокруг глаз Антивозрастной Уход защита от морщин 35+ 15 мл";216;270;15;530252;1
"GARNIER крем для кожи вокруг глаз Антивозрастной Уход активный лифтинг 45+ 15мл";216;270;25;530251;1
"LOREAL для кожи вокруг глаз Revitalift Филлер [ha] против морщин 15 мл";834;1042;15;530255;1
"LOREAL крем Revitalift Лазер Х3 ночной 50 мл";834;1042;15;530083;1
"LOREAL крем Revitalift ночной 50 мл";542;678;15;530084;1
"LOREAL крем Revitalift для контура лица и шеи 50 мл";726;908;5;530079;1
"LOREAL крем Revitalift Филлер ночной 50 мл";834;1042;15;530081;1
"ВЕСНА крем для лица Морковный омолаживающий 40 мл";34;42;25;530121;1
"ВЕСНА крем для лица Огуречный увлажняющий 40 мл";34;42;25;530122;1
"ВЕСНА крем для лица Тыквенный питательный 40 мл";34;42;25;530123;1
"ЛАБОРАТОРИЯ ПРИРОДЫ крем для лица Женьшеневый питательный 75 мл";40;50;25;560163;1
"GARNIER крем для лица Интенсивное омоложение 55+ ночной 50 мл";216;270;25;530070;1
"LOREAL крем Возраст Эксперт 35+ дневной 50 мл";307;384;25;530090;1
"LOREAL крем Возраст Эксперт 55+ дневной 50 мл";307;384;25;530094;1
"LOREAL уход-скульптор Возраст Эксперт 45+ для лица, шеи и зоны декольте 50 мл";358;448;15;530096;1
"LOREAL уход-скульптор Возраст Эксперт 55+ для лица, шеи и зоны декольте 50 мл";358;448;15;530097;1
"LOREAL крем Возраст Эксперт 35+ ночной 50 мл";307;384;15;530091;1
"LOREAL крем Возраст Эксперт 45+ ночной 50 мл";307;384;25;530093;1
"LOREAL крем Увлажнение эксперт ночной 50 мл";293;366;5;530089;1
"LOREAL крем Увлажнение Эксперт 50 мл";293;366;25;530086;1
"LOREAL крем Увлажнение Эксперт для сухой и чувствительной кожи 50 мл";293;366;15;530088;1
"LOREAL крем-гель Увлажнение Эксперт для нормальной и смешанной кожи 50 мл";293;366;25;530077;1
"LOREAL крем Роскошь питания Преображающий дневной 50 мл";508;635;5;530085;1
"LOREAL крем Возраст Эксперт 55+ ночной 50 мл";307;384;25;530095;1
"LOREAL крем Возраст Эксперт 45+ дневной 50 мл";307;384;25;530092;1
"ЛАБОРАТОРИЯ ПРИРОДЫ крем для лица Облепиховый 75 мл";40;50;25;560164;1
"LOREAL крем ночной Возраст Эксперт 65+ 50 мл";307;384;25;530078;1
"LOREAL крем дневной Возраст Эксперт 65+ 50 мл";307;384;25;530076;1
"LOREAL гель для лица Абсолютная Нежность для сухой и чувствительной кожи 150 мл";228;285;25;530230;1
"LOREAL крем дневной Возраст Эксперт 55+ 50 мл";307;384;25;530075;1
"LOREAL крем дневной Revitalift Лазер x3 50 мл";834;1042;5;530074;1
"LOREAL гель для лица Бесконечная Свежесть для нормальной и смешанной кожи 150 мл";228;285;25;530231;1
"DIADEMINE крем для лица LIFT+ Разглаживание морщин дневной 50 мл";826;1032;25;530057;1
"DIADEMINE крем для лица Lift + Увлажнение дневной 50 мл";757;946;15;530059;1
"ЧЕРНЫЙ ЖЕМЧУГ крем для лица Крем-Эксперт 26+ 50 мл";311;389;5;530027;1
"ЧЕРНЫЙ ЖЕМЧУГ крем для лица Крем-Эксперт 36+ 50 мл";311;389;15;530028;1
"ЧЕРНЫЙ ЖЕМЧУГ крем для лица Крем-Эксперт 46+ 50 мл";311;389;25;530029;1
"ЧЕРНЫЙ ЖЕМЧУГ крем для лица Крем-Эксперт 56+ 50 мл";311;389;25;530030;1
"ЧЕРНЫЙ ЖЕМЧУГ ночной крем Самоомоложение Программа от 26 лет 50 мл";217;271;5;530032;1
"ЧЕРНЫЙ ЖЕМЧУГ ночной крем Самоомоложение Программа от 36 лет 50 мл";217;271;25;560165;1
"ЧЕРНЫЙ ЖЕМЧУГ ночной крем Самоомоложение Программа от 46 лет 50 мл";217;271;25;530034;1
"ЧЕРНЫЙ ЖЕМЧУГ дневной крем BiO-программа для нормальной и комбинированной кожи 50 мл";147;184;15;530021;1
"ЧЕРНЫЙ ЖЕМЧУГ дневной крем BiO-программа для сухой и чувствительной кожи 50 мл";147;184;15;530022;1
"ЧЕРНЫЙ ЖЕМЧУГ ночной крем BiO-программа 50 мл";147;184;15;530031;1
"ЧЕРНЫЙ ЖЕМЧУГ BB-крем Самоомоложение 46+ Лифтинг 45 мл";259;324;5;570207;1
"ЧЕРНЫЙ ЖЕМЧУГ BB-крем Самоомоложение 56+ Омолаживающий 45 мл";259;324;15;530017;1
"ЧЕРНЫЙ ЖЕМЧУГ дневная эмульсия для лица Dream Cream Естественное Сияние 50 мл";399;499;25;530020;1
"ЧЕРНЫЙ ЖЕМЧУГ ночной крем Самоомоложение Программа от 46 лет 50 мл";217;271;25;530034;1
"ЧЕРНЫЙ ЖЕМЧУГ дневной крем Самоомоложение Программа от 36 лет 50 мл";217;271;25;530024;1
"GARNIER крем для лица Антивозрастной Уход защита от морщин 35+ дневной 50 мл";216;270;25;530068;1
"GARNIER крем для лица Антивозрастной Уход защита от морщин 35+ ночной 50 мл";216;270;25;530069;1
"GARNIER крем для лица Антивозрастной Уход активный лифтинг 45+ ночной 50 мл";216;270;25;530066;1
"GARNIER крем для лица Антивозрастной Уход активный лифтинг 45+ дневной 50 мл";216;270;25;530065;1
"GARNIER крем для лица Антивозрастной Уход интенсивное омоложение 55+ дневной 50мл";216;270;25;530067;1
"ЧИСТАЯ ЛИНИЯ крем дневной Лёгкий Увлажняющий для нормальной и комбинированной кожи 40 мл";75;94;25;530049;1
"ЧЕРНЫЙ ЖЕМЧУГ для лица Омолаживающий bio-программа 56+ 50 мл";183;229;25;530019;1
"ЧИСТАЯ ЛИНИЯ ночной крем для лица Нежный Питательный для нормальной и комбинированной кожи 40 мл";75;94;25;530052;1
"ЧИСТАЯ ЛИНИЯ Утренний крем для лица и шеи 3 в 1 от 35 лет 50 мл";94;118;25;530055;1
"ЧИСТАЯ ЛИНИЯ для лица Дневной Фито-крем от 55 лет шлемник и морошка 45 мл";154;192;25;530037;1
"ЧИСТАЯ ЛИНИЯ Фито-крем для лица Дневной Анрика и Жимолость от 45 лет 45 мл";154;192;25;530039;1
"ЧИСТАЯ ЛИНИЯ ночной крем для лица От 60 лет таволга и калина 45 мл";154;192;25;530053;1
"ЧИСТАЯ ЛИНИЯ Аква‑крем для лица Идеальная Кожа мгновенная матовость 50 мл";127;159;25;530035;1
"ЧИСТАЯ ЛИНИЯ крем для лица Комплексный Сила 5 Трав Байкал 45 мл";119;149;25;530047;1
"ЧИСТАЯ ЛИНИЯ крем-актив для лица Идеальная Кожа против прыщей 40 мл";127;159;5;530046;1
"ЧИСТАЯ ЛИНИЯ ночной крем-сон для лица Идеальная Кожа для всех типов кожи 45мл";168;210;15;530054;1
"ЧИСТАЯ ЛИНИЯ антивозрастной крем-лифтинг для век Сила 5 Трав 25 мл";83;104;15;530036;1
"ЧИСТАЯ ЛИНИЯ крем-мусс для лица Идеальная Кожа для для сухой и чувствительной кожи 45мл";168;210;15;530050;1
"ЧИСТАЯ ЛИНИЯ Фито-крем для лица Дневной Шлемник и Морошка от 55 лет 45 мл";154;192;25;530041;1
"ЧИСТАЯ ЛИНИЯ Фито-крем для лица Ночной Шлемник и Морошка от 55 лет 45 мл";154;192;25;530044;1
"ЧЕРНЫЙ ЖЕМЧУГ Крем для лица BIO-программа 56+ 50 мл";183;229;25;530026;1
"ЧИСТАЯ ЛИНИЯ Фито-крем для лица Ночной Арника и Жимолость от 45 лет 45мл";154;192;25;530042;1
"ЧИСТАЯ ЛИНИЯ фито-крем для лица Ночной от 55 лет Шлемник и Морошка 45 мл";154;192;25;530043;1
"ЧИСТАЯ ЛИНИЯ Фито-крем для лица Ночной Вербена и Первоцвет от 35 лет 45 мл";154;192;15;530045;1
"ЧИСТАЯ ЛИНИЯ Ночной крем для лица Импульс Молодости от 45 лет 50 мл";220;275;15;530051;1
"ЧИСТАЯ ЛИНИЯ фито-крем для лица дневной От 45 лет арника и жимолость 45 мл";154;192;25;530040;1
"LOREAL антивозрастная сыворотка Ревиталифт Филлер [ha] против морщин для лица 16 мл";907;1134;15;530072;1
"NATURA SIBERICA крем для лица ночной для комбинированной и жирной кожи 50 мл";293;366;15;530100;1
"LOREAL Крем-масло Роскошь Питания 50 мл";508;635;15;530338;1
"LOREAL масло для лица Роскошь питания 30 мл";508;635;5;530346;1
"LOREAL крем-маска для лица Роскошь Питания Экстраординарное Масло 50 мл";508;635;15;530337;1
"LOREAL маска для лица Магия Глины Детокс и сияние с углем 50 мл";477;596;25;560174;1
"LOREAL маска для лица Магия Глины Очищение и Матирование с эвкалиптом 50 мл";477;596;15;530341;1
"LOREAL маска-скраб для лица Магия Глины для всех типов кожи 125 мл";477;596;15;530345;1
"LOREAL аква-флюид Гений Увлажнения для нормальной и смешанной кожи 70 мл";503;629;15;530335;1
"LOREAL аква-флюид Гений Увлажнения для сухой кожи 70 мл";503;629;25;530336;1
"LOREAL аква-флюид Гений Увлажнения для чувствительной кожи 70 мл";503;629;25;530334;1
"LOREAL маска для лица Магия Глины Детокс и Сияние 6 мл";88;110;15;530339;1
"LOREAL маска для лица Магия Глины Очищение и Матирование 6 мл";88;110;25;530340;1
"LOREAL маска для лица Возраст Эксперт 55+ 50 мл";358;448;25;530344;1
"LOREAL маска для лица Revitalift Лазер x3 ночная 50 мл";838;1048;5;530342;1
"LET ME SKIN маска альгинатная Ultra H2O для сияния кожи 50+5 г";1043;1304;5;530328;1
"ЧЕРНЫЙ ЖЕМЧУГ маска для лица тканевая MezoCare Лифтинг-эффект 1 шт";117;146;25;530283;1
"ЧЕРНЫЙ ЖЕМЧУГ маска для лица тканевая MezoCare Питание и Омоложение 1 шт";117;146;25;530284;1
"ЧЕРНЫЙ ЖЕМЧУГ маска-эксперт для лица для Y-зоны 50 мл";297;371;25;530285;1
"GARNIER маска для лица тканевая Увлажнение + Антистресс суперувлажняющая и снимающая усталость 32 г";137;171;25;530321;1
"GARNIER маска для лица Черная Тканевая Маска Очищающий Уголь 28 г";137;171;25;530319;1
"GARNIER маска для лица тканевая Увлажнение + Аква Бомба 32 г";137;171;25;530320;1
"GARNIER тканевая маска Увлажнение + Комфорт для сухой и чувствительной кожи 32 г";137;171;25;530322;1
"ЧИСТАЯ ЛИНИЯ тканевая маска Увлажняющая";85;106;25;530292;1
"ЧИСТАЯ ЛИНИЯ маска для лица Очищающая 45 мл";169;211;25;530287;1
"ЧИСТАЯ ЛИНИЯ сыворотка для лица и шеи Сила 5 трав 40 мл";117;146;15;530289;1
"ЧИСТАЯ ЛИНИЯ маска для лица Антивозрастная 45 мл";169;211;25;530286;1
"GARNIER гель-пенка для умывания Основной уход 200 мл";196;245;25;530222;1
"LOREAL cредство для снятия макияжа для чувствительных глаз 125 мл";220;275;25;530227;1
"LOREAL cредство для снятия макияжа с глаз и губ 125 мл";220;275;25;530228;1
"LOREAL очищающее молочко Бесконечная свежесть 200 мл";228;285;25;560172;1
"LOREAL молочко Абсолютная нежность 200 мл";228;285;25;530232;1
"GARNIER лосьон для снятия макияжа с глаз Основной Уход 125 мл";189;236;25;530224;1
"NIVEA черная пенка для умывания Make-up Expert для жирной кожи 100 мл";230;288;15;530234;1
"DOVE крем-гель для умывания Матирующий 120 мл";256;320;15;530207;1
