"Рекомендуемые товары";"Сопутствующие товары";"Короткое название";"Артикул"
"ДОМИНГО Губки поролоновые с абразивом Bubbler 4 шт;FORESTER Решетка-гриль для сосисок, купат, колбасок 1 шт";"ENERGIZER батарейки MAX AA (LR6) 2 шт;DURACELL батарейки Turbo Max AA 8 шт;ЧИСТЮЛЯ губки поролоновые с абразивом Комфорт 5 шт";"REFRESH ароматизатор для автомобиля Your Car Тропические Фрукты клипса 4 шт";450132
"ДОМИНГО Перчатки с длинной манжетой Longa L;ЧИСТЮЛЯ губки поролоновые с абразивом Комфорт 7 шт";"CIF чистящий крем Active Fresh 500 мл;Совок с закрывающейся крышкой Леголэнд;VILEDA салфетка вискозная универсальная 38х40 см красная 1 шт";"SYMPHONY сменный баллон для автоматического освежителя воздуха Свежесть океана 250 мл";450178
"ДОМИНГО Перчатки с длинной манжетой Longa S";"ДОННА РОЗА салфетки вискозные 3 шт;CIF чистящий крем Max Ледяной Бриз 450 мл;Щетка для совка Леголэнд 25 см";"SYMPHONY освежитель воздуха Антитабак 300 мл";450173
"ДОМИНГО Перчатки хозяйственные Brute прочные L;БИОЛАН чистящее средство Сочный лимон 400 г";"VILEDA салфетка хозяйственная МикроТафф Плюс 38х38 см красная 1 шт;Совок с закрывающейся крышкой Леголэнд;ДОМИНГО Салфетка из микрофибры для пола Ламинат";"SYMPHONY Дезинфектор Воздуха Expert без запаха 250 мл";450171
"ДОМИНГО Перчатки хозяйственные Brute прочные L;ЧИСТЮЛЯ мочалка-нержавейка Маленькая кухня";"ENERGIZER батарейка CR2025 1 шт;ДОМИНГО Губки поролоновые с абразивом Bubbler 4 шт;СОЮЗГРИЛЬ решетка-гриль Универсальная с регулируемой высотой 24 х 37 см";"CALIFORNIA SCENTS ароматизатор для автомобиля Монтерейская Ваниль банка 1 шт";450102
"ДОМИНГО Перчатки хозяйственные Brute прочные S;SANITA спрей Жироудалитель 500 мл";"ЧИСТЮЛЯ швабра отжимная с губкой ПВА 1 ролик;ДОМИНГО Салфетка из микрофибры для пола Ламинат;COMET чистящий порошок Лимон без хлоринола 475 г";"SYMPHONY сменный баллон для автоматического освежителя воздуха Горный воздух 250 мл";450176
"ДОМИНГО Салфетка из микрофибры для пола Ламинат;DURACELL аккумуляторы AA 2500 mAh 4 шт";"FORESTER Решетка-гриль для стейков большая;ЧИСТЮЛЯ Салфетка вискозная тонкая 10 шт;ENERGIZER батарейки Maximum AAA 2 шт";"DELISS автомобильный ароматизатор Harmony набор 1 шт";450121
"ДОННА РОЗА губка поролоновая с абразивом 10 шт;ДОМИНГО Перчатки хозяйственные Brute прочные L";"ЧИСТЮЛЯ швабра с насадкой из микрофибры;QUALITA cкребок из нержавеющей стали 1 шт;DR. SCHNELL средство для очистки санитарных зон и удаления отложений Milizid 1 л";"SUNNY DAY освежитель воздуха Летний Дождь 300 мл";450167
"Пакеты для мусора 60 л Особо Прочные 20 шт;ENERGIZER батарейки AAA (LR03) 20 шт";"ЧИСТЮЛЯ Салфетки целлюлозные Маленькая кухня мини 3 шт;FORESTER решетка-гриль большая;ENERGIZER батарейки A27 2 шт";"DELISS ароматизатор для автомобиля Joy саше 1 шт";450114
"Совок с закрывающейся крышкой Леголэнд;VILEDA салфетка хозяйственная МикроТафф Бэйс 36х36 см желтая 1 шт";"VILEDA перчатки Контракт резиновые M;COMET порошок чистящий Океан 475 г;EXPEL средство для чистки унитаза соединенного с септиком";"SYMPHONY Освежитель воздуха Морской бриз 300см3 /12/12";450174
"СОЮЗГРИЛЬ уголь Пионер 10 л;ENERGIZER батарейка CR2025 1 шт";"ENERGIZER батарейка CR2032 1 шт;FORESTER решетка-гриль для стейков 22 х 44 см 1 шт";"REFRESH ароматизатор для автомобиля Your Car Солнечный Лимон клипса 4 шт";450131
"ЧИСТИН средство санитарно-гигиеническое 750 мл;COMET порошок чистящий Лимон 475 г";"QUALITA губки кухонные Extra Strong 5+1 шт;ДОННА РОЗА перчатки хозяйственные L;Щетка для совка Леголэнд 25 см";"SYMPHONY сменный баллон для автоматического освежителя воздуха Утренняя роса 250 мл";450179
"ЧИСТЮЛЯ губка в сетке со стальной нитью 2 шт";"QUALITA перчатки хозяйственные Universal L;ЧИСТЮЛЯ швабра отжимная с губкой ПВА 1 ролик;ПЕМОЛЮКС чистящее средство Лимон 480 г";"BREESAL освежитель воздуха Arome Art Вдохновение";450158
"ЧИСТЮЛЯ губка поролоновая с абразивом Маленькая кухня XL 1 шт;FORESTER решетка-гриль для овощей объемная 21 х 28 см 1 шт";"DURACELL батарейки Turbo Max AA 8 шт;FORESTER решетка-гриль для стейков 22 х 44 см 1 шт;FORESTER решетка-гриль большая с антипригарным покрытием";"DELISS ароматизатор для автомобиля Comfort  картонный 1 шт";460433
"ЧИСТЮЛЯ губки поролоновые с абразивом Комфорт 7 шт;VORTEX нейтрализатор запаха Block свежесть 500 мл";"ЧИСТЮЛЯ губка-нержавейка со стальной нитью Маленькая кухня;ДОННА РОЗА перчатки хозяйственные L;Щетка для совка Леголэнд 25 см";"SYMPHONY сменный балон Лаванда и Грейпфрут для автоматического освежителя воздуха 250 мл";460311
"ЧИСТЮЛЯ губки поролоновые с абразивом XL 5 шт;COMET чистящий спрей для ванной комнаты 500 мл";"ЧИСТЫЙ СОСТАВ моющее средство Ацид антиналет 750 мл;ДОМИНГО Перчатки хозяйственные Brute прочные S;ЧИСТЮЛЯ швабра с насадкой из микрофибры";"SUNNY DAY освежитель воздуха Солнечный Лимон 300 мл";450170
"ЧИСТЮЛЯ ЛЕГКАЯ салфетки вискозные 3 шт;CIF чистящий крем Max Свежесть Эвкалипта 450 мл";"VILEDA перчатки Контракт резиновые M;Совок с закрывающейся крышкой Леголэнд;ЧИСТЮЛЯ Перчатки латексные с напылением хлопка M";"BREESAL декор ароматизатор Arome Fleur Мелодия Чувств 1 шт";450151
"ЧИСТЮЛЯ ЛЕГКАЯ салфетки вискозные тонкие 5 шт;KLEENEX салфетки универсальные Viva в рулоне1 шт";"DURACELL батарейки Basic AAA 8 шт;FORESTER решетка-гриль со съёмной ручкой;СОЮЗГРИЛЬ Брикеты угольные длительного горения 2 кг";"DELISS ароматизатор для автомобиля  Joy  картонный 1 шт";460431
"ЧИСТЮЛЯ мочалка из нержавеющей стали 1 шт;FORESTER решетка-гриль малая";"ДОМИНГО салфетки целлюлозные абсорбирующие 3 шт;DURACELL батарейка Basic 9V 1 шт;BAGI салфетки в рулоне Чудо Тряпка анти-ворсинки 140 шт";"DELISS ароматизатор для автомобиля Harmony саше 1 шт";450111
"ЧИСТЮЛЯ мочалки из нержавеющей стали 2 шт;ЧИСТЮЛЯ ЛЕГКАЯ салфетки вискозные тонкие 5 шт";"СОЮЗГРИЛЬ решетка-гриль 22 х 35 см 1 шт;ЧИСТЮЛЯ Салфетка - полотенце из микрофибры для посуды";"REFRESH ароматизатор для автомобиля Your Car Солнечный Лимон мини диффузор 2 шт";460309
"ЧИСТЮЛЯ насадка из микрофибры для швабры;ПЕМОЛЮКС чистящее средство Сода 5 лимон 480 г";"ДОМИНГО Перчатки хозяйственные Brute прочные L;BAGI салфетки в рулоне Чудо Тряпка Гипоаллергенная 33 шт";"BREESAL Aqua-нейтрализатор Запаха Освежающий Микс 375 мл";450145
"ЧИСТЮЛЯ насадка из микрофибры для швабры;KLEENEX салфетки универсальные Viva в рулоне1 шт";"ЧИСТЮЛЯ ЛЕГКАЯ перчатки хозяйственные легкие прочные S;DOMESTOS универсальный чистящий гель Лимонная Свежесть 1 л;VILEDA салфетка хозяйственная Бризи универсальная 35х35 см зеленая 1 шт";"СИМФОНИЯ освежитель воздуха Весенняя Свежесть 300 мл";450163
"ЧИСТЮЛЯ пакеты для мусора Стандарт 60 л 31 шт;ЧИСТЮЛЯ насадка для отжимной швабры";"QUALITA перчатки хозяйственные Universal M;CIF чистящий крем Active Лимон 250 мл;QUALITA cкребок из нержавеющей стали 1 шт";"BREESAL ароматизатор Arome Fleur элегия любви 150 мл";450148
"ЧИСТЮЛЯ Перчатки латексные с напылением хлопка S;BAGI салфетки в рулоне Чудо Тряпка Супер Прочная 33 шт";"CIF чистящий крем Max Свежесть Эвкалипта 450 мл;ЧИСТЮЛЯ губка поролоновая с абразивом MIDI 10 шт;ЧИСТЮЛЯ швабра отжимная с губкой ПВА 1 ролик";"СИМФОНИЯ сменный баллон для автоматического освежителя воздуха Морской Бриз 250 мл";450165
"ЧИСТЮЛЯ Перчатки латексные с напылением хлопка S;QUALITA салфетки Влаговпитывающие целлюлозные 3 шт";"Совок с закрывающейся крышкой Леголэнд;ПЕМОЛЮКС чистящее средство Сода 5 ослепительно белый 480 г;MEINE LIEBE чистящее средство для сантехники 500 мл";"BREESAL био-поглотитель запаха для холодильника 80 г";450150
"ЧИСТЮЛЯ Салфетка - полотенце из микрофибры для посуды;ENERGIZER батарейки AAA (LR03) 20 шт";"FORESTER казан чугунный с крышкой-сковородой 1 шт;ЧИСТЮЛЯ ЛЕГКАЯ салфетки вискозные 3 шт;FORESTER решетка-гриль для овощей";"REFRESH ароматизатор для автомобиля Your Car  Клубника и Прохладный Лимонад мини диффузор 2 шт";460434
"ЧИСТЮЛЯ Салфетка - полотенце из микрофибры для посуды;VILEDA Губка средней жёсткости жёлтая с зелёный абразивом 9x7см 1 шт";"ЧИСТЮЛЯ ЛЕГКАЯ перчатки хозяйственные легкие прочные S;Сгон для совка Леголэнд  35 см;SANFOR чистящее средство Universal 10 в 1 Морской бриз 750 мл";"SYMPHONY сменный баллон для автоматического освежителя воздуха Сочные ягоды 250 мл";450177
"ЧИСТЮЛЯ салфетка вискозная в рулоне 30 шт;ЧИСТЮЛЯ пакеты для мусора Стандарт 30 л 31 шт";"ENERGIZER батарейки Maximum AAA 2 шт;ЧИСТЮЛЯ губка поролоновая для ванной;FORESTER решетка-гриль чугунная 1 шт";"DELISS подарочный набор Ароматы Для Авто Подвесное Саше + 2 Картонные подвески";450123
"ЧИСТЮЛЯ салфетка для кухни из микрофибры Антижир;ЧИСТЮЛЯ ЛЕГКАЯ перчатки хозяйственные легкие прочные L";"ДОННА РОЗА салфетки вискозные 3 шт;SANFOR чистящее средство Universal 10 в 1 Морской бриз 750 мл;ЧИСТЮЛЯ насадка для отжимной швабры";"SUNNY DAY освежитель воздуха Майский Ландыш 300 мл";450168
"ЧИСТЮЛЯ салфетки вискозная 3 шт;ЧИСТЮЛЯ Губки для посуды Легкая с защитой маникюра 3 шт";"DURACELL батарейки Basic C 2 шт;СОЮЗГРИЛЬ решетка-гриль 23 х 42 см 1 шт;ЧИСТЮЛЯ Губка целлюлозная Натуральная";"REFRESH ароматизатор для автомобиля Your Car Новая Машина и Прохладный Бриз клипса 4 шт";450129
"ЧИСТЮЛЯ салфетки вискозные 10 шт";"MR PROPER Моющий порошок для уборки Универсальный с отбеливателем 400 г;ЧИСТЮЛЯ ЛЕГКАЯ перчатки хозяйственные легкие прочные M;ЧИСТЮЛЯ швабра с насадкой из микрофибры";"СИМФОНИЯ освежитель воздуха Ландыш 300 мл";450161
"ЧИСТЮЛЯ салфетки вискозные 5 шт;ДОМИНГО Перчатки с длинной манжетой Longa S";"ЧИСТЮЛЯ швабра с насадкой из микрофибры;ЧИСТИН чистящий порошок Яблоко 400 г";"BREESAL освежитель Аромат Для Дома Чарующая Роскошь 250 мл";450152
"ЧИСТЮЛЯ салфетки вискозные тонкие 5 шт;BAGI Средство для удаления накипи Кумкумит 550 мл";"ДОМИНГО Перчатки с длинной манжетой Longa М;CIF чистящий крем Max Ледяной Бриз 450 мл;ЧИСТЮЛЯ швабра отжимная с губкой ПВА 1 ролик";"СИМФОНИЯ освежитель воздуха Морской Бриз 300 мл";450162
"ЧИСТЮЛЯ Салфетки из микрофибры для окон";"FORESTER решетка-гриль со съёмной ручкой;DURACELL батарейки UltraPower AA 4 шт";"REFRESH ароматизатор для автомобиля Your Car  Клубника и Прохладный Лимонад клипса 4 шт";460436
"ЧИСТЮЛЯ швабра отжимная с губкой ПВА 1 ролик;ЧИСТЮЛЯ салфетка для кухни из микрофибры Антижир";"COMET порошок чистящий Лимон 475 г;DOMESTOS туалетный блок Power 5 Duo Свежесть Лайма 1 шт;ЧИСТЮЛЯ Перчатки латексные с напылением хлопка L";"SUNNY DAY освежитель воздуха Антитабак Сочный Цитрус 300 мл";450166
"ЧИСТЮЛЯ Baby салфетки для уборки в деткой из микрофибры 2 шт;DURACELL батарейка 12V MN27 1 шт";"VILEDA салфетка вискозная универсальная 38х40 см голубая 1 шт;СОЮЗГРИЛЬ решетка-гриль универсальная с регулируемой высотой 20 х 25см 1 шт;FORESTER очиститель гелевый с алое-вера с дозатором 500 мл";"BAHAMA&CO ароматизатор для автомобиля Дикий Гибискус Вайкики ожерелье 1 шт";460308
"Щетка для совка Леголэнд 25 см;ЧИСТЮЛЯ Перчатки латексные с напылением хлопка L";"ЧИСТЮЛЯ насадка из микрофибры для швабры;ЧИСТЮЛЯ салфетка для пола с микрофиброй;DR. SCHNELL Универсальное моющее средство Unimagic 1 л";"BREESAL ароматические гелевые шарики Свежесть Летнего Луга 215 г";450146
"BREF туалетный блок Сила-Актив лимонная свежесть 2 шт;QUALITA перчатки хозяйственные Universal M";"COMET Чистящий гель Весенняя свежесть 1 л;ЧИСТЮЛЯ насадка для отжимной швабры;ДОМИНГО Салфетки из микрофибры для окон Windowzer 2 шт";"SYMPHONY очиститель воздуха От запахов животных 300 мл";450172
"BREF туалетный блок Сила-Актив океанский бриз 1 шт;Щетка для совка Леголэнд 25 см";"CIF чистящий крем Active Лимон 250 мл;ЧИСТЮЛЯ Перчатки латексные с напылением хлопка M;ЧИСТЮЛЯ Baby салфетки для уборки из микрофибры для мытья пола в детской 2 шт";"BREESAL освежитель воздуха Arome Art Преображение";450157
"COMET порошок чистящий Лимон 475 г;COMET Чистящий гель Сосна 1 л";"ЧИСТЮЛЯ швабра отжимная с губкой ПВА 1 ролик;QUALITA Салфетки вискозные для экспресс-уборки в рулоне 70 шт;ЧИСТЮЛЯ ЛЕГКАЯ перчатки хозяйственные легкие прочные M";"BREESAL сменный картридж для био-поглотителя запаха для холодильника 80 г";450159
"DOMESTOS универсальный чистящий гель Ультра Блеск 500 мл;ЧИСТЮЛЯ Губки для посуды Легкая с защитой маникюра 3 шт";"CIF чистящий крем Зеленая Свежесть 500 мл;ЧИСТЮЛЯ насадка для отжимной швабры;ДОМИНГО перчатки хозяйственные Gadget Brute Экстрапрочные M";"SYMPHONY Освежитель воздуха Клубничный щербет 300мл";460310
"DURACELL батарейка 12V MN21 1 шт;ЧИСТЮЛЯ салфетка-варежка из микрофибры 1 шт";"СОЮЗГРИЛЬ решетка-гриль универсальная с регулируемой высотой 20 х 25см 1 шт;VILEDA cпрей-бутылочка с распылителем белая 600 мл;ЧИСТЮЛЯ ЛЕГКАЯ перчатки хозяйственные легкие прочные S";"DELISS ароматизатор для автомобиля Romance саше 1 шт";450118
"DURACELL батарейка Basic 9V 1 шт;ЧИСТЮЛЯ губка-хватайка поролоновая с абразивом Маленькая кухня 1 шт";"СОЮЗГРИЛЬ решетка-гриль 22 х 35 см 1 шт;VILEDA салфетка хозяйственная МикроТафф Плюс 38х38 см красная 1 шт;ЧИСТЮЛЯ мочалки металлические для посуды 2 шт";"DELISS ароматизатор для автомобиля Romance подвесной 1 шт";450117
"DURACELL батарейки Industrial AA 10 шт;ЧИСТЮЛЯ губка-нержавейка со стальной нитью Маленькая кухня";"СОЮЗГРИЛЬ решетка-гриль универсальная с регулируемой высотой 20 х 25см 1 шт;ЧИСТЮЛЯ мочалки металлические для посуды 2 шт;Пакеты для мусора 30 л Стандарт 30 шт";"DELISS ароматизатор для автомобиля Comfort набор 1 шт";450108
"DURACELL зарядное устройство для аккумуляторов CEF15;VILEDA салфетка вискозная универсальная 38х40 см красная 1 шт";"СОЮЗГРИЛЬ решетка-гриль универсальная с регулируемой высотой 25 х 32 см 1 шт;Набор для уборки УльтраСпид Мини Красный;EVEREADY батарейка SuperHD 9V 1 шт";"DELISS ароматизатор для автомобиля Romance  мембранный 4 мл";460430
"DURACELL портативное зарядное устройство для мобильных гаджетов 1150 mAh;FORESTER казан чугунный с крышкой-сковородой 1 шт";"VILEDA салфетка вискозная универсальная 38х40 см зеленая 1 шт;DURACELL батарейки Basic AA 12 шт;VILEDA перчатки Контракт резиновые M";"DELISS ароматизатор для автомобиля Car картонный 1 шт";450106
"ENERGIZER батарейки AAA (LR03) 20 шт;BAGI салфетки в рулоне Чудо Тряпка Супер Прочная 33 шт";"ENERGIZER батарейки Maximum AAA 2 шт;СОЮЗГРИЛЬ решетка-гриль 23 х 42 см 1 шт;ENERGIZER батарейки Maximum AA 2 шт";"DELISS ароматизатор для автомобиляя Comfort саше 1 шт";450120
"ENERGIZER батарейки Maximum AA 4 шт;СОЮЗГРИЛЬ решетка-гриль Универсальная с регулируемой высотой 24 х 37 см";"DURACELL батарейки Turbo Max AA 8 шт;ЧИСТЮЛЯ губка Оттиратор меламиновая для сложных пятен 1 шт;ДОМИНГО Салфетка из микрофибры для уборки Plush-up";"DELISS ароматизатор для автомобиля Harmony  картонный 1 шт";460429
"EVEREADY батарейка SuperHD 9V 1 шт;DOMESTOS влажные салфетки для очищения поверхностей Антибактериальные 30 шт";"FORESTER Решетка-гриль для рыбы 1 шт;DURACELL батарейки Basic AA 8 шт;VILEDA салфетка хозяйственная Бризи универсальная 35х35 см голубая 1 шт";"BAHAMA&CO ароматизатор для автомобиля Аромат с осторова Oaxy тапочек 1 шт";450101
"EXPEL Жирогон Средство для устранения засоров от жира и пищевых остатков 2*50гр;ПЕМОЛЮКС чистящее средство Сода 5 яблоко 480 г";"ДОННА РОЗА перчатки хозяйственные L;ЧИСТЮЛЯ салфетка для кухни из микрофибры Антижир";"СИМФОНИЯ освежитель воздуха Антитабак 300 мл";460312
"FORESTER Комплект Шашлычки на шпажках: гриль-приправа Свиная шейка 5 специй + 8 бамбуковых шпажек;EVEREADY батарейки HD C/R14 2 шт";"СОЮЗГРИЛЬ лотки для запекания 3 шт;DURACELL батарейки Basic AAA 12 шт;VILEDA салфетка хозяйственная МикроТафф Бэйс 36х36 см красная 1 шт";"REFRESH ароматизатор для автомобиля Your Car Новая Машина и Прохладный Бриз диффузор 1 шт";450128
