"Рекомендуемые товары";"Сопутствующие товары";"Короткое название";"Артикул"
"FORESTER решетка-гриль малая;EVEREADY батарейки SuperHD AAA 4 шт";"ЧИСТЮЛЯ салфетки вискозные 5 шт;VILEDA салфетка-губка Веттекс Классик 18х20 см красная 1 шт;FORESTER набор шампуров 55 см в чехле 6 шт";"REFRESH ароматизатор для автомобиля Your Car  Клубника и Прохладный Лимонад диффузор 1 шт";460435
"FORESTER решетка-гриль малая;VILEDA салфетка вискозная универсальная 38х40 см зеленая 1 шт";"DURACELL батарейка CR2 3V для фотоаппаратов 1 шт;FORESTER Решетка-гриль для рыбы 1 шт;ЧИСТЮЛЯ губка поролоновая для ванной";"DELISS нейтрализатор запаха  для автомобиля Comfort Тройного действия 100 мл";460432
"FORESTER Решетка-гриль объемная большая с антипригарным покрытием;DURACELL аккумуляторы AA 2500 mAh 2 шт";"ЧИСТЮЛЯ Губка целлюлозная Натуральная;FORESTER Комплект Шашлычки на шпажках: гриль-приправа Свиная шейка 5 специй + 8 бамбуковых шпажек;EVEREADY батарейки HD D/R20 2 шт";"CALIFORNIA SCENTS ароматизатор для автомобиля Вишня Коронадо банка 1 шт";450104
"FORESTER решетка-гриль объемная со съёмной ручкой малая;DURACELL батарейки Industrial AA 10 шт";"DURACELL батарейки Basic AA 12 шт;FORESTER решетка-гриль для овощей;ЧИСТЮЛЯ мочалка-нержавейка Маленькая кухня";"CALIFORNIA SCENTS ароматизатор для автомобиля Новая Машина банка 1 шт";450103
"MR PROPER моющее средство Чистота и Гигиена эвкалипт 500 мл;SANFOR чистящее средство Activ Антиржавчина 750 мл";"ЧИСТЮЛЯ насадка для отжимной швабры;ЧИСТЮЛЯ салфетки целлюлозные 3 шт;ДОМИНГО Перчатки с длинной манжетой Longa L";"SYMPHONY освежитель воздуха Зелёный чай 300 мл";450175
"QUALITA перчатки хозяйственные Universal L";"QUALITA салфетки Влаговпитывающие целлюлозные 3 шт;MR PROPER моющее средство Чистота и Гигиена эвкалипт 500 мл;VORTEX моющее средство Destroy для удаления загрязнений после строительства и ремонта 1 л";"BREESAL ароматическое саше Атласный Восторг 20 г";450147
"SANFOR чистящее средство WС гель Speсial black 750 мл";"ДОМИНГО Перчатки с длинной манжетой Longa S;ЧИСТЮЛЯ швабра с насадкой из микрофибры;ЧИСТЮЛЯ Салфетка - полотенце из микрофибры для посуды";"BREESAL освежитель воздуха Arome Art Наслаждение";450156
"VILEDA Губка средней жёсткости жёлтая с зелёный абразивом 9x7см 1 шт;DURACELL батарейки Basic AA 8 шт";"DURACELL батарейки Industrial AAA 10 шт;СОЮЗГРИЛЬ уголь Пионер 10 л;СОЮЗГРИЛЬ решетка-гриль 22 х 35 см 1 шт";"DELISS ароматизатор для автомобиля Comfort подвесной 1 шт";450109
"VILEDA салфетка вискозная универсальная 38х40 см голубая 1 шт;COMET порошок чистящий Сосна 475 г";"ПЕМОЛЮКС чистящее средство Лимон 480 г;ДОМИНГО Перчатки с длинной манжетой Longa L;ЧИСТЮЛЯ швабра с насадкой из микрофибры";"СИМФОНИЯ освежитель воздуха Яблоневый цвет 300 мл";450164
"VILEDA салфетка вискозная универсальная 38х40 см желтая 1 шт";"СОЮЗГРИЛЬ Мангал разборный 35*25см;FORESTER решетка-гриль для стейков 22 х 44 см 1 шт;EVEREADY батарейки SuperHD AA 4 шт";"REFRESH ароматизатор для автомобиля Your Car Новая Машина мини диффузор 2 шт";450130
"VILEDA салфетка вискозная универсальная 38х40 см зеленая 1 шт;FORESTER решетка-гриль чугунная 1 шт";"ENERGIZER батарейки AA (LR6) 20 шт;ENERGIZER батарейки MAX AA (LR6) 2 шт;СОЮЗГРИЛЬ набор совок + кочерга 1 шт";"DELISS ароматизатор для автомобиляи Joy мембранный 4 мл";450119
"VILEDA салфетка хозяйственная Бризи универсальная 35х35 см голубая 1 шт;СОЮЗГРИЛЬ решетка-гриль Универсальная с регулируемой высотой 24 х 37 см";"DURACELL аккумуляторы AA 1300 mAh 2 шт;DURACELL батарейка 12V MN27 1 шт;BAGI салфетки в рулоне Чудо Тряпка Супер Прочная 33 шт";"CALIFORNIA SCENTS ароматизатор для автомобиля Вишня Коронадо картон подвесной 3 шт";450105
"VILEDA салфетка хозяйственная МикроТафф Бэйс 36х36 см красная 1 шт;СОЮЗГРИЛЬ решетка-гриль 22 х 22 см 1 шт";"ENERGIZER батарейки Plus AA 4 шт;ENERGIZER батарейки MAX C/LR14 2 шт;DURACELL батарейки Turbo Max AA 4 шт";"DELISS ароматизатор для автомобиля Romance  картонный 1 шт";460428
"VORTEX чистящее средство для удаления плесени и грибка Fungus 500 мл;ЧИСТЮЛЯ насадка из микрофибры для швабры";"VILEDA салфетка-губка Веттекс Классик 18х20 см красная 1 шт;ЧИСТИН чистящий порошок Лимонный всплеск 400 г;ЧИСТЮЛЯ Перчатки латексные с напылением хлопка L";"BREESAL ароматизатор Arome Fleur шлейф волшебства 150 мл";450149
"ЧИСТЮЛЯ швабра отжимная с губкой ПВА 1 ролик;ЧИСТЮЛЯ салфетка для кухни из микрофибры Антижир";"COMET порошок чистящий Лимон 475 г;DOMESTOS туалетный блок Power 5 Duo Свежесть Лайма 1 шт;ЧИСТЮЛЯ Перчатки латексные с напылением хлопка L";"BAHAMA&CO ароматизатор для автомобиля Аромат с осторова Oaxy девушка 1 шт";450100
"ЧИСТЮЛЯ Baby салфетки для уборки в деткой из микрофибры 2 шт;DURACELL батарейка 12V MN27 1 шт";"VILEDA салфетка вискозная универсальная 38х40 см голубая 1 шт;СОЮЗГРИЛЬ решетка-гриль универсальная с регулируемой высотой 20 х 25см 1 шт;FORESTER очиститель гелевый с алое-вера с дозатором 500 мл";"DELISS ароматизатор для автомобиля Joy набор 1 шт";450113
"Щетка для совка Леголэнд 25 см;ЧИСТЮЛЯ Перчатки латексные с напылением хлопка L";"ЧИСТЮЛЯ насадка из микрофибры для швабры;ЧИСТЮЛЯ салфетка для пола с микрофиброй;DR. SCHNELL Универсальное моющее средство Unimagic 1 л";"DELISS подарочный набор Ароматизатор для автомобиля Comfort 3 шт";450124
"BREF туалетный блок Сила-Актив лимонная свежесть 2 шт;QUALITA перчатки хозяйственные Universal M";"COMET Чистящий гель Весенняя свежесть 1 л;ЧИСТЮЛЯ насадка для отжимной швабры;ДОМИНГО Салфетки из микрофибры для окон Windowzer 2 шт";"REFRESH ароматизатор для автомобиля Your Car Тропические Фрукты мини диффузор 2 шт";450133
"BREF туалетный блок Сила-Актив океанский бриз 1 шт;Щетка для совка Леголэнд 25 см";"CIF чистящий крем Active Лимон 250 мл;ЧИСТЮЛЯ Перчатки латексные с напылением хлопка M;ЧИСТЮЛЯ Baby салфетки для уборки из микрофибры для мытья пола в детской 2 шт";"DELISS ароматизатор для автомобиля Comfort картонный 1 шт";450107
"COMET порошок чистящий Лимон 475 г;COMET Чистящий гель Сосна 1 л";"ЧИСТЮЛЯ швабра отжимная с губкой ПВА 1 ролик;QUALITA Салфетки вискозные для экспресс-уборки в рулоне 70 шт;ЧИСТЮЛЯ ЛЕГКАЯ перчатки хозяйственные легкие прочные M";"DELISS ароматизатор для автомобиля Harmony картонный 1 шт";450110
"DOMESTOS универсальный чистящий гель Ультра Блеск 500 мл;ЧИСТЮЛЯ Губки для посуды Легкая с защитой маникюра 3 шт";"CIF чистящий крем Зеленая Свежесть 500 мл;ЧИСТЮЛЯ насадка для отжимной швабры;ДОМИНГО перчатки хозяйственные Gadget Brute Экстрапрочные M";"DELISS ароматизатор для автомобиля Joy картонный 1 шт";450112
"DURACELL батарейка 12V MN21 1 шт;ЧИСТЮЛЯ салфетка-варежка из микрофибры 1 шт";"СОЮЗГРИЛЬ решетка-гриль универсальная с регулируемой высотой 20 х 25см 1 шт;VILEDA cпрей-бутылочка с распылителем белая 600 мл;ЧИСТЮЛЯ ЛЕГКАЯ перчатки хозяйственные легкие прочные S";"DELISS ароматизатор для автомобиля Romance  мембранный 4 мл";450116
"DURACELL батарейка Basic 9V 1 шт;ЧИСТЮЛЯ губка-хватайка поролоновая с абразивом Маленькая кухня 1 шт";"СОЮЗГРИЛЬ решетка-гриль 22 х 35 см 1 шт;VILEDA салфетка хозяйственная МикроТафф Плюс 38х38 см красная 1 шт;ЧИСТЮЛЯ мочалки металлические для посуды 2 шт";"DELISS ароматизатор для автомобиля Romance картонный 1 шт";450115
"DURACELL батарейки Industrial AA 10 шт;ЧИСТЮЛЯ губка-нержавейка со стальной нитью Маленькая кухня";"СОЮЗГРИЛЬ решетка-гриль универсальная с регулируемой высотой 20 х 25см 1 шт;ЧИСТЮЛЯ мочалки металлические для посуды 2 шт;Пакеты для мусора 30 л Стандарт 30 шт";"DELISS нейтрализатор запаха для автомобиля Comfort Тройного действия 100 мл";450122
"DURACELL зарядное устройство для аккумуляторов CEF15;VILEDA салфетка вискозная универсальная 38х40 см красная 1 шт";"СОЮЗГРИЛЬ решетка-гриль универсальная с регулируемой высотой 25 х 32 см 1 шт;Набор для уборки УльтраСпид Мини Красный;EVEREADY батарейка SuperHD 9V 1 шт";"REFRESH ароматизатор для автомобиля Your Car Клубника и Прохладный Лимонад диффузор 1 шт";450125
"DURACELL портативное зарядное устройство для мобильных гаджетов 1150 mAh;FORESTER казан чугунный с крышкой-сковородой 1 шт";"VILEDA салфетка вискозная универсальная 38х40 см зеленая 1 шт;DURACELL батарейки Basic AA 12 шт;VILEDA перчатки Контракт резиновые M";"REFRESH ароматизатор для автомобиля Your Car Клубника и Прохладный Лимонад клипса 4 шт";450126
"ENERGIZER батарейки AAA (LR03) 20 шт;BAGI салфетки в рулоне Чудо Тряпка Супер Прочная 33 шт";"ENERGIZER батарейки Maximum AAA 2 шт;СОЮЗГРИЛЬ решетка-гриль 23 х 42 см 1 шт;ENERGIZER батарейки Maximum AA 2 шт";"REFRESH ароматизатор для автомобиля Your Car Клубника и Прохладный Лимонад мини диффузор 2 шт";450127
"ENERGIZER батарейки Maximum AA 4 шт;СОЮЗГРИЛЬ решетка-гриль Универсальная с регулируемой высотой 24 х 37 см";"DURACELL батарейки Turbo Max AA 8 шт;ЧИСТЮЛЯ губка Оттиратор меламиновая для сложных пятен 1 шт;ДОМИНГО Салфетка из микрофибры для уборки Plush-up";"AIR WICK аэрозольный освежитель воздуха Pure Природная свежесть 250 мл";450134
"EVEREADY батарейка SuperHD 9V 1 шт;DOMESTOS влажные салфетки для очищения поверхностей Антибактериальные 30 шт";"FORESTER Решетка-гриль для рыбы 1 шт;DURACELL батарейки Basic AA 8 шт;VILEDA салфетка хозяйственная Бризи универсальная 35х35 см голубая 1 шт";"AIR WICK аэрозольный освежитель воздуха Pure Солнечный цитрус 250 мл";450135
"EXPEL Жирогон Средство для устранения засоров от жира и пищевых остатков 2*50гр;ПЕМОЛЮКС чистящее средство Сода 5 яблоко 480 г";"ДОННА РОЗА перчатки хозяйственные L;ЧИСТЮЛЯ салфетка для кухни из микрофибры Антижир";"AIR WICK аэрозольный освежитель воздуха Pure Весеннее настроение 250 мл";450136
"FORESTER Комплект Шашлычки на шпажках: гриль-приправа Свиная шейка 5 специй + 8 бамбуковых шпажек;EVEREADY батарейки HD C/R14 2 шт";"СОЮЗГРИЛЬ лотки для запекания 3 шт;DURACELL батарейки Basic AAA 12 шт;VILEDA салфетка хозяйственная МикроТафф Бэйс 36х36 см красная 1 шт";"AIR WICK Сменный баллон к автоматическому освежителю воздуха Магнолия и цветущая вишня 250 мл";450137
"FORESTER решетка-гриль малая;EVEREADY батарейки SuperHD AAA 4 шт";"ЧИСТЮЛЯ салфетки вискозные 5 шт;VILEDA салфетка-губка Веттекс Классик 18х20 см красная 1 шт;FORESTER набор шампуров 55 см в чехле 6 шт";"AIR WICK Сменный баллон к автоматическому освежителю воздуха Нежность шелка и лилии 250 мл";450138
"FORESTER решетка-гриль малая;VILEDA салфетка вискозная универсальная 38х40 см зеленая 1 шт";"DURACELL батарейка CR2 3V для фотоаппаратов 1 шт;FORESTER Решетка-гриль для рыбы 1 шт;ЧИСТЮЛЯ губка поролоновая для ванной";"AIR WICK Сменный баллон к автоматическому освежителю воздуха Райские цветы 250 мл";450139
"FORESTER Решетка-гриль объемная большая с антипригарным покрытием;DURACELL аккумуляторы AA 2500 mAh 2 шт";"ЧИСТЮЛЯ Губка целлюлозная Натуральная;FORESTER Комплект Шашлычки на шпажках: гриль-приправа Свиная шейка 5 специй + 8 бамбуковых шпажек;EVEREADY батарейки HD D/R20 2 шт";"AIR WICK Сменный баллон к автоматическому освежителю воздуха Райское Наслаждение 250 мл";450140
"FORESTER решетка-гриль объемная со съёмной ручкой малая;DURACELL батарейки Industrial AA 10 шт";"DURACELL батарейки Basic AA 12 шт;FORESTER решетка-гриль для овощей;ЧИСТЮЛЯ мочалка-нержавейка Маленькая кухня";"AIR WICK Сменный баллон к автоматическому освежителю воздуха Свежесть водопада 250 мл";450141
"MR PROPER моющее средство Чистота и Гигиена эвкалипт 500 мл;SANFOR чистящее средство Activ Антиржавчина 750 мл";"ЧИСТЮЛЯ насадка для отжимной швабры;ЧИСТЮЛЯ салфетки целлюлозные 3 шт;ДОМИНГО Перчатки с длинной манжетой Longa L";"AIRWICK автоматический аэрозольный освежитель воздуха в комплекте со сменным баллоном Life Scents Сказочный Сад 250 мл";450142
"QUALITA перчатки хозяйственные Universal L";"QUALITA салфетки Влаговпитывающие целлюлозные 3 шт;MR PROPER моющее средство Чистота и Гигиена эвкалипт 500 мл;VORTEX моющее средство Destroy для удаления загрязнений после строительства и ремонта 1 л";"AIRWICK сменный баллон к автоматическому освежителю воздуха Лимон и Женшень 250 мл";450143
"SANFOR чистящее средство WС гель Speсial black 750 мл";"ДОМИНГО Перчатки с длинной манжетой Longa S;ЧИСТЮЛЯ швабра с насадкой из микрофибры;ЧИСТЮЛЯ Салфетка - полотенце из микрофибры для посуды";"BREESAL Aqua-нейтрализатор Запаха Антитабак ганатовый Коктейль 375 мл";450144
"VILEDA Губка средней жёсткости жёлтая с зелёный абразивом 9x7см 1 шт;DURACELL батарейки Basic AA 8 шт";"DURACELL батарейки Industrial AAA 10 шт;СОЮЗГРИЛЬ уголь Пионер 10 л;СОЮЗГРИЛЬ решетка-гриль 22 х 35 см 1 шт";"BREESAL освежитель Аромат Для Дома Загадочная Романтика 250 мл";450153
"VILEDA салфетка вискозная универсальная 38х40 см голубая 1 шт;COMET порошок чистящий Сосна 475 г";"ПЕМОЛЮКС чистящее средство Лимон 480 г;ДОМИНГО Перчатки с длинной манжетой Longa L;ЧИСТЮЛЯ швабра с насадкой из микрофибры";"BREESAL освежитель Ароматические Гелевые Энергия Фруктов 215 г";450154
"VILEDA салфетка вискозная универсальная 38х40 см желтая 1 шт";"СОЮЗГРИЛЬ Мангал разборный 35*25см;FORESTER решетка-гриль для стейков 22 х 44 см 1 шт;EVEREADY батарейки SuperHD AA 4 шт";"BREESAL освежитель Ароматические Гелевые Шарики Сочность Ягод 215 г";450155
"VILEDA салфетка вискозная универсальная 38х40 см зеленая 1 шт;FORESTER решетка-гриль чугунная 1 шт";"ENERGIZER батарейки AA (LR6) 20 шт;ENERGIZER батарейки MAX AA (LR6) 2 шт;СОЮЗГРИЛЬ набор совок + кочерга 1 шт";"FAX Аэрозольный освежитель воздуха Морская свежесть 300 мл";450160
"VILEDA салфетка хозяйственная Бризи универсальная 35х35 см голубая 1 шт;СОЮЗГРИЛЬ решетка-гриль Универсальная с регулируемой высотой 24 х 37 см";"DURACELL аккумуляторы AA 1300 mAh 2 шт;DURACELL батарейка 12V MN27 1 шт;BAGI салфетки в рулоне Чудо Тряпка Супер Прочная 33 шт";"SUNNY DAY освежитель воздуха Мечты о Море 300 мл";450169
"VILEDA салфетка хозяйственная МикроТафф Бэйс 36х36 см красная 1 шт;СОЮЗГРИЛЬ решетка-гриль 22 х 22 см 1 шт";"ENERGIZER батарейки Plus AA 4 шт;ENERGIZER батарейки MAX C/LR14 2 шт;DURACELL батарейки Turbo Max AA 4 шт";"AIR WICK Аэрозольный освежитель воздуха Райские цветы 500 мл";460246
"VORTEX чистящее средство для удаления плесени и грибка Fungus 500 мл;ЧИСТЮЛЯ насадка из микрофибры для швабры";"VILEDA салфетка-губка Веттекс Классик 18х20 см красная 1 шт;ЧИСТИН чистящий порошок Лимонный всплеск 400 г;ЧИСТЮЛЯ Перчатки латексные с напылением хлопка L";"AIR WICK Сменный баллон к автоматическому освежителю воздуха Сказочный Сад 250 мл";460245
