"Рекомендуемые товары";"Сопутствующие товары";"Артикул";"Короткое название"
"ЧИСТАЯ ЛИНИЯ мицеллярная вода 3в1 для нормальной и комбинированной кожи 400 мл;EVO Крем Для Локтей и Коленей 46 мл";"LOREAL крем Возраст Эксперт 45+ вокруг глаз 50 мл;GARNIER Ambre Solaire крем после загара Эксперт Защита освежающий 200 мл;PAMPERS влажные салфетки Sensitive 12 шт";530134;"LOREAL мицеллярный лосьон для сухой и чувствительной кожи 200 мл"
"ЧИСТАЯ ЛИНИЯ молочко для снятия макияжа Идеальная кожа 100 мл;ЧИСТАЯ ЛИНИЯ маска для лица Антивозрастная 45 мл";"LOREAL губная помада Color Riche Shine 245 сияющий рассвет;СОЛНЦЕ И ЛУНА влажные салфетки Для Детей с экстрактом алоэ 63 шт;NIVEA черная пенка для умывания Make-up Expert для жирной кожи 100 мл";530135;"LOREAL мицелярная вода Skin Expert для сухой кожи 400 мл"
"ЧИСТАЯ ЛИНИЯ молочко Мицеллярное для сухой и чувствительной кожи 100 мл;БАРХАТНЫЕ РУЧКИ крем для рук Основной Уход 45 мл";"LOREAL крем Revitalift Лазер Х3 ночной 50 мл;GARNIER крем для кожи вокруг глаз Антивозрастной Уход активный лифтинг 45+ 15мл;BARNANGEN лосьон для тела Caring 400 мл";530136;"LOREAL очищающий тоник Бесконечная Свежесть 200 мл"
"ЧИСТАЯ ЛИНИЯ молочко Мицеллярное для сухой и чувствительной кожи 100 мл;LOREAL крем Увлажнение Эксперт 50 мл";"PAMPERS влажные салфетки Sensitive 12 шт;LOREAL крем Увлажнение Эксперт вокруг глаз 50 мл;CETTUA мини-пластыри для проблемной кожи 36 шт";530137;"NIVEA мицеллярная вода Освежающая 3 в 1 для нормальной кожи 400 мл"
"ЧИСТАЯ ЛИНИЯ Солнцезащитный спрей 20 SPF 160мл;DOVE мицеллярный гель для снятия макияжа С маслами 120 мл";"RAINBOW BEAUTY крем для рук Sense of Care с маслом Ши и Экстрактом Сакуры 35 г;LOREAL крем Увлажнение Эксперт вокруг глаз 50 мл;СОЛНЦЕ И ЛУНА влажные салфетки для детей Фитолиния с отваром череды и облепихи с крышкой 56 шт";530138;"THE SKIN HOUSE спрей-мист Aloe Water Mist увлажняющий 80 мл"
"ЧИСТАЯ ЛИНИЯ Солнцезащитный спрей 20 SPF 160мл;ROYAL SKIN крем для рук Water Drop с Экстрактом Гардении 60 мл";"CHAMOS средство для умывания Acaci Special с Экстрактом Лимона 20 мл;PAMPERS влажные салфетки Sensitive 4x56 шт;GARNIER крем для кожи вокруг глаз Антивозрастной Уход активный лифтинг 45+ 15мл";530139;"THE SKIN HOUSE тонер для лица Dr.Clear Magic Toner 130 мл"
"ЧИСТАЯ ЛИНИЯ фитобальзам для тела Упругость и Питание 200 мл;ЧИСТАЯ ЛИНИЯ крем-актив для лица Идеальная Кожа против прыщей 40 мл";"АВАНТА крем для рук и ногтей Белоручка Крепкие ногти 80 мл;ЧЕРНЫЙ ЖЕМЧУГ крем-сыворотка для век Программа от 56 лет 17 мл;GARNIER лосьон для снятия макияжа с глаз Основной Уход 125 мл";530140;"THE SKIN HOUSE тонер для лица Natural Balancing 130 мл"
"Я САМАЯ влажные салфетки для снятия макияжа 15 шт;AURA Влажные салфетки Ultra Comfort для детей с экстрактом Алоэ и витамином Е 120 шт";"KLEENEX носовые платочки Original белые10 х 10 шт;DOVE мусс для умывания Ухаживающий 160 мл;ЧИСТАЯ ЛИНИЯ Аква‑крем для лица Идеальная Кожа мгновенная матовость 50 мл";530141;"THE SKIN HOUSE тонер для лица Pore Control Powder 130 мл"
"Я САМАЯ влажные салфетки освежающие 15 шт;DOVE крем для рук Объятия Нежности 75 мл";"МОЕ СОЛНЫШКО крем детский солнцезащитный SPF 20 75 мл;ЧИСТАЯ ЛИНИЯ молочко Мицеллярное для сухой и чувствительной кожи 100 мл;LOREAL крем Роскошь Питания вокруг глаз 15 мл";530142;"THE SKIN HOUSE тонер для лица Wrinkle Active 130 мл"
"Я САМАЯ средство для снятия лака Professional с помпой дозатором 150 мл;ЧЕРНЫЙ ЖЕМЧУГ маска-эксперт для лица для Y-зоны 50 мл";"LOREAL очищающее молочко Бесконечная свежесть 200 мл;DOVE крем для лица и тела Питательный 75 мл;БАРХАТНЫЕ РУЧКИ крем для рук Для Всей Семьи 200 мл";530143;"THE SKIN HOUSE тонер для лица Wrinkle Supreme 130 мл"
"AURA влажная туалетная бумага 20 шт;AURA Влажные салфетки Ultra Comfort для детей 15 шт";"LOREAL скраб для лица Сахарный Придающий Сияние 50 мл;CETTUA мини-пластыри для проблемной кожи 36 шт;JOHNSON'S Baby влажные салфетки детские Нежная забота 64 шт";530151;"LOREAL скраб для лица Сахарный Очищающий 50 мл"
"AURA влажные салфетки антибактериальные 20 шт;LOREAL крем Возраст Эксперт 55+ вокруг глаз 50 мл";"GARNIER Крем для загара Ambre Solaire Малыш в Тени SPF 50+ 50 мл;БАРХАТНЫЕ РУЧКИ крем для рук Питательный 80 мл;GARNIER молочко для снятия макияжа Основной Уход  Экстракт Винограда для нормальной и смешанной кожи 200 мл";530152;"LOREAL скраб для лица Сахарный Питательный 50 мл"
"AURA влажные салфетки антибактериальные 72 шт;LOREAL очищающее молочко Бесконечная свежесть 200 мл";"GARNIER Ambre Solaire молочко солнцезащитное SPF 30 200 мл;LOREAL крем Роскошь Питания вокруг глаз 15 мл;АВАНТА крем для рук Белоручка Летний шелк 80 мл";530155;"LUKE угольные полоски Charcoal Nose Cleansing Strip от черных точек 10 шт"
"AURA Влажные салфетки для детей Ultra Comfort с крышкой 120 шт;CETTUA мини-пластыри для проблемной кожи 36 шт";"LOREAL уход-скульптор Возраст Эксперт 45+ для лица, шеи и зоны декольте 50 мл;ZEWA носовые платки Deluxe Ромашка 10 х 10 шт";530156;"NATURA SIBERICA мыло-детокс Северное для глубокой очистки лица черное 120 гр"
"AURA влажные салфетки Tropic Cocktail антибактериальные в ассортименте 15 шт;ZEWA туалетная бумага Плюс Ромашка 2 слоя 4 шт";"ZEWA туалетная бумага Deluxe ромашка 3 слоя 8 шт;HUGGIES влажные салфетки Elite Soft 64 шт;ЧИСТАЯ ЛИНИЯ скраб-маска для лица Фитобаня Обновляющий 75 мл";530157;"NATURA SIBERICA пилинг для лица нежный 150 мл"
"AURA влажные салфетки Tropic Cocktail освежающие 60 шт";"МОЕ СОЛНЫШКО крем детский солнцезащитный SPF 50 55 мл;ЧИСТАЯ ЛИНИЯ гель для умывания на отваре целебных трав для нормальной и комбинированной кожи 160 мл;DOVE крем для рук Объятия Нежности 75 мл";530158;"NATURA SIBERICA пилинг для лица  White отбеливающий малина 150 мл"
"AURA Влажные салфетки Ultra Comfort для детей 100 шт;ЧИСТАЯ ЛИНИЯ лосьон-тоник Лепестки роз для сухой и чувствительной кожи 100 мл";"БАРХАТНЫЕ РУЧКИ крем для рук Для Всей Семьи 200 мл;ЧЕРНЫЙ ЖЕМЧУГ крем для кожи вокруг глаз Крем-Эксперт 46+ 15 мл;GARNIER Ambre Solaire крем после загара Эксперт Защита освежающий 200 мл";530159;"NATURA SIBERICA скраб для лица Natura Kamchatka вулканический активный detox 150 мл"
"AURA Влажные салфетки Ultra Comfort для детей с экстрактом Алоэ и витамином Е 100 шт;LOREAL скраб Pure Zone Глубокое очищение 7 в 1";"ЧИСТАЯ ЛИНИЯ гель для умывания на отваре трав с алое для жирной и комбинированной кожи 100 мл;ZEWA носовые платки Softis Soft Sensitive 10х9 шт;BELLA носовые платки Classic 10х10 шт";530161;"ORGANIC SHOP пилинг для лица абрикосовый манго 75 мл"
"AURA Влажные салфетки Ultra Comfort для детей с экстрактом Алоэ и витамином Е 100 шт;LOREAL cредство для снятия макияжа для чувствительных глаз 125 мл";"АВАНТА крем для рук Белоручка увлажняющий 75 мл;GARNIER крем для кожи вокруг глаз Антивозрастной Уход защита от морщин 35+ 15 мл;ЧИСТАЯ ЛИНИЯ Солнцезащитный спрей 20 SPF 160мл";530163;"THE SKIN HOUSE пилинг-гель Shiny Crystal Peeling Gel 120 мл"
"AURA крем для рук и ногтей Beauty Комплексный с витаминами и экстрактом лаванды 75 мл;ORGANIC BEAUTY бальзам для рук и тела Питательный 500 мл";"ЧИСТАЯ ЛИНИЯ маска для лица Антивозрастная 45 мл;GARNIER гель для умывания Чистая кожа Очищающий против чёрных точек 200 мл;LET ME SKIN маска альгинатная Ultra H2O для сияния кожи 50+5 г";530166;"ЧИСТАЯ ЛИНИЯ бальзам для губ Естественный Цвет и Блеск земляника 4 г"
"AURA Одноразовое покрытие на сиденье унитаза 10 шт;LOREAL Крем-масло Роскошь Питания 50 мл";"PAMPERS влажные салфетки Sensitive 2x56 шт;LOREAL скраб для лица Сахарный Придающий Сияние 50 мл;LIBRESSE влажные салфетки Natural 20 шт";530167;"ЧИСТАЯ ЛИНИЯ бальзам для губ Фитопантенол 4 г"
"BELLA влажные салфетки Happy для детей 56 шт;MAYBELLINE помада для губ Hydra Extreme 39 (670) Розовое дерево";"ЧИСТАЯ ЛИНИЯ мицеллярная вода 3в1 Цветочная 400 мл;DOVE мицеллярный гель для снятия макияжа С маслами 120 мл";530168;"ЧИСТАЯ ЛИНИЯ Бальзам для губ против обветривания Брусника 4 гр"
"BIORE мицеллярная вода 320 мл";"ROYAL SKIN крем для рук Water Drop с Экстрактом Гардении 60 мл;HUGGIES влажные салфетки Ultra Comfort алоэ 128 шт;ЧЕРНЫЙ ЖЕМЧУГ крем для кожи вокруг глаз Крем-Эксперт 46+ 15 мл";530170;"ГАДКИЙ Я бальзам для губ Сладкоежка 4,6 г"
"BIORE мицеллярная вода 320 мл;ЧИСТАЯ ЛИНИЯ молочко для тела Двойное Увлажнение медуница и таволга 250 мл";"АВАНТА крем для рук и ногтей Белоручка питательный 75 мл;ЧИСТАЯ ЛИНИЯ гель для умывания Идеальная Кожа 100 мл;LOREAL крем Роскошь Питания вокруг глаз 15 мл";530173;"NIVEA бальзам для губ Аква Забота 4,8 г"
"CETTUA салфетки для лица Матирующие 50 шт";"GARNIER Ambre Solaire молочко солнцезащитное SPF 30 200 мл;БАРХАТНЫЕ РУЧКИ крем-мусс для рук Энергия Асаи 72 мл;DIADEMINE мицеллярная вода Основная программа 200 мл";530175;"NIVEA бальзам для губ Фруктовое Сияние вишня 5 г"
"CHAMOS крем для лица Acaci Омолаживающий с Экстрактом Лимона 12 мл;LOREAL блеск для губ Infaillible 401 Аминь";"AURA влажные салфетки Tropic Cocktail освежающие 15 шт;DIADEMINE спрей для лица Основная программа 3в1 Очищающий 200 мл;GARNIER крем BB Секрет Совершенства для жирной кожи светло-бежевый 50 мл";530176;"NIVEA бальзам для губ Жемчужное Сияние 4,8 г"
"CHAMOS маска для лица Hinijini Антивозрастная с Лошадиным Маслом;ВЕСНА крем для лица Тыквенный питательный 40 мл";"GARNIER крем для лица Антивозрастной Уход активный лифтинг 45+ дневной 50 мл;ЧИСТАЯ ЛИНИЯ скраб для лица Мягкий малина и косточки клюквы50 мл;AURA влажные салфетки антибактериальные Лимон 15 шт";530178;"ПРИНЦЕССА бальзам для губ Полезный уход 3,8 гр"
"CHAMOS маска для лица Hinijini Антивозрастная с Лошадиным Маслом;PAMPERS влажные салфетки Sensitive 2x56 шт";"ЧИСТАЯ ЛИНИЯ маска для лица Антивозрастная 45 мл;DIADEMINE лосьон для снятия макияжа с глаз Бережное очищение 125 мл;BIORE мицеллярная вода 320 мл";530179;"ПРИНЦЕССА блеск для губ светло-розовый 5 мл"
"DIADEMINE мицеллярная вода Основная программа 200 мл;Я САМАЯ влажные салфетки для снятия макияжа 15 шт";"ЧИСТАЯ ЛИНИЯ гель для умывания на отваре целебных трав для нормальной и комбинированной кожи 160 мл;AURA Влажные салфетки Ultra Comfort для детей 60 шт;AURA влажные салфетки антибактериальные 20 шт";530182;"ЧЕРНЫЙ ЖЕМЧУГ био-масло для умывания 160 мл"
"DIADEMINE мицеллярная вода Основная программа 200 мл;LOREAL крем Revitalift Вокруг глаз 50 мл";"ORGANIC BEAUTY бальзам для рук и тела Питательный 500 мл;АВАНТА крем для рук Белоручка увлажняющий 75 мл;CETTUA мини-пластыри для проблемной кожи 36 шт";530183;"ЧЕРНЫЙ ЖЕМЧУГ гель для умывания Очищение и Уход для нормальной и комбинированной кожи 120 мл"
"DIADEMINE спрей для лица Основная программа 3в1 Очищающий 200 мл";"CETTUA мини-пластыри для проблемной кожи 36 шт;ЧИСТАЯ ЛИНИЯ Бальзам для губ проотив Против обветривания Брусника 4 гр;BELLA влажные салфетки Happy для детей 56 шт";530184;"ЧЕРНЫЙ ЖЕМЧУГ пенка-мусс для умывания Деликатное Очищение 150 мл"
"DOVE крем-гель для умывания Матирующий 120 мл";"LOREAL крем Увлажнение Эксперт вокруг глаз 50 мл;DOVE крем для лица и тела Питательный 150 мл;БАРХАТНЫЕ РУЧКИ крем для рук Интенсивный Молодость Кожи 80 мл";530192;"ЧИСТАЯ ЛИНИЯ лосьон Идеальная кожа Глубокое действие против черных точек 100 мл"
"DOVE крем-гель для умывания Увлажняющий 120 мл;LOREAL крем Увлажнение Эксперт вокруг глаз 50 мл";"DOVE лосьон для тела Сияние лета 250 мл;AURA крем для рук и ногтей Beauty Комплексный с витаминами и экстрактом лаванды 75 мл;THE SKIN HOUSE очищающее гидрофильное масло Essential Cleansing Oil 150 мл";530206;"ЧИСТАЯ ЛИНИЯ тоник для лица Импульс молодости 150 мл"
"DOVE крем-гель для умывания Ухаживающий 120 мл;LIBRESSE влажные салфетки Natural 20 шт";"LOREAL крем Увлажнение Эксперт вокруг глаз 50 мл;ORGANIC BEAUTY бальзам для рук и тела Питательный 500 мл;МОЕ СОЛНЫШКО крем детский солнцезащитный SPF 50 55 мл";530215;"ELIZAVECCA пена для умывания Milky Piggy Elastic Pore Cleansing Foam 120 мл"
"DOVE лосьон для тела Сияние лета 250 мл;БАРХАТНЫЕ РУЧКИ крем для рук Смягчающий 80 мл";"GARNIER Ambre Solaire молочко солнцезащитное SPF 30 200 мл;DOVE крем-гель для умывания Ухаживающий 120 мл;LOREAL крем Увлажнение Эксперт вокруг глаз 50 мл";530217;"FARMSTAY гель-лосьон увлажняющий Cucumber с экстрактом огурца 250 мл"
"DOVE лосьон для тела Сияние лета 250 мл;LOREAL крем Возраст Эксперт 45+ вокруг глаз 50 мл";"ЧИСТАЯ ЛИНИЯ лосьон-тоник Василек для нормальной и комбинированной кожи 100 мл;МАЛЕНЬКАЯ ФЕЯ крем для рук Happy Moments Детский 25 мл;ЧЕРНЫЙ ЖЕМЧУГ скраб для тела Идеальнаяя Кожа 200 мл";530218;"FARMSTAY пенка очищающая Pure Cleansing Egg с яичным экстрактом 180 мл"
"DOVE лосьон для тела Сияние лета 250 мл;LOREAL крем Увлажнение Эксперт вокруг глаз 50 мл";"ЧИСТАЯ ЛИНИЯ лосьон-тоник Лепестки роз для сухой и чувствительной кожи 100 мл;GARNIER крем для кожи вокруг глаз Антивозрастной Уход активный лифтинг 45+ 15мл";530219;"FARMSTAY пенка очищающая Pure Cleansing Snail с экстрактом улитки 180 мл"
"DOVE молочко для тела Увлажнение и Питание 250 мл;ELIZAVECCA маска для лица Anti Aging EGF Aqua 25 мл";"LOREAL аква-флюид Гений Увлажнения для сухой кожи 70 мл;АВАНТА крем для рук Белоручка Смягчающий 75мл;LOREAL cредство для снятия макияжа для чувствительных глаз 125 мл";530220;"FARMSTAY пилинг-гель All-in-One Whitening с экстрактом киви 180 мл"
"DOVE мусс для умывания Ухаживающий 160 мл";"LOREAL крем Revitalift Вокруг глаз 50 мл;СОЛНЦЕ И ЛУНА влажные салфетки детские с экстрактом алоэ 63 шт;ORGANIC SHOP крем для рук Organic Kitchen питательный акуна банана 100 мл";530221;"FARMSTAY пилинг-гель All-in-One Whitening с экстрактом яблока 180 мл"
"EVO крем для ног с мочевиной;GARNIER крем для рук Интенсивный уход для очень сухой кожи 100 мл";"БАРХАТНЫЕ РУЧКИ крем для рук Защитный 80 мл;LOREAL крем Роскошь Питания вокруг глаз 15 мл";530223;"GARNIER лосьон для снятия макияжа с глаз Экспресс Лосьон 2 в 1 125 мл"
"FARMSTAY эмульсия увлажняющая Snail Muscus Moisture с экстрактом улитки 150 мл;БАРХАТНЫЕ РУЧКИ крем для рук Энергия Асаи ночной 45 мл";"PIGEON влажные салфетки для детей (0+ мес) 70 шт;ЧЕРНЫЙ ЖЕМЧУГ крем-сыворотка для век Программа от 56 лет 17 мл;GARNIER Крем для загара Ambre Solaire Малыш в Тени SPF 50+ 50 мл";530229;"LOREAL cредство для умывания Pure Power Черный уголь 150 мл"
"FARMSTAY эмульсия увлажняющая Snail Muscus Moisture с экстрактом улитки 150 мл;МОЕ СОЛНЫШКО крем детский солнцезащитный SPF 20 75 мл";"AURA влажные салфетки антибактериальные Лимон 15 шт;БАРХАТНЫЕ РУЧКИ крем для рук Основной Уход 45 мл;ЧЕРНЫЙ ЖЕМЧУГ крем-гель для умывания Очищение и Уход для сухой и чувствительной кожи 120 мл";530233;"NATURA SIBERICA пенка для умывания Natura Kamchatka очищающая идеальная кожа 150 мл"
"GARNIER драгоценное масло красоты 150 мл;ЧИСТАЯ ЛИНИЯ молочко для тела Упругость Черная смородина и Черемуха 250 мл";"DOVE крем-гель для умывания Увлажняющий 120 мл;GARNIER маска для лица тканевая Увлажнение + Аква Бомба 32 г";530235;"NIVEA средство для снятия макияжа Двойной Эффект 125 мл"
"GARNIER драгоценное масло красоты 150 мл;LOREAL крем Возраст Эксперт 35+ дневной 50 мл";"БАРХАТНЫЕ РУЧКИ крем-масло для рук SOS-восстановление ночной уход 45 мл;GARNIER гель-пенка для умывания Основной уход 200 мл;ЧЕРНЫЙ ЖЕМЧУГ крем-сыворотка для век Программа от 56 лет 17 мл";530236;"NIVEA средство для снятия макияжа с глаз Make-up Expert ухаживающее 125 мл"
"GARNIER Крем для загара Ambre Solaire Малыш в Тени SPF 50+ 50 мл;СОЛНЦЕ И ЛУНА влажные салфетки Нежное Прикосновение для детей 15 шт";"АВАНТА крем для рук Белоручка Летний шелк 80 мл;DOVE крем-гель для умывания Ухаживающий 120 мл;GARNIER крем для кожи вокруг глаз Антивозрастной Уход защита от морщин 35+ 15 мл";530237;"NIVEA тоник Нежный Смягчающий 200 мл"
"GARNIER Крем для загара Ambre Solaire Малыш в Тени SPF 50+ 50 мл;LOREAL крем Увлажнение Эксперт вокруг глаз 50 мл";"DOVE крем-гель для умывания Матирующий 120 мл;БАРХАТНЫЕ РУЧКИ крем для рук Тайна Цветов Моринги 30 мл;AURA влажные салфетки антибактериальные Лимон 15 шт";530238;"ROYAL SKIN очищающая пенка для умывания с Коллагеном 150 мл"
