"Рекомендуемые товары";"Сопутствующие товары";"Артикул";"Короткое название"
"АВАНТА крем для рук Белоручка зимний бархат 75 мл";"LOREAL крем Возраст Эксперт 55+ вокруг глаз 50 мл;PAMPERS влажные салфетки Sensitive 12 шт;МОЕ СОЛНЫШКО крем детский солнцезащитный SPF 50 55 мл";530046;"ЧИСТАЯ ЛИНИЯ крем-актив для лица Идеальная Кожа против прыщей 40 мл"
"АВАНТА крем для рук Белоручка зимний бархат 75 мл;ЧЕРНЫЙ ЖЕМЧУГ крем для кожи вокруг глаз Крем-Эксперт 46+ 15 мл";"BARNANGEN лосьон для тела Nutritive 400 мл;BARNANGEN лосьон для тела Sensitive 400 мл;ЧИСТАЯ ЛИНИЯ мицеллярная вода 3в1 Цветочная 100 мл";530297;"DR. SMART маска для лица Anti Pore Clinic с Древесным Углем"
"АВАНТА крем для рук Белоручка Летний шелк 80 мл;AURA влажные салфетки для детей Ultra Comfort с крышкой 200 шт";"GARNIER крем для кожи вокруг глаз Антивозрастной Уход активный лифтинг 45+ 15мл;DOVE крем-гель для умывания Ухаживающий 120 мл;GARNIER Ambre Solaire крем после загара Эксперт Защита освежающий 200 мл";530029;"ЧЕРНЫЙ ЖЕМЧУГ крем для лица Крем-Эксперт 46+ 50 мл"
"АВАНТА крем для рук Белоручка увлажняющий 75 мл;LOREAL крем Возраст Эксперт 45+ вокруг глаз 50 мл";"ЧИСТАЯ ЛИНИЯ молочко для тела Двойное Увлажнение медуница и таволга 250 мл;LOREAL крем Revitalift для контура лица и шеи 50 мл;LOREAL cредство для снятия макияжа с глаз и губ 125 мл";530303;"ELIZAVECCA маска для лица Anti Aging EGF Aqua 25 мл"
"АВАНТА крем для рук Белоручка увлажняющий 75 мл;NIVEA черная пенка для умывания Make-up Expert для жирной кожи 100 мл";"ЧИСТАЯ ЛИНИЯ Солнцезащитный спрей 20 SPF 160мл;GARNIER крем для кожи вокруг глаз Антивозрастной Уход защита от морщин 35+ 15 мл;Я САМАЯ влажные салфетки для интимной гигиены Ромашка 15 шт";530015;"CHAMOS крем для лица Acaci Омолаживающий с Экстрактом Лимона 12 мл"
"АВАНТА крем для рук Дачница 75 мл;LOREAL крем Возраст Эксперт 45+ вокруг глаз 50 мл";"ЧИСТАЯ ЛИНИЯ лосьон-тоник Василек для нормальной и комбинированной кожи 100 мл;GARNIER молочко для тела с маслом Манго 250 мл";530319;"GARNIER маска для лица Черная Тканевая Маска Очищающий Уголь 28 г"
"АВАНТА крем для рук Дачница 75 мл;LUKE маска для лица Green Tea Essence Mask с Экстрактом Зеленого Чая";"АВАНТА крем массажный Нега 75 мл;ЧЕРНЫЙ ЖЕМЧУГ крем для кожи вокруг глаз Крем-Эксперт 46+ 15 мл;LOREAL гель для лица Бесконечная Свежесть для нормальной и смешанной кожи 150 мл";530289;"ЧИСТАЯ ЛИНИЯ сыворотка для лица и шеи Сила 5 трав 40 мл"
"АВАНТА крем для рук Силиконовый защитный 75 мл;DIADEMINE мицеллярная вода Основная программа 200 мл";"DOVE молочко для тела Увлажнение и Питание 250 мл;LUKE маска для лица Green Tea Essence Mask с Экстрактом Зеленого Чая";530252;"GARNIER крем для кожи вокруг глаз Антивозрастной Уход защита от морщин 35+ 15 мл"
"БАРХАТНЫЕ РУЧКИ крем для рук Гипоаллергенный 80 мл;GARNIER Ambre Solaire крем после загара Эксперт Защита освежающий 200 мл";"LOREAL крем Увлажнение Эксперт вокруг глаз 50 мл;ЧИСТАЯ ЛИНИЯ мицеллярная вода 3в1 Цветочная 100 мл;МОЕ СОЛНЫШКО влажные салфетки Универсальные 70 шт";530020;"ЧЕРНЫЙ ЖЕМЧУГ дневная эмульсия для лица Dream Cream Естественное Сияние 50 мл"
"БАРХАТНЫЕ РУЧКИ крем для рук Для Всей Семьи 200 мл;АВАНТА крем для рук Белоручка Смягчающий 75мл";"ЧИСТАЯ ЛИНИЯ антивозрастной крем-лифтинг для век Сила 5 Трав 25 мл;DERMANIKA крем для рук Омолаживающий 75 мл;ЛАБОРАТОРИЯ ПРИРОДЫ крем для ног Каштановый 100 мл";530060;"DOVE крем для лица и тела Питательный 150 мл"
"БАРХАТНЫЕ РУЧКИ крем для рук Защитный 80 мл;DIADEMINE лосьон для снятия макияжа с глаз Бережное очищение 125 мл";"JOHNSON'S Baby влажные салфетки детские Pure Protect 25 шт;GARNIER молочко солнцезащитное детское Ambre Solaire SPF 30 200 мл";570229;"ЧИСТАЯ ЛИНИЯ Фито-крем для лица  Дневной Шлемник и Морошка от 55 лет 45 мл"
"БАРХАТНЫЕ РУЧКИ крем для рук Нежность Тиаре 80 мл;ЧИСТАЯ ЛИНИЯ мицеллярная вода 3в1 для нормальной и комбинированной кожи 400 мл";"BARNANGEN лосьон для тела Caring 400 мл;ЧЕРНЫЙ ЖЕМЧУГ крем для кожи вокруг глаз Крем-Эксперт 46+ 15 мл;АВАНТА крем для рук Белоручка Смягчающий 75мл";530335;"LOREAL аква-флюид Гений Увлажнения для нормальной и смешанной кожи 70 мл"
"БАРХАТНЫЕ РУЧКИ крем для рук Ночной Восстанавливающий 80 мл;ЧЕРНЫЙ ЖЕМЧУГ ночной крем Самоомоложение Программа от 26 лет 50 мл";"LOREAL cредство для снятия макияжа с глаз и губ 125 мл;ЧЕРНЫЙ ЖЕМЧУГ крем-гель для умывания Очищение и Уход для сухой и чувствительной кожи 120 мл;DOVE лосьон для тела Масло Авокадо и экстракт календулы Пробуждающий 250 мл";530342;"LOREAL маска для лица Revitalift Лазер x3 ночная 50 мл"
"БАРХАТНЫЕ РУЧКИ крем для рук Основной Уход 45 мл;GARNIER крем для кожи вокруг глаз Антивозрастной Уход защита от морщин 35+ 15 мл";"GARNIER молочко солнцезащитное детское Ambre Solaire SPF 30 200 мл;СОЛНЦЕ И ЛУНА влажные салфетки Для Новорожденных 54 шт;ЧИСТАЯ ЛИНИЯ лосьон-тоник Лепестки роз для сухой и чувствительной кожи 100 мл";530097;"LOREAL уход-скульптор Возраст Эксперт 55+ для лица, шеи и зоны декольте 50 мл"
"БАРХАТНЫЕ РУЧКИ крем для рук Питательный 80 мл;СОЛНЦЕ И ЛУНА влажные салфетки Для Детей с экстрактом алоэ 15 шт";"ЧИСТАЯ ЛИНИЯ молочко для снятия макияжа Для любой кожи 100 мл;МОЕ СОЛНЫШКО крем детский солнцезащитный SPF 20 75 мл;LOREAL для кожи вокруг глаз Revitalift Филлер [ha] против морщин 15 мл";530121;"ВЕСНА крем для лица Морковный омолаживающий 40 мл"
"БАРХАТНЫЕ РУЧКИ крем для рук Питательный 80 мл;LOREAL крем Роскошь Питания вокруг глаз 15 мл";"ЧЕРНЫЙ ЖЕМЧУГ тоник-комфорт Освежающий для нормальной и комбинированной кожи 200 мл;СОЛНЦЕ И ЛУНА влажные салфетки Нежное Прикосновение с крышкой 63 шт;GARNIER солнцезащитный спрей Ambre Solaire солнечная вода прозрачный SPF 30 150 мл";530030;"ЧЕРНЫЙ ЖЕМЧУГ крем для лица Крем-Эксперт 56+ 50 мл"
"БАРХАТНЫЕ РУЧКИ крем для рук Питательный 80 мл;PAMPERS влажные салфетки Sensitive 12 шт";"МОЕ СОЛНЫШКО крем детский солнцезащитный SPF 50 55 мл;LOREAL для кожи вокруг глаз Revitalift Филлер [ha] против морщин 15 мл";570228;"DIADEMINE крем для лица Lift + Увлажнение  дневной 50 мл"
"БАРХАТНЫЕ РУЧКИ крем для рук Питательный мини версия 20 мл;LOREAL маска для лица Магия Глины Детокс и сияние с углем 50 мл";"LOREAL крем Увлажнение Эксперт вокруг глаз 50 мл;ЧИСТАЯ ЛИНИЯ гель для умывания на отваре трав с алое для жирной и комбинированной кожи 100 мл;GARNIER молочко для тела с Алоэ Вера 250 мл";530284;"ЧЕРНЫЙ ЖЕМЧУГ маска для лица тканевая MezoCare Питание и Омоложение 1 шт"
"БАРХАТНЫЕ РУЧКИ крем для рук Тайна Цветов Моринги 30 мл;KLEENEX влажные салфетки Дисней антибактериальные 10 шт";"ЧЕРНЫЙ ЖЕМЧУГ крем-сыворотка для век Программа от 56 лет 17 мл;МОЕ СОЛНЫШКО крем детский солнцезащитный SPF 30 55 мл;DIADEMINE мицеллярная вода Основная программа 200 мл";530090;"LOREAL крем Возраст Эксперт 35+ дневной 50 мл"
"БАРХАТНЫЕ РУЧКИ крем для рук Увлажняющий 80 мл;AURA влажные салфетки Tropic Cocktail антибактериальные в ассортименте 15 шт";"МОЕ СОЛНЫШКО крем детский солнцезащитный SPF 20 75 мл;DIADEMINE мицеллярная вода Основная программа 200 мл;LOREAL крем Возраст Эксперт 55+ вокруг глаз 50 мл";530091;"LOREAL крем Возраст Эксперт 35+ ночной 50 мл"
"БАРХАТНЫЕ РУЧКИ крем для рук Увлажняющий 80 мл;GARNIER драгоценное масло красоты 150 мл";"ЧИСТАЯ ЛИНИЯ пенка для умывания На отваре целебных трав для любой кожи 100 мл;ЧЕРНЫЙ ЖЕМЧУГ крем для кожи вокруг глаз Крем-Эксперт 46+ 15 мл";530286;"ЧИСТАЯ ЛИНИЯ маска для лица Антивозрастная 45 мл"
"БАРХАТНЫЕ РУЧКИ крем для рук Увлажняющий 80 мл;GARNIER крем для кожи вокруг глаз Антивозрастной Уход активный лифтинг 45+ 15мл";"GARNIER Ambre Solaire крем после загара Эксперт Защита освежающий 200 мл;ЧИСТАЯ ЛИНИЯ мицеллярная вода Идеальная кожа 400 мл;AURA FAMILY влажные салфетки для всей семьи Ecoomy с крышкой 200 шт";530074;"LOREAL крем дневной Revitalift Лазер x3 50 мл"
"БАРХАТНЫЕ РУЧКИ крем для рук Энергия Асаи ночной 45 мл;АВАНТА крем для рук Белоручка увлажняющий 75 мл";"DOVE мицеллярный гель для снятия макияжа С маслами 120 мл;BARNANGEN лосьон для тела Sensitive 400 мл;LOREAL крем Revitalift Вокруг глаз 50 мл";530355;"THE SKIN HOUSE кислородная маска Black Snail Bubble Mask 100 мл"
"БАРХАТНЫЕ РУЧКИ крем-бальзам для рук SOS-восстановление 45 мл;KLEENEX влажные салфетки Дисней 40 шт";"GARNIER солнцезащитный спрей Ambre Solaire солнечная вода прозрачный SPF 30 150 мл;ЧЕРНЫЙ ЖЕМЧУГ тоник-комфорт Освежающий для нормальной и комбинированной кожи 200 мл;LOREAL для кожи вокруг глаз Revitalift Филлер [ha] против морщин 15 мл";530043;"ЧИСТАЯ ЛИНИЯ фито-крем для лица Ночной от 55 лет Шлемник и Морошка 45 мл"
"БАРХАТНЫЕ РУЧКИ крем-лосьон для рук и ногтей Прикосновение Нежности Питательный 160 мл;БАРХАТНЫЕ РУЧКИ крем для рук Увлажняющий 80 мл";"ЧЕРНЫЙ ЖЕМЧУГ крем для кожи вокруг глаз Крем-Эксперт 46+ 15 мл;ЧИСТАЯ ЛИНИЯ молочко для тела Двойное Увлажнение медуница и таволга 250 мл";530346;"LOREAL масло для лица Роскошь питания 30 мл"
"БАРХАТНЫЕ РУЧКИ крем-лосьон для рук и ногтей Прикосновение Нежности Питательный 160 мл;LOREAL cредство для снятия макияжа для чувствительных глаз 125 мл";"ЧИСТАЯ ЛИНИЯ лосьон-тоник Календула для жирной кожи 100 мл;CHAMOS маска для лица Hinijini Антивозрастная с Лошадиным Маслом;DOVE лосьон для тела Масло Авокадо и экстракт календулы Пробуждающий 250 мл";530246;"ЧЕРНЫЙ ЖЕМЧУГ крем-сыворотка для век Программа от 56 лет 17 мл"
"БАРХАТНЫЕ РУЧКИ крем-масло для рук SOS-восстановление ночной уход 45 мл";"ЧИСТАЯ ЛИНИЯ пенка для умывания На отваре целебных трав для любой кожи 100 мл;ЧИСТАЯ ЛИНИЯ Солнцезащитный спрей 20 SPF 160мл;СОЛНЦЕ И ЛУНА влажные салфетки детские с экстрактом алоэ 63 шт";530086;"LOREAL крем Увлажнение Эксперт 50 мл"
"БАРХАТНЫЕ РУЧКИ крем-масло для рук SOS-восстановление ночной уход 45 мл;LOREAL молочко Абсолютная нежность 200 мл";"DOVE лосьон для тела Масло Авокадо и экстракт календулы Пробуждающий 250 мл;FARMSTAY многофункциональная сыворотка Honey с медом 250 мл;RAINBOW BEAUTY крем для рук Sense of Care с маслом Ши и Экстрактом Сакуры 35 г";530259;"LOREAL крем Увлажнение Эксперт вокруг глаз 50 мл"
"МАЛЕНЬКАЯ ФЕЯ крем для рук Happy Moments Детский 25 мл;DIADEMINE лосьон для снятия макияжа с глаз Бережное очищение 125 мл";"МОЕ СОЛНЫШКО крем детский солнцезащитный SPF 30 55 мл;СОЛНЦЕ И ЛУНА влажные салфетки Для Детей с экстрактом алоэ 15 шт;GARNIER крем для кожи вокруг глаз Антивозрастной Уход активный лифтинг 45+ 15мл";570230;"ЧЕРНЫЙ ЖЕМЧУГ Крем для лица  BIO-программа 56+ 50 мл"
"МОЕ СОЛНЫШКО влажные салфетки Универсальные 70 шт;AURA Влажные салфетки Ultra Comfort для детей с экстрактом Алоэ и витамином Е 100 шт";"ORGANIC SHOP скраб для лица очищающий имбирная сакура 75 мл;GARNIER маска для лица тканевая Увлажнение + Антистресс суперувлажняющая и снимающая усталость 32 г;GARNIER крем для кожи вокруг глаз Антивозрастной Уход активный лифтинг 45+ 15мл";530188;"ЧИСТАЯ ЛИНИЯ гель для умывания Идеальная Кожа 100 мл"
"МОЕ СОЛНЫШКО крем детский солнцезащитный SPF 30 55 мл;ЧИСТАЯ ЛИНИЯ молочко для снятия макияжа Для любой кожи 100 мл";"KLEENEX влажные салфетки антибактериальные 10 шт;LOREAL крем Увлажнение Эксперт вокруг глаз 50 мл;БАРХАТНЫЕ РУЧКИ крем для рук Тайна Цветов Моринги 30 мл";530093;"LOREAL крем Возраст Эксперт 45+ ночной 50 мл"
"МОЕ СОЛНЫШКО крем детский солнцезащитный SPF 50 55 мл;LOREAL крем Возраст Эксперт 45+ вокруг глаз 50 мл";"БАРХАТНЫЕ РУЧКИ крем-лосьон для рук и ногтей Прикосновение Нежности Питательный 160 мл;KLEENEX влажные салфетки Дисней 40 шт;GARNIER лосьон для снятия макияжа с глаз Основной Уход 125 мл";530083;"LOREAL крем Revitalift Лазер Х3 ночной 50 мл"
"СОЛНЦЕ И ЛУНА влажные салфетки Для Детей с экстрактом алоэ 63 шт;ЧИСТАЯ ЛИНИЯ крем-актив для лица Идеальная Кожа против прыщей 40 мл";"KLEENEX влажная туалетная бумага в пластиковой упаковке 42 шт;ZEWA туалетная бумага Exclusive Ultra Soft 4 слоя 4 шт;DIADEMINE лосьон для снятия макияжа с глаз Бережное очищение 125 мл";530148;"ЧИСТАЯ ЛИНИЯ скраб-маска для лица Фитобаня Обновляющий 75 мл"
"СОЛНЦЕ И ЛУНА влажные салфетки Для Детей с экстрактом алоэ 63 шт;LOREAL молочко Абсолютная нежность 200 мл";"ЧЕРНЫЙ ЖЕМЧУГ крем-гель для умывания Очищение и Уход для сухой и чувствительной кожи 120 мл;EVO Крем Для Локтей и Коленей 46 мл;МОЕ СОЛНЫШКО крем детский солнцезащитный SPF 20 75 мл";530054;"ЧИСТАЯ ЛИНИЯ ночной крем-сон для лица Идеальная Кожа для всех типов кожи 45мл"
"СОЛНЦЕ И ЛУНА влажные салфетки Для Новорожденных 54 шт;LIBERO влажные салфетки Baby Care 2x64 шт";"ЧИСТАЯ ЛИНИЯ скраб-маска для лица Фитобаня Обновляющий 75 мл;GARNIER тоник для лица Основной Уход Розовая вода для сухой и чувствительной кожи 200 мл;LOVULAR влажные салфетки Календула 62 шт";530207;"DOVE крем-гель для умывания Матирующий 120 мл"
"СОЛНЦЕ И ЛУНА влажные салфетки Нежное Прикосновение для детей 15 шт;GARNIER тоник для лица Чистая Кожа для комбинированной и жирной кожи 200 мл";"BELLA влажные салфетки Happy для детей 56 шт;CETTUA салфетки для лица Матирующие 50 шт;ORGANIC SHOP скраб для лица очищающий имбирная сакура 75 мл";530199;"ЧИСТАЯ ЛИНИЯ мицеллярная вода 3в1 для нормальной и комбинированной кожи 100 мл"
"ЧЕРНЫЙ ЖЕМЧУГ дневной крем BiO-программа для сухой и чувствительной кожи 50 мл;LOREAL скраб для лица Сахарный Придающий Сияние 50 мл";"LOREAL Крем-масло Роскошь Питания 50 мл;ZEWA туалетная бумага Плюс Сирень 2 слоя 8 шт;AURA Влажные салфетки Ultra Comfort для детей 100 шт";530232;"LOREAL молочко Абсолютная нежность 200 мл"
"ЧЕРНЫЙ ЖЕМЧУГ крем для кожи вокруг глаз Крем-Эксперт 46+ 15 мл;DOVE мицеллярная вода Ухаживающая 240 мл";"БАРХАТНЫЕ РУЧКИ крем для рук Гармония Арганы 80 мл;PIGEON влажные салфетки для детей (0+ мес) 70 шт;GARNIER Ambre Solaire крем после загара Эксперт Защита освежающий 200 мл";530085;"LOREAL крем Роскошь питания Преображающий дневной 50 мл"
"ЧЕРНЫЙ ЖЕМЧУГ крем-гель для умывания Очищение и Уход для сухой и чувствительной кожи 120 мл;БАРХАТНЫЕ РУЧКИ крем-бальзам для рук SOS-восстановление 45 мл";"DOVE крем-гель для умывания Увлажняющий 120 мл;AURA влажные салфетки антибактериальные 72 шт;GARNIER молочко солнцезащитное детское Ambre Solaire SPF 30 200 мл";530098;"NATURA SIBERICA крем для лица дневной для чувствительной кожи SPF 20 50 мл"
"ЧЕРНЫЙ ЖЕМЧУГ крем-гель для умывания Очищение и Уход для сухой и чувствительной кожи 120 мл;СОЛНЦЕ И ЛУНА влажные салфетки детские с экстрактом алоэ 63 шт";"GARNIER гель-пенка для умывания Основной уход 200 мл;GARNIER молочко солнцезащитное детское Ambre Solaire SPF 30 200 мл;БАРХАТНЫЕ РУЧКИ крем-бальзам для рук SOS-восстановление 45 мл";530095;"LOREAL крем Возраст Эксперт 55+ ночной 50 мл"
"ЧЕРНЫЙ ЖЕМЧУГ крем-гель для умывания Очищение и Уход для сухой и чувствительной кожи 120 мл;GARNIER Ambre Solaire крем после загара Эксперт Защита освежающий 200 мл";"HUGGIES влажные салфетки Ultra Comfort алоэ 64 шт;ЧИСТАЯ ЛИНИЯ лосьон-тоник Василек для нормальной и комбинированной кожи 100 мл;DERMANIKA крем для рук Омолаживающий 75 мл";530040;"ЧИСТАЯ ЛИНИЯ фито-крем для лица дневной От 45 лет арника и жимолость 45 мл"
"ЧЕРНЫЙ ЖЕМЧУГ крем-сыворотка для век Программа от 56 лет 17 мл;ЧЕРНЫЙ ЖЕМЧУГ пенка-мусс для умывания Очищение и Уход ждя нормальной и комбинированной кожи 150 мл";"БАРХАТНЫЕ РУЧКИ крем для рук Сокровище Бурити 30 мл;BARNANGEN бальзам для тела All Over Rescue 200 мл;БАРХАТНЫЕ РУЧКИ крем-мусс для рук Энергия Асаи 72 мл";530277;"CHAMOS маска для лица Acaci Антивозрастная с Улиточным Экстрактом"
"ЧЕРНЫЙ ЖЕМЧУГ крем-сыворотка для век Программа от 56 лет 17 мл;ЧИСТАЯ ЛИНИЯ мицеллярная вода Идеальная кожа 400 мл";"ORGANIC BEAUTY бальзам для рук и тела Питательный 500 мл;ЧИСТАЯ ЛИНИЯ фитобальзам для тела Упругость и Питание 200 мл";530287;"ЧИСТАЯ ЛИНИЯ маска для лица Очищающая 45 мл"
