"Рекомендуемые товары";"Сопутствующие товары";"Артикул";"Короткое название"
"DIADEMINE мицеллярная вода Основная программа 200 мл;LOREAL крем Revitalift Вокруг глаз 50 мл";"ORGANIC BEAUTY бальзам для рук и тела Питательный 500 мл;АВАНТА крем для рук Белоручка увлажняющий 75 мл;CETTUA мини-пластыри для проблемной кожи 36 шт";570234;"CHAMOS сыворотка для лица Acaci Oil Drop Антивозрастная с Улиточным Экстрактом  50 мл"
"DIADEMINE спрей для лица Основная программа 3в1 Очищающий 200 мл";"CETTUA мини-пластыри для проблемной кожи 36 шт;ЧИСТАЯ ЛИНИЯ Бальзам для губ проотив Против обветривания Брусника 4 гр;BELLA влажные салфетки Happy для детей 56 шт";530227;"LOREAL cредство для снятия макияжа для чувствительных глаз 125 мл"
"DOVE крем-гель для умывания Матирующий 120 мл";"LOREAL крем Увлажнение Эксперт вокруг глаз 50 мл;DOVE крем для лица и тела Питательный 150 мл;БАРХАТНЫЕ РУЧКИ крем для рук Интенсивный Молодость Кожи 80 мл";530283;"ЧЕРНЫЙ ЖЕМЧУГ маска для лица тканевая MezoCare Лифтинг-эффект 1 шт"
"DOVE крем-гель для умывания Увлажняющий 120 мл;LOREAL крем Увлажнение Эксперт вокруг глаз 50 мл";"DOVE лосьон для тела Сияние лета 250 мл;AURA крем для рук и ногтей Beauty Комплексный с витаминами и экстрактом лаванды 75 мл;THE SKIN HOUSE очищающее гидрофильное масло Essential Cleansing Oil 150 мл";530279;"CHAMOS маска для лица Hinijini Антивозрастная с Лошадиным Маслом"
"DOVE крем-гель для умывания Ухаживающий 120 мл;LIBRESSE влажные салфетки Natural 20 шт";"LOREAL крем Увлажнение Эксперт вокруг глаз 50 мл;ORGANIC BEAUTY бальзам для рук и тела Питательный 500 мл;МОЕ СОЛНЫШКО крем детский солнцезащитный SPF 50 55 мл";530049;"ЧИСТАЯ ЛИНИЯ крем дневной Лёгкий Увлажняющий для нормальной и комбинированной кожи 40 мл"
"DOVE лосьон для тела Сияние лета 250 мл;БАРХАТНЫЕ РУЧКИ крем для рук Смягчающий 80 мл";"GARNIER Ambre Solaire молочко солнцезащитное SPF 30 200 мл;DOVE крем-гель для умывания Ухаживающий 120 мл;LOREAL крем Увлажнение Эксперт вокруг глаз 50 мл";530296;"CRACARE маска-сыворотка для лица с Коллагеном Лифтинг Эффект"
"DOVE лосьон для тела Сияние лета 250 мл;LOREAL крем Возраст Эксперт 45+ вокруг глаз 50 мл";"ЧИСТАЯ ЛИНИЯ лосьон-тоник Василек для нормальной и комбинированной кожи 100 мл;МАЛЕНЬКАЯ ФЕЯ крем для рук Happy Moments Детский 25 мл;ЧЕРНЫЙ ЖЕМЧУГ скраб для тела Идеальнаяя Кожа 200 мл";530330;"LET ME SKIN маска альгинатная Ultra H2O увлажняющая 50+5 г"
"DOVE лосьон для тела Сияние лета 250 мл;LOREAL крем Увлажнение Эксперт вокруг глаз 50 мл";"ЧИСТАЯ ЛИНИЯ лосьон-тоник Лепестки роз для сухой и чувствительной кожи 100 мл;GARNIER крем для кожи вокруг глаз Антивозрастной Уход активный лифтинг 45+ 15мл";530338;"LOREAL Крем-масло Роскошь Питания 50 мл"
"DOVE молочко для тела Увлажнение и Питание 250 мл;ELIZAVECCA маска для лица Anti Aging EGF Aqua 25 мл";"LOREAL аква-флюид Гений Увлажнения для сухой кожи 70 мл;АВАНТА крем для рук Белоручка Смягчающий 75мл;LOREAL cредство для снятия макияжа для чувствительных глаз 125 мл";530258;"LOREAL крем Роскошь Питания вокруг глаз 15 мл"
"DOVE мусс для умывания Ухаживающий 160 мл";"LOREAL крем Revitalift Вокруг глаз 50 мл;СОЛНЦЕ И ЛУНА влажные салфетки детские с экстрактом алоэ 63 шт;ORGANIC SHOP крем для рук Organic Kitchen питательный акуна банана 100 мл";530076;"LOREAL крем дневной Возраст Эксперт 65+ 50 мл"
"EVO крем для ног с мочевиной;GARNIER крем для рук Интенсивный уход для очень сухой кожи 100 мл";"БАРХАТНЫЕ РУЧКИ крем для рук Защитный 80 мл;LOREAL крем Роскошь Питания вокруг глаз 15 мл";530061;"DOVE крем для лица и тела Питательный 75 мл"
"FARMSTAY эмульсия увлажняющая Snail Muscus Moisture с экстрактом улитки 150 мл;БАРХАТНЫЕ РУЧКИ крем для рук Энергия Асаи ночной 45 мл";"PIGEON влажные салфетки для детей (0+ мес) 70 шт;ЧЕРНЫЙ ЖЕМЧУГ крем-сыворотка для век Программа от 56 лет 17 мл;GARNIER Крем для загара Ambre Solaire Малыш в Тени SPF 50+ 50 мл";530123;"ВЕСНА крем для лица Тыквенный питательный 40 мл"
"FARMSTAY эмульсия увлажняющая Snail Muscus Moisture с экстрактом улитки 150 мл;МОЕ СОЛНЫШКО крем детский солнцезащитный SPF 20 75 мл";"AURA влажные салфетки антибактериальные Лимон 15 шт;БАРХАТНЫЕ РУЧКИ крем для рук Основной Уход 45 мл;ЧЕРНЫЙ ЖЕМЧУГ крем-гель для умывания Очищение и Уход для сухой и чувствительной кожи 120 мл";530021;"ЧЕРНЫЙ ЖЕМЧУГ дневной крем BiO-программа для нормальной и комбинированной кожи 50 мл"
"GARNIER драгоценное масло красоты 150 мл;ЧИСТАЯ ЛИНИЯ молочко для тела Упругость Черная смородина и Черемуха 250 мл";"DOVE крем-гель для умывания Увлажняющий 120 мл;GARNIER маска для лица тканевая Увлажнение + Аква Бомба 32 г";530257;"LOREAL крем Revitalift Вокруг глаз 50 мл"
"GARNIER драгоценное масло красоты 150 мл;LOREAL крем Возраст Эксперт 35+ дневной 50 мл";"БАРХАТНЫЕ РУЧКИ крем-масло для рук SOS-восстановление ночной уход 45 мл;GARNIER гель-пенка для умывания Основной уход 200 мл;ЧЕРНЫЙ ЖЕМЧУГ крем-сыворотка для век Программа от 56 лет 17 мл";530340;"LOREAL маска для лица Магия Глины Очищение и Матирование 6 мл"
"GARNIER Крем для загара Ambre Solaire Малыш в Тени SPF 50+ 50 мл;СОЛНЦЕ И ЛУНА влажные салфетки Нежное Прикосновение для детей 15 шт";"АВАНТА крем для рук Белоручка Летний шелк 80 мл;DOVE крем-гель для умывания Ухаживающий 120 мл;GARNIER крем для кожи вокруг глаз Антивозрастной Уход защита от морщин 35+ 15 мл";530065;"GARNIER крем для лица Антивозрастной Уход активный лифтинг 45+ дневной 50 мл"
"GARNIER Крем для загара Ambre Solaire Малыш в Тени SPF 50+ 50 мл;LOREAL крем Увлажнение Эксперт вокруг глаз 50 мл";"DOVE крем-гель для умывания Матирующий 120 мл;БАРХАТНЫЕ РУЧКИ крем для рук Тайна Цветов Моринги 30 мл;AURA влажные салфетки антибактериальные Лимон 15 шт";530057;"DIADEMINE крем для лица LIFT+ Разглаживание морщин дневной 50 мл"
"GARNIER Крем для загара Ambre Solaire Малыш в Тени SPF 50+ 50 мл;RAINBOW BEAUTY крем для рук Sense of Care с маслом Ши и Экстрактом Лаванды 35 г";"LOREAL для кожи вокруг глаз Revitalift Филлер [ha] против морщин 15 мл;PAMPERS влажные салфетки Sensitive 4x56 шт;DOVE мицеллярная вода Ухаживающая 240 мл";560164;"ЛАБОРАТОРИЯ ПРИРОДЫ крем для лица Облепиховый 75 мл"
"GARNIER крем для кожи вокруг глаз Антивозрастной Уход активный лифтинг 45+ 15мл;BARNANGEN бальзам для тела All Over Rescue 200 мл";"БАРХАТНЫЕ РУЧКИ крем для рук Тайна Цветов Моринги 30 мл;DOVE крем для лица и тела Питательный 75 мл;DIADEMINE лосьон для снятия макияжа с глаз Базовое очищение Уход за ресницами 125 мл";530331;"LINDSAY альгинатная маска All-in One Purifying Charcoal с углем 26 г"
"GARNIER крем для кожи вокруг глаз Антивозрастной Уход активный лифтинг 45+ 15мл;DOVE лосьон для тела Сияние лета 250 мл";"LOREAL крем дневной Возраст Эксперт 55+ 50 мл;БАРХАТНЫЕ РУЧКИ крем для рук Ночной Восстанавливающий 80 мл";530360;"THE SKIN HOUSE средство для разглаживания глубоких морщин Wrinkle Collagen Free Spot 30 мл"
"GARNIER крем для кожи вокруг глаз Антивозрастной Уход защита от морщин 35+ 15 мл";"KLEENEX влажные салфетки Дисней 40 шт;БАРХАТНЫЕ РУЧКИ для рук крем Увлажняющий 80 мл;DOVE мусс для умывания Увлажняющий 160 мл";530078;"LOREAL крем ночной Возраст Эксперт 65+ 50 мл"
"GARNIER крем для кожи вокруг глаз Антивозрастной Уход защита от морщин 35+ 15 мл;DOVE крем-гель для умывания Матирующий 120 мл";"МОЕ СОЛНЫШКО крем детский солнцезащитный SPF 20 75 мл;PAMPERS влажные салфетки Sensitive 2x56 шт;AURA крем для рук и ногтей Beauty Комплексный с витаминами и экстрактом лаванды 75 мл";530051;"ЧИСТАЯ ЛИНИЯ Ночной крем для лица Импульс Молодости от 45 лет 50 мл"
"GARNIER крем для рук Интенсивный уход для очень сухой кожи 100 мл;ЧЕРНЫЙ ЖЕМЧУГ крем-гель для умывания Очищение и Уход для сухой и чувствительной кожи 120 мл";"GARNIER Крем для загара Ambre Solaire Малыш в Тени SPF 50+ 50 мл;СОЛНЦЕ И ЛУНА влажные салфетки Для Детей с экстрактом алоэ 63 шт;ЧИСТАЯ ЛИНИЯ лосьон-тоник Василек для нормальной и комбинированной кожи 100 мл";530045;"ЧИСТАЯ ЛИНИЯ Фито-крем для лица Ночной Вербена и Первоцвет от 35 лет 45 мл"
"GARNIER мицеллярная вода Skin Naturals 400 мл;ORGANIC SHOP бальзам для губ Organic Kitchen конфета ириска 15 мл";"ЧИСТАЯ ЛИНИЯ скраб-маска для лица Фитобаня Обновляющий 75 мл;DOVE крем для лица и тела Питательный 75 мл;Я САМАЯ влажные салфетки для интимной гигиены Ромашка 15 шт";530205;"ЧИСТАЯ ЛИНИЯ пенка для умывания На отваре целебных трав для любой кожи 100 мл"
"GARNIER молочко для тела Овсяное Успокаивающее 250 мл;БАРХАТНЫЕ РУЧКИ крем для рук Гармония Арганы 80 мл";"CHAMOS средство для умывания Acaci Special с Экстрактом Лимона 20 мл;ЧЕРНЫЙ ЖЕМЧУГ крем-сыворотка для век Программа от 56 лет 17 мл;LOREAL маска для лица Магия Глины Очищение и Матирование с эвкалиптом 50 мл";530334;"LOREAL аква-флюид Гений Увлажнения для чувствительной кожи 70 мл"
"GARNIER молочко для тела Овсяное Успокаивающее 250 мл;GARNIER гель-пенка для умывания Основной уход 200 мл";"ROYAL SKIN крем для рук Water Drop с Экстрактом Лотоса 60 мл;BARNANGEN лосьон для тела Sensitive 400 мл;LOREAL для кожи вокруг глаз Revitalift Филлер [ha] против морщин 15 мл";530320;"GARNIER маска для лица тканевая Увлажнение + Аква Бомба 32 г"
"GARNIER молочко для тела Овсяное Успокаивающее 250 мл;LOREAL для кожи вокруг глаз Revitalift Филлер [ha] против морщин 15 мл";"БАРХАТНЫЕ РУЧКИ крем для рук Гипоаллергенный 80 мл;GARNIER тоник для лица Чистая Кожа для комбинированной и жирной кожи 200 мл;ЧИСТАЯ ЛИНИЯ молочко Мицеллярное для сухой и чувствительной кожи 100 мл";530344;"LOREAL маска для лица Возраст Эксперт 55+ 50 мл"
"GARNIER молочко для тела с маслом Манго 250 мл;ЧЕРНЫЙ ЖЕМЧУГ крем для лица Крем-Эксперт 26+ 50 мл";"ЧЕРНЫЙ ЖЕМЧУГ тоник-комфорт Освежающий для нормальной и комбинированной кожи 200 мл;NATURA SIBERICA крем для рук Natura Kamchatka омолаживающий даурский бархат гладкость и упругость кожи 75 мл;LET ME SKIN маска альгинатная Ultra H2O увлажняющая 50+5 г";530244;"ЧЕРНЫЙ ЖЕМЧУГ крем-гель для умывания Очищение и Уход для сухой и чувствительной кожи 120 мл"
"GARNIER молочко солнцезащитное детское Ambre Solaire SPF 30 200 мл;ЧИСТАЯ ЛИНИЯ лосьон-тоник Лепестки роз для сухой и чувствительной кожи 100 мл";"БАРХАТНЫЕ РУЧКИ крем для рук Смягчающий 80 мл;JOHNSON'S Baby влажные салфетки детские Pure Protect 25 шт;LOREAL крем Роскошь Питания вокруг глаз 15 мл";530024;"ЧЕРНЫЙ ЖЕМЧУГ дневной крем Самоомоложение Программа от 36 лет 50 мл"
"GARNIER солнцезащитный спрей Ambre Solaire солнечная вода прозрачный SPF 30 150 мл;HUGGIES влажные салфетки Ultra Comfort алоэ 128 шт";"АВАНТА крем для рук Дачница 75 мл;DOVE мусс для умывания Увлажняющий 160 мл;GARNIER крем для кожи вокруг глаз Антивозрастной Уход активный лифтинг 45+ 15мл";560165;"ЧЕРНЫЙ ЖЕМЧУГ ночной крем Самоомоложение Программа от 36 лет 50 мл"
"GARNIER солнцезащитный спрей Ambre Solaire солнечная вода прозрачный SPF 30 150 мл;LOREAL cредство для снятия макияжа с глаз и губ 125 мл";"ЧЕРНЫЙ ЖЕМЧУГ крем для кожи вокруг глаз Крем-Эксперт 46+ 15 мл;БАРХАТНЫЕ РУЧКИ для рук крем Увлажняющий 80 мл;MANUOKI влажые салфетки для детей 80 шт";530088;"LOREAL крем Увлажнение Эксперт для сухой и чувствительной кожи 50 мл"
"GARNIER тоник для лица Основной Уход для нормальной и смешанной кожи 200 мл;МОЕ СОЛНЫШКО крем детский солнцезащитный SPF 50 55 мл";"PAMPERS влажные салфетки Baby Fresh Clean 2х64 шт;GARNIER крем для кожи вокруг глаз Антивозрастной Уход активный лифтинг 45+ 15мл;БАРХАТНЫЕ РУЧКИ крем для рук Регенерирующий 80 мл";530072;"LOREAL антивозрастная сыворотка Ревиталифт Филлер [ha] против морщин для лица 16 мл"
"GARNIER тоник для лица Чистая Кожа для комбинированной и жирной кожи 200 мл;FAMILIA туалетная бумага белая Радуга двухслойная 4 шт";"AURA влажные салфетки антибактериальные Лимон 15 шт;ЧИСТАЯ ЛИНИЯ гель для умывания на отваре трав с алое для жирной и комбинированной кожи 100 мл;GARNIER крем для кожи вокруг глаз Антивозрастной Уход защита от морщин 35+ 15 мл";530150;"LOREAL скраб для лица Бесконечная Свежесть для нормальной и смешанной кожи 150 мл"
"GARNIER Ambre Solaire крем после загара Эксперт Защита освежающий 200 мл;LOREAL крем Возраст Эксперт 45+ вокруг глаз 50 мл";"THE SKIN HOUSE очищающее гидрофильное масло Essential Cleansing Oil 150 мл;АВАНТА крем для рук и ногтей Белоручка Крепкие ногти 80 мл;PAMPERS влажные салфетки Baby Fresh Clean 64 шт";530068;"GARNIER крем для лица Антивозрастной Уход защита от морщин 35+ дневной 50 мл"
"GARNIER Ambre Solaire молочко солнцезащитное SPF 30 200 мл;АВАНТА крем для рук Дачница защитный 75 мл";"СОЛНЦЕ И ЛУНА влажные салфетки Для Детей с экстрактом алоэ 15 шт;ЧЕРНЫЙ ЖЕМЧУГ крем для кожи вокруг глаз Крем-Эксперт 46+ 15 мл;LOREAL гель для лица Бесконечная Свежесть для нормальной и смешанной кожи 150 мл";530027;"ЧЕРНЫЙ ЖЕМЧУГ крем для лица Крем-Эксперт 26+ 50 мл"
"GARNIER Ambre Solaire молочко солнцезащитное SPF 30 200 мл;AURA влажные салфетки освежающие для всей семьи 63 шт";"БАРХАТНЫЕ РУЧКИ крем для рук Питательный 80 мл;ЧИСТАЯ ЛИНИЯ молочко Мицеллярное для сухой и чувствительной кожи 100 мл;LOREAL для кожи вокруг глаз Revitalift Филлер [ha] против морщин 15 мл";530092;"LOREAL крем Возраст Эксперт 45+ дневной 50 мл"
"GARNIER Ambre Solaire молочко солнцезащитное SPF 30 200 мл;LOREAL для кожи вокруг глаз Revitalift Филлер [ha] против морщин 15 мл";"ЧИСТАЯ ЛИНИЯ пенка для умывания На отваре целебных трав для любой кожи 100 мл;ELIZAVECCA крем для рук с маслом ши YeonYe HyuokMyung 80 мл;AURA влажные салфетки освежающие для всей семьи 63 шт";530022;"ЧЕРНЫЙ ЖЕМЧУГ дневной крем BiO-программа для сухой и чувствительной кожи 50 мл"
"GARNIER Ambre Solaire солнцезащитный спрей для тела Солнечная вода SPF 20 150 мл;PAMPERS влажные салфетки Baby Fresh Clean 4x64";"LOREAL cредство для снятия макияжа с глаз и губ 125 мл;БАРХАТНЫЕ РУЧКИ крем для рук Основной Уход 45 мл";530037;"ЧИСТАЯ ЛИНИЯ для лица Дневной Фито-крем от 55 лет шлемник и морошка 45 мл"
"GARNIER cпрей Ambre Solaire Идеальный загар SPF 30 200 мл;ЧИСТАЯ ЛИНИЯ лосьон-тоник Лепестки роз для сухой и чувствительной кожи 100 мл";"ЧЕРНЫЙ ЖЕМЧУГ крем-гель для умывания Очищение и Уход для сухой и чувствительной кожи 120 мл;Я САМАЯ влажные салфетки для интимной гигиены Organic 15 шт;АВАНТА крем для рук и ногтей Белоручка питательный 75 мл";530016;"CHAMOS крем для лица Hinijini Восстанавливающий с Экстрактом Молока и витамина С 12 мл"
"GARNIER cпрей Ambre Solaire Идеальный загар SPF 30 200 мл;GARNIER молочко для тела Овсяное Успокаивающее 250 мл";"ЧИСТАЯ ЛИНИЯ мицеллярная вода 3в1 для нормальной и комбинированной кожи 400 мл;БАРХАТНЫЕ РУЧКИ крем для рук Регенерирующий 80 мл;LOREAL для кожи вокруг глаз Revitalift Филлер [ha] против морщин 15 мл";530359;"THE SKIN HOUSE сыворотка Wrinkle System с коллагеном 50 мл"
"HUGGIES влажные салфетки Classic 128 шт;AURA влажные салфетки Family 10 шт";"ZEWA туалетная бумага Deluxe ромашка 3 слоя 12 шт;ЧИСТАЯ ЛИНИЯ скраб для лица Очищающий 50 мл";530200;"ЧИСТАЯ ЛИНИЯ мицеллярная вода 3в1 для нормальной и комбинированной кожи 400 мл"
"HUGGIES влажные салфетки Classic 64 шт;ЧИСТАЯ ЛИНИЯ молочко Мицеллярное для сухой и чувствительной кожи 100 мл";"ЧИСТАЯ ЛИНИЯ пенка для умывания На отваре целебных трав для любой кожи 100 мл;GARNIER гель-пенка для умывания Основной уход 200 мл;ЧИСТАЯ ЛИНИЯ гель для умывания Идеальная Кожа для нормальной и комбинированной кожи160 мл";530144;"CETTUA мини-пластыри для проблемной кожи 36 шт"
"HUGGIES влажные салфетки Classic 64 шт;ЧИСТАЯ ЛИНИЯ скраб для лица Мягкий малина и косточки клюквы50 мл";"CHAMOS маска для лица Acaci Антивозрастная с Улиточным Экстрактом;PLUSHE бумажные полотенца Light 2 слоя белые 2 шт;ORGANIC SHOP бальзам для губ Organic Kitchen конфета ириска 15 мл";530191;"ЧИСТАЯ ЛИНИЯ гель для умывания на отваре трав с алое для жирной и комбинированной кожи 100 мл"
