"Рекомендуемые товары";"Сопутствующие товары";"Артикул";"Короткое название"
"NIVEA молочко для тела Ванильный Десерт 200 мл;ЧИСТАЯ ЛИНИЯ крем для рук Интенсивное Увлажнение 75 мл";"GARNIER крем для кожи вокруг глаз Антивозрастной Уход защита от морщин 35+ 15 мл;ORGANIC SHOP крем для рук Organic Kitchen питательный акуна банана 100 мл;THE SKIN HOUSE очищающее гидрофильное масло Essential Cleansing Oil 150 мл";530326;"INOFACE альгинатная маска Red Ginseng Modeling Mask 200 г"
"NIVEA молочко для тела Ванильный Десерт 200 мл;GARNIER гель для умывания Чистая кожа Очищающий против чёрных точек 200 мл";"АВАНТА крем для рук Дачница 75 мл;ЧЕРНЫЙ ЖЕМЧУГ крем-гель для умывания Очищение и Уход для сухой и чувствительной кожи 120 мл;ORGANIC SHOP бальзам для губ Organic Kitchen конфета ириска 15 мл";530336;"LOREAL аква-флюид Гений Увлажнения для сухой кожи 70 мл"
"NIVEA черная пенка для умывания Make-up Expert для жирной кожи 100 мл;INOFACE альгинатная маска Red Ginseng Modeling Mask 200 г";"БАРХАТНЫЕ РУЧКИ крем для рук Интенсивный Молодость Кожи 80 мл;BARNANGEN лосьон для тела Caring 400 мл";530241;"ЧЕРНЫЙ ЖЕМЧУГ крем для кожи вокруг глаз Крем-Эксперт 46+ 15 мл"
"NIVEA черная пенка для умывания Make-up Expert для жирной кожи 100 мл;LOREAL Крем-масло Роскошь Питания 50 мл";"DOVE крем для лица и тела Питательный 150 мл;АВАНТА крем для рук и ногтей Белоручка питательный 75 мл;ЧЕРНЫЙ ЖЕМЧУГ скраб для тела Идеальнаяя Кожа 200 мл";530260;"LOREAL крем Возраст Эксперт 45+ вокруг глаз 50 мл"
"ORGANIC BEAUTY бальзам для рук и тела Питательный 500 мл;GARNIER Ambre Solaire крем после загара Эксперт Защита освежающий 200 мл";"BIORE мицеллярная вода 320 мл;LOREAL крем Revitalift Вокруг глаз 50 мл;MANUOKI влажые салфетки для детей 80 шт";530052;"ЧИСТАЯ ЛИНИЯ ночной крем для лица Нежный Питательный для нормальной и комбинированной кожи 40 мл"
"ORGANIC BEAUTY бальзам для рук и тела Питательный 500 мл;LURE крем для рук Питательный с маслом ши и D-пантенолом 90 мл";"ЧЕРНЫЙ ЖЕМЧУГ пенка-мусс для умывания Очищение и Уход ждя нормальной и комбинированной кожи 150 мл;ЧЕРНЫЙ ЖЕМЧУГ крем-сыворотка для век Программа от 56 лет 17 мл;DIADEMINE крем для лица LIFT+ Разглаживание морщин дневной 50 мл";560174;"LOREAL маска для лица Магия Глины Детокс и сияние с углем 50 мл"
"ORGANIC SHOP гоммаж для лица утренний кофе 75 мл;AURA влажные салфетки антибактериальные 72 шт";"LOREAL масло для лица Роскошь питания 30 мл;ЧИСТАЯ ЛИНИЯ крем для лица Комплексный Сила 5 Трав Байкал 45 мл;ЧИСТАЯ ЛИНИЯ Фито-крем для лица Ночной Шлемник и Морошка от 55 лет 45 мл";530213;"DOVE мусс для умывания Ухаживающий 160 мл"
"ORGANIC SHOP гоммаж для лица утренний кофе 75 мл;ZEWA бумажные полотенца 2 шт";"AURA влажные салфетки Tropic Cocktail освежающие 15 шт;LIBERO влажные салфетки Baby Care 2x64 шт;ЧИСТАЯ ЛИНИЯ антивозрастной крем-лифтинг для век Сила 5 Трав 25 мл";530186;"ЧЕРНЫЙ ЖЕМЧУГ тоник-комфорт Освежающий для нормальной и комбинированной кожи 200 мл"
"ORGANIC SHOP крем для рук Organic Kitchen питательный акуна банана 100 мл;DOVE лосьон для тела Кокосовое масло и Миндальное молочко Восстанавливающий 250 мл";"GARNIER мицеллярная вода с маслами Skin Naturals 400 мл;ЧЕРНЫЙ ЖЕМЧУГ крем-сыворотка для век Программа от 56 лет 17 мл;ЧИСТАЯ ЛИНИЯ гель для умывания на отваре целебных трав для нормальной и комбинированной кожи 160 мл";530322;"GARNIER тканевая маска Увлажнение + Комфорт для сухой и чувствительной кожи 32 г"
"ORGANIC SHOP крем для рук Organic Kitchen питательный акуна банана 100 мл;GARNIER cпрей Ambre Solaire Идеальный загар SPF 30 200 мл";"ЧЕРНЫЙ ЖЕМЧУГ крем-сыворотка для век Программа от 56 лет 17 мл;PIGEON влажные салфетки для детей (0+ мес) 70 шт;ЧЕРНЫЙ ЖЕМЧУГ пенка-мусс для умывания Очищение и Уход ждя нормальной и комбинированной кожи 150 мл";530089;"LOREAL крем Увлажнение эксперт ночной 50 мл"
"ORGANIC SHOP скраб для лица очищающий имбирная сакура 75 мл;LOREAL крем Увлажнение Эксперт вокруг глаз 50 мл";"СОЛНЦЕ И ЛУНА влажные салфетки Для Детей с экстрактом алоэ 63 шт;MAYBELLINE бальзам для губ Baby Lips Dr.Rescue восстанавливающий и увлажняющий нежный ментол 1,78 мл";530190;"ЧИСТАЯ ЛИНИЯ гель для умывания на отваре целебных трав для нормальной и комбинированной кожи 160 мл"
"PAMPERS влажные салфетки Baby Fresh Clean 2х64 шт";"МОЕ СОЛНЫШКО крем детский солнцезащитный SPF 30 55 мл;GARNIER крем для кожи вокруг глаз Антивозрастной Уход активный лифтинг 45+ 15мл;LOREAL cредство для снятия макияжа с глаз и губ 125 мл";530069;"GARNIER крем для лица Антивозрастной Уход защита от морщин 35+ ночной 50 мл"
"PAMPERS влажные салфетки Baby Fresh Clean 2х64 шт;DIADEMINE лосьон для снятия макияжа с глаз Бережное очищение 125 мл";"GARNIER Ambre Solaire молочко солнцезащитное SPF 30 200 мл;БАРХАТНЫЕ РУЧКИ крем для рук Тайна Цветов Моринги 30 мл;LOREAL крем Возраст Эксперт 45+ вокруг глаз 50 мл";560163;"ЛАБОРАТОРИЯ ПРИРОДЫ крем для лица Женьшеневый питательный 75 мл"
"PAMPERS влажные салфетки Baby Fresh Clean 2х64 шт;GARNIER крем для лица Интенсивное омоложение 55+ ночной 50 мл";"LOREAL скраб Pure Zone Глубокое очищение 7 в 1;LOVULAR влажные фито-салфетки для груди, сосок, пустышек 40 шт";530181;"CHAMOS средство для умывания Acaci Special с Экстрактом Лимона 20 мл"
"PAMPERS влажные салфетки Baby Fresh Clean 64 шт;NIVEA черная пенка для умывания Make-up Expert для жирной кожи 100 мл";"THE SKIN HOUSE очищающее гидрофильное масло Essential Cleansing Oil 150 мл;LOREAL мицелярная вода Skin Expert для нормальной и смешанной кожи 400 мл;CHAMOS маска для лица Acaci Антивозрастная с Улиточным Экстрактом";530154;"LOREAL скраб Pure Zone Глубокое очищение 7 в 1"
"PAMPERS влажные салфетки Sensitive 2x56 шт;GARNIER молочко солнцезащитное детское Ambre Solaire SPF 30 200 мл";"LOREAL крем Возраст Эксперт 55+ вокруг глаз 50 мл;БАРХАТНЫЕ РУЧКИ крем-масло для рук SOS-восстановление ночной уход 45 мл;GARNIER гель-пенка для умывания Основной уход 200 мл";530032;"ЧЕРНЫЙ ЖЕМЧУГ ночной крем Самоомоложение Программа от 26 лет 50 мл"
"PAMPERS влажные салфетки Sensitive 4x56 шт;СОЛНЦЕ И ЛУНА влажные салфетки Нежное Прикосновение для детей 54 шт";"AURA влажные салфетки Tropic Cocktail антибактериальные в ассортименте 15 шт;AURA влажные салфетки антибактериальные 72 шт;ЧИСТАЯ ЛИНИЯ скраб для лица Мягкий малина и косточки клюквы50 мл";570232;"GARNIER молочко для снятия макияжа Основной Уход  Экстракт Винограда для нормальной и смешанной кожи 200 мл"
"PAMPERS влажные салфетки Sensitive 4x56 шт;ЧИСТАЯ ЛИНИЯ мицеллярная вода 3в1 для нормальной и комбинированной кожи 400 мл";"LOREAL крем-гель Увлажнение Эксперт для нормальной и смешанной кожи 50 мл;ZEWA носовые платки Softis Алоэ 9х10 шт;HUGGIES влажные салфетки Elite Soft 128 шт";530160;"ORGANIC SHOP гоммаж для лица утренний кофе 75 мл"
"PAMPERS влажные салфетки Sensitive 4x56 шт;BIORE мицеллярная вода 320 мл";"AURA влажные салфетки Family 10 шт;ЧИСТАЯ ЛИНИЯ гель для умывания на отваре трав с алое для жирной и комбинированной кожи 100 мл;LOREAL блеск для губ Infaillible 101 Верх совершенства";530164;"ЧИСТАЯ ЛИНИЯ бальзам для губ 3 в 1 Питание, Увлажнение и Смягчение 4 г"
"PAPIA туалетная бумага Professional 3 слоя 8 шт;BELLAGIO салфетки для лица Monalisa двухслойные 200 шт";"Я САМАЯ влажные салфетки освежающие для всей семьи 63 шт;LOREAL антивозрастная сыворотка Ревиталифт Филлер [ha] против морщин для лица 16 мл;ORGANIC SHOP гоммаж для лица утренний кофе 75 мл";570167;"DIADEMINE мицеллярная вода Основная программа 200 мл"
"PIGEON влажные салфетки для детей (0+ мес) 70 шт;GARNIER солнцезащитный спрей Ambre Solaire солнечная вода прозрачный SPF 30 150 мл";"ЧЕРНЫЙ ЖЕМЧУГ крем для кожи вокруг глаз Крем-Эксперт 46+ 15 мл;ЧИСТАЯ ЛИНИЯ лосьон-тоник Календула для жирной кожи 100 мл;АВАНТА крем для рук Белоручка зимний бархат 75 мл";530017;"ЧЕРНЫЙ ЖЕМЧУГ BB-крем Самоомоложение 56+ Омолаживающий 45 мл"
"PIGEON влажные салфетки для детей (0+ мес) 70 шт;LOREAL для кожи вокруг глаз Revitalift Филлер [ha] против морщин 15 мл";"ЧИСТАЯ ЛИНИЯ гель для умывания Идеальная Кожа 100 мл;GARNIER молочко солнцезащитное детское Ambre Solaire SPF 30 200 мл;ROYAL SKIN крем для рук Water Drop с Экстрактом Гардении 60 мл";530084;"LOREAL крем Revitalift ночной 50 мл"
"PIGEON влажные салфетки для детей (0+ мес) 70 шт;LOREAL скраб для лица Бесконечная Свежесть для нормальной и смешанной кожи 150 мл";"ZEWA Влажная туалетная бумага детская 42 шт;HUGGIES влажные салфетки Elite Soft 64 шт;СОЛНЦЕ И ЛУНА влажные салфетки для детей Фитолиния с отваром череды и облепихи с крышкой 56 шт";570164;"DIADEMINE спрей для лица Основная программа 3в1 Очищающий 200 мл"
"RAINBOW BEAUTY крем для рук Sense of Care с маслом Ши и Экстрактом Лаванды 35 г";"DOVE лосьон для тела Кокосовое масло и Миндальное молочко Восстанавливающий 250 мл;ЧЕРНЫЙ ЖЕМЧУГ тоник-комфорт Освежающий для нормальной и комбинированной кожи 200 мл";530328;"LET ME SKIN маска альгинатная Ultra H2O для сияния кожи 50+5 г"
"RAINBOW BEAUTY крем для рук Sense of Care с маслом Ши и Экстрактом Сакуры 35 г;Я САМАЯ влажные салфетки для снятия макияжа 15 шт";"GARNIER гель-пенка для умывания Основной уход 200 мл;ЧЕРНЫЙ ЖЕМЧУГ крем-сыворотка для век Программа от 56 лет 17 мл;GARNIER Крем для загара Ambre Solaire Малыш в Тени SPF 50+ 50 мл";530066;"GARNIER крем для лица Антивозрастной Уход активный лифтинг 45+ ночной 50 мл"
"THE SKIN HOUSE очищающее гидрофильное масло Essential Cleansing Oil 150 мл;AURA влажные салфетки антибактериальные 72 шт";"GARNIER молочко солнцезащитное детское Ambre Solaire SPF 30 200 мл;ЧЕРНЫЙ ЖЕМЧУГ крем для кожи вокруг глаз Крем-Эксперт 46+ 15 мл;БАРХАТНЫЕ РУЧКИ крем-лосьон для рук и ногтей Прикосновение Нежности Питательный 160 мл";530028;"ЧЕРНЫЙ ЖЕМЧУГ крем для лица Крем-Эксперт 36+ 50 мл"
"THE SKIN HOUSE сыворотка Wrinkle System с коллагеном 50 мл;LOREAL крем-маска для лица Роскошь Питания Экстраординарное Масло 50 мл";"ЧИСТАЯ ЛИНИЯ скраб для лица Очищающий 50 мл;PAMPERS влажные салфетки Sensitive 12 шт;KLEENEX влажные салфетки Дисней 40 шт";530228;"LOREAL cредство для снятия макияжа с глаз и губ 125 мл"
"ZEWA бумажные полотенца 2-в-1 1 шт";"FARMSTAY эмульсия увлажняющая Snail Muscus Moisture с экстрактом улитки 150 мл;HUGGIES влажные салфетки Elite Soft 128 шт;LOREAL уход-скульптор Возраст Эксперт 45+ для лица, шеи и зоны декольте 50 мл";530146;"ЧИСТАЯ ЛИНИЯ скраб для лица Мягкий малина и косточки клюквы50 мл"
"ZEWA туалетная бумага Kids детская 3 слоя 4 шт;ЧИСТАЯ ЛИНИЯ скраб для лица Мягкий малина и косточки клюквы50 мл";"KLEENEX туалетная бумага Natural Care белая трехслойная 4 шт;LOREAL крем Увлажнение эксперт ночной 50 мл;HUGGIES влажные салфетки Ultra Comfort алоэ 64 шт";570165;"GARNIER гель для умывания Чистая кожа Очищающий против чёрных точек 200 мл"
"АВАНТА крем для рук Белоручка зимний бархат 75 мл";"LOREAL крем Возраст Эксперт 55+ вокруг глаз 50 мл;PAMPERS влажные салфетки Sensitive 12 шт;МОЕ СОЛНЫШКО крем детский солнцезащитный SPF 50 55 мл";530010;"LOREAL гель для умывания L'Oreal MenExpert Гидра Сенситив с березовым соком 150 мл"
"АВАНТА крем для рук Белоручка зимний бархат 75 мл;ЧЕРНЫЙ ЖЕМЧУГ крем для кожи вокруг глаз Крем-Эксперт 46+ 15 мл";"BARNANGEN лосьон для тела Nutritive 400 мл;BARNANGEN лосьон для тела Sensitive 400 мл;ЧИСТАЯ ЛИНИЯ мицеллярная вода 3в1 Цветочная 100 мл";530011;"LOREAL Men Expert крем для лица Виталифтинг 5 увлажняющий антивозрастной 50 мл"
"АВАНТА крем для рук Белоручка Летний шелк 80 мл;AURA влажные салфетки для детей Ultra Comfort с крышкой 200 шт";"GARNIER крем для кожи вокруг глаз Антивозрастной Уход активный лифтинг 45+ 15мл;DOVE крем-гель для умывания Ухаживающий 120 мл;GARNIER Ambre Solaire крем после загара Эксперт Защита освежающий 200 мл";530012;"LOREAL увлажняющий уход для лица Гидра Энергетик против признаков усталости 50 мл"
"АВАНТА крем для рук Белоручка увлажняющий 75 мл;LOREAL крем Возраст Эксперт 45+ вокруг глаз 50 мл";"ЧИСТАЯ ЛИНИЯ молочко для тела Двойное Увлажнение медуница и таволга 250 мл;LOREAL крем Revitalift для контура лица и шеи 50 мл;LOREAL cредство для снятия макияжа с глаз и губ 125 мл";530013;"NATURA SIBERICA крем для лица от морщин мужской медвежья сила 50 мл"
"АВАНТА крем для рук Белоручка увлажняющий 75 мл;NIVEA черная пенка для умывания Make-up Expert для жирной кожи 100 мл";"ЧИСТАЯ ЛИНИЯ Солнцезащитный спрей 20 SPF 160мл;GARNIER крем для кожи вокруг глаз Антивозрастной Уход защита от морщин 35+ 15 мл;Я САМАЯ влажные салфетки для интимной гигиены Ромашка 15 шт";530014;"THE SKIN HOUSE многофункциональное ухаживающее средство Homme Innofect All in One Soother для мужчин 130 мл"
"АВАНТА крем для рук Дачница 75 мл;LOREAL крем Возраст Эксперт 45+ вокруг глаз 50 мл";"ЧИСТАЯ ЛИНИЯ лосьон-тоник Василек для нормальной и комбинированной кожи 100 мл;GARNIER молочко для тела с маслом Манго 250 мл";530018;"ЧЕРНЫЙ ЖЕМЧУГ для лица Масляный Пилинг Драгоценные Масла деликатное очищение 80 мл"
"АВАНТА крем для рук Дачница 75 мл;LUKE маска для лица Green Tea Essence Mask с Экстрактом Зеленого Чая";"АВАНТА крем массажный Нега 75 мл;ЧЕРНЫЙ ЖЕМЧУГ крем для кожи вокруг глаз Крем-Эксперт 46+ 15 мл;LOREAL гель для лица Бесконечная Свежесть для нормальной и смешанной кожи 150 мл";530023;"ЧЕРНЫЙ ЖЕМЧУГ дневной крем Самоомоложение Программа от 26 лет 50 мл"
"АВАНТА крем для рук Силиконовый защитный 75 мл;DIADEMINE мицеллярная вода Основная программа 200 мл";"DOVE молочко для тела Увлажнение и Питание 250 мл;LUKE маска для лица Green Tea Essence Mask с Экстрактом Зеленого Чая";530025;"ЧЕРНЫЙ ЖЕМЧУГ дневной крем Самоомоложение Программа от 56 лет 50 мл"
"БАРХАТНЫЕ РУЧКИ крем для рук Гипоаллергенный 80 мл;GARNIER Ambre Solaire крем после загара Эксперт Защита освежающий 200 мл";"LOREAL крем Увлажнение Эксперт вокруг глаз 50 мл;ЧИСТАЯ ЛИНИЯ мицеллярная вода 3в1 Цветочная 100 мл;МОЕ СОЛНЫШКО влажные салфетки Универсальные 70 шт";530038;"ЧИСТАЯ ЛИНИЯ дневной фито-крем для лица От 60 лет таволга и калина 45 мл"
"БАРХАТНЫЕ РУЧКИ крем для рук Для Всей Семьи 200 мл;АВАНТА крем для рук Белоручка Смягчающий 75мл";"ЧИСТАЯ ЛИНИЯ антивозрастной крем-лифтинг для век Сила 5 Трав 25 мл;DERMANIKA крем для рук Омолаживающий 75 мл;ЛАБОРАТОРИЯ ПРИРОДЫ крем для ног Каштановый 100 мл";530048;"ЧИСТАЯ ЛИНИЯ крем для лица Умный 3 в 1 120 мл"
"БАРХАТНЫЕ РУЧКИ крем для рук Защитный 80 мл;DIADEMINE лосьон для снятия макияжа с глаз Бережное очищение 125 мл";"JOHNSON'S Baby влажные салфетки детские Pure Protect 25 шт;GARNIER молочко солнцезащитное детское Ambre Solaire SPF 30 200 мл";530056;"DIADEMINE крем для лица Комплексный Основная Программа Против Морщин День и Ночь 50 мл"
"БАРХАТНЫЕ РУЧКИ крем для рук Нежность Тиаре 80 мл;ЧИСТАЯ ЛИНИЯ мицеллярная вода 3в1 для нормальной и комбинированной кожи 400 мл";"BARNANGEN лосьон для тела Caring 400 мл;ЧЕРНЫЙ ЖЕМЧУГ крем для кожи вокруг глаз Крем-Эксперт 46+ 15 мл;АВАНТА крем для рук Белоручка Смягчающий 75мл";530058;"DIADEMINE крем для лица LIFT+ Разглаживание морщин ночной 50 мл"
"БАРХАТНЫЕ РУЧКИ крем для рук Ночной Восстанавливающий 80 мл;ЧЕРНЫЙ ЖЕМЧУГ ночной крем Самоомоложение Программа от 26 лет 50 мл";"LOREAL cредство для снятия макияжа с глаз и губ 125 мл;ЧЕРНЫЙ ЖЕМЧУГ крем-гель для умывания Очищение и Уход для сухой и чувствительной кожи 120 мл;DOVE лосьон для тела Масло Авокадо и экстракт календулы Пробуждающий 250 мл";530062;"EUNYUL крем для лица Multi-complex Horse Oil Cream 30 мл"
"БАРХАТНЫЕ РУЧКИ крем для рук Основной Уход 45 мл;GARNIER крем для кожи вокруг глаз Антивозрастной Уход защита от морщин 35+ 15 мл";"GARNIER молочко солнцезащитное детское Ambre Solaire SPF 30 200 мл;СОЛНЦЕ И ЛУНА влажные салфетки Для Новорожденных 54 шт;ЧИСТАЯ ЛИНИЯ лосьон-тоник Лепестки роз для сухой и чувствительной кожи 100 мл";530063;"FARMSTAY крем увлажняющий Snail Muscus Moisture с экстрактом улитки 50 мл"
"БАРХАТНЫЕ РУЧКИ крем для рук Питательный 80 мл;СОЛНЦЕ И ЛУНА влажные салфетки Для Детей с экстрактом алоэ 15 шт";"ЧИСТАЯ ЛИНИЯ молочко для снятия макияжа Для любой кожи 100 мл;МОЕ СОЛНЫШКО крем детский солнцезащитный SPF 20 75 мл;LOREAL для кожи вокруг глаз Revitalift Филлер [ha] против морщин 15 мл";530064;"FARMSTAY многофункциональный смягчающий гель Moisture Soothing Gel Snail с экстрактом улитки 300 мл"
